results/cuda_GATuner_mm.log
{"input": ["cuda -keys=cuda,gpu -arch=sm_75 -max_num_threads=1024 -thread_warp_size=32", "template_matmul", [900, 800, 700, [1, 16, 32, 48, 64, 80, 96, 112, 128], "cuda", "float32"], {}], "config": {"index": 1548, "code_hash": null, "entity": [["tile_i", "ot", 1], ["tile_j", "ot", 16], ["tile_k", "ot", 16], ["order", "ot", 2]]}, "result": [[0.045133743000000004, 0.045141582, 0.045493217], 0, 1.5171029567718506, 1684252518.768319], "version": 0.2, "tvm_version": "0.13.dev0"}
{"input": ["cuda -keys=cuda,gpu -arch=sm_75 -max_num_threads=1024 -thread_warp_size=32", "template_matmul", [900, 800, 700, [1, 16, 32, 48, 64, 80, 96, 112, 128], "cuda", "float32"], {}], "config": {"index": 3087, "code_hash": null, "entity": [["tile_i", "ot", 1], ["tile_j", "ot", 16], ["tile_k", "ot", 32], ["order", "ot", 4]]}, "result": [[0.114619949, 0.1146490855, 0.114932014], 0, 2.27970027923584, 1684252520.5134556], "version": 0.2, "tvm_version": "0.13.dev0"}
{"input": ["cuda -keys=cuda,gpu -arch=sm_75 -max_num_threads=1024 -thread_warp_size=32", "template_matmul", [900, 800, 700, [1, 16, 32, 48, 64, 80, 96, 112, 128], "cuda", "float32"], {}], "config": {"index": 2583, "code_hash": null, "entity": [["tile_i", "ot", 1], ["tile_j", "ot", 128], ["tile_k", "ot", 64], ["order", "ot", 3]]}, "result": [[0.12120972399999999, 0.1212241895, 0.12122828649999999], 0, 2.215221643447876, 1684252522.3300514], "version": 0.2, "tvm_version": "0.13.dev0"}
{"input": ["cuda -keys=cuda,gpu -arch=sm_75 -max_num_threads=1024 -thread_warp_size=32", "template_matmul", [900, 800, 700, [1, 16, 32, 48, 64, 80, 96, 112, 128], "cuda", "float32"], {}], "config": {"index": 1053, "code_hash": null, "entity": [["tile_i", "ot", 1], ["tile_j", "ot", 1], ["tile_k", "ot", 64], ["order", "ot", 1]]}, "result": [[0.1475962825, 0.1476096035, 0.14761369300000002], 0, 2.58678936958313, 1684252524.4473252], "version": 0.2, "tvm_version": "0.13.dev0"}
{"input": ["cuda -keys=cuda,gpu -arch=sm_75 -max_num_threads=1024 -thread_warp_size=32", "template_matmul", [900, 800, 700, [1, 16, 32, 48, 64, 80, 96, 112, 128], "cuda", "float32"], {}], "config": {"index": 549, "code_hash": null, "entity": [["tile_i", "ot", 1], ["tile_j", "ot", 112], ["tile_k", "ot", 96], ["order", "ot", 0]]}, "result": [[0.11868975799999999, 0.118695457, 0.1187133405], 0, 2.354846715927124, 1684252526.2561216], "version": 0.2, "tvm_version": "0.13.dev0"}
{"input": ["cuda -keys=cuda,gpu -arch=sm_75 -max_num_threads=1024 -thread_warp_size=32", "template_matmul", [900, 800, 700, [1, 16, 32, 48, 64, 80, 96, 112, 128], "cuda", "float32"], {}], "config": {"index": 1576, "code_hash": null, "entity": [["tile_i", "ot", 16], ["tile_j", "ot", 64], ["tile_k", "ot", 16], ["order", "ot", 2]]}, "result": [[0.0044257275, 0.004426752, 0.00442784], 0, 0.9265847206115723, 1684252526.7872264], "version": 0.2, "tvm_version": "0.13.dev0"}
{"input": ["cuda -keys=cuda,gpu -arch=sm_75 -max_num_threads=1024 -thread_warp_size=32", "template_matmul", [900, 800, 700, [1, 16, 32, 48, 64, 80, 96, 112, 128], "cuda", "float32"], {}], "config": {"index": 4150, "code_hash": null, "entity": [["tile_i", "ot", 16], ["tile_j", "ot", 32], ["tile_k", "ot", 96], ["order", "ot", 5]]}, "result": [[0.035614719, 0.0356552655, 0.0356839025], 0, 1.3765723705291748, 1684252527.671823], "version": 0.2, "tvm_version": "0.13.dev0"}
{"input": ["cuda -keys=cuda,gpu -arch=sm_75 -max_num_threads=1024 -thread_warp_size=32", "template_matmul", [900, 800, 700, [1, 16, 32, 48, 64, 80, 96, 112, 128], "cuda", "float32"], {}], "config": {"index": 84, "code_hash": null, "entity": [["tile_i", "ot", 48], ["tile_j", "ot", 1], ["tile_k", "ot", 16], ["order", "ot", 0]]}, "result": [[0.0108584955, 0.010879664, 0.01088], 0, 0.9522476196289062, 1684252528.776078], "version": 0.2, "tvm_version": "0.13.dev0"}
{"input": ["cuda -keys=cuda,gpu -arch=sm_75 -max_num_threads=1024 -thread_warp_size=32", "template_matmul", [900, 800, 700, [1, 16, 32, 48, 64, 80, 96, 112, 128], "cuda", "float32"], {}], "config": {"index": 1152, "code_hash": null, "entity": [["tile_i", "ot", 1], ["tile_j", "ot", 32], ["tile_k", "ot", 80], ["order", "ot", 1]]}, "result": [[0.1050470425, 0.10506913749999999, 0.105140205], 0, 1.9647419452667236, 1684252530.4210098], "version": 0.2, "tvm_version": "0.13.dev0"}
{"input": ["cuda -keys=cuda,gpu -arch=sm_75 -max_num_threads=1024 -thread_warp_size=32", "template_matmul", [900, 800, 700, [1, 16, 32, 48, 64, 80, 96, 112, 128], "cuda", "float32"], {}], "config": {"index": 4248, "code_hash": null, "entity": [["tile_i", "ot", 1], ["tile_j", "ot", 64], ["tile_k", "ot", 112], ["order", "ot", 5]]}, "result": [[0.151159805, 0.15117749, 0.15117790199999998], 0, 2.5141477584838867, 1684252532.5794494], "version": 0.2, "tvm_version": "0.13.dev0"}
{"input": ["cuda -keys=cuda,gpu -arch=sm_75 -max_num_threads=1024 -thread_warp_size=32", "template_matmul", [900, 800, 700, [1, 16, 32, 48, 64, 80, 96, 112, 128], "cuda", "float32"], {}], "config": {"index": 685, "code_hash": null, "entity": [["tile_i", "ot", 16], ["tile_j", "ot", 64], ["tile_k", "ot", 128], ["order", "ot", 0]]}, "result": [[0.0120606715, 0.012073984, 0.012107775500000001], 0, 0.9875521659851074, 1684252533.6906545], "version": 0.2, "tvm_version": "0.13.dev0"}
{"input": ["cuda -keys=cuda,gpu -arch=sm_75 -max_num_threads=1024 -thread_warp_size=32", "template_matmul", [900, 800, 700, [1, 16, 32, 48, 64, 80, 96, 112, 128], "cuda", "float32"], {}], "config": {"index": 174, "code_hash": null, "entity": [["tile_i", "ot", 48], ["tile_j", "ot", 16], ["tile_k", "ot", 32], ["order", "ot", 0]]}, "result": [[0.012746416, 0.0127478875, 0.012759791999999999], 0, 0.9960463047027588, 1684252534.3197963], "version": 0.2, "tvm_version": "0.13.dev0"}
{"input": ["cuda -keys=cuda,gpu -arch=sm_75 -max_num_threads=1024 -thread_warp_size=32", "template_matmul", [900, 800, 700, [1, 16, 32, 48, 64, 80, 96, 112, 128], "cuda", "float32"], {}], "config": {"index": 4296, "code_hash": null, "entity": [["tile_i", "ot", 48], ["tile_j", "ot", 1], ["tile_k", "ot", 128], ["order", "ot", 5]]}, "result": [[0.0373094405, 0.037341728000000005, 0.037364624], 0, 1.2356669902801514, 1684252535.2216053], "version": 0.2, "tvm_version": "0.13.dev0"}
{"input": ["cuda -keys=cuda,gpu -arch=sm_75 -max_num_threads=1024 -thread_warp_size=32", "template_matmul", [900, 800, 700, [1, 16, 32, 48, 64, 80, 96, 112, 128], "cuda", "float32"], {}], "config": {"index": 1737, "code_hash": null, "entity": [["tile_i", "ot", 1], ["tile_j", "ot", 64], ["tile_k", "ot", 48], ["order", "ot", 2]]}, "result": [[0.118925392, 0.11905126149999999, 0.119105293], 0, 2.148193120956421, 1684252537.0204363], "version": 0.2, "tvm_version": "0.13.dev0"}
{"input": ["cuda -keys=cuda,gpu -arch=sm_75 -max_num_threads=1024 -thread_warp_size=32", "template_matmul", [900, 800, 700, [1, 16, 32, 48, 64, 80, 96, 112, 128], "cuda", "float32"], {}], "config": {"index": 2281, "code_hash": null, "entity": [["tile_i", "ot", 64], ["tile_j", "ot", 16], ["tile_k", "ot", 16], ["order", "ot", 3]]}, "result": [[0.00317632, 0.0031765435, 0.003177952], 0, 0.9010639190673828, 1684252538.1177359], "version": 0.2, "tvm_version": "0.13.dev0"}
{"input": ["cuda -keys=cuda,gpu -arch=sm_75 -max_num_threads=1024 -thread_warp_size=32", "template_matmul", [900, 800, 700, [1, 16, 32, 48, 64, 80, 96, 112, 128], "cuda", "float32"], {}], "config": {"index": 1786, "code_hash": null, "entity": [["tile_i", "ot", 64], ["tile_j", "ot", 1], ["tile_k", "ot", 64], ["order", "ot", 2]]}, "result": [[0.0099015035, 0.0099047355, 0.010161312], 0, 1.0036873817443848, 1684252538.717007], "version": 0.2, "tvm_version": "0.13.dev0"}
{"input": ["cuda -keys=cuda,gpu -arch=sm_75 -max_num_threads=1024 -thread_warp_size=32", "template_matmul", [900, 800, 700, [1, 16, 32, 48, 64, 80, 96, 112, 128], "cuda", "float32"], {}], "config": {"index": 2848, "code_hash": null, "entity": [["tile_i", "ot", 64], ["tile_j", "ot", 16], ["tile_k", "ot", 128], ["order", "ot", 3]]}, "result": [[0.0111568, 0.0111568955, 0.0111595515], 0, 1.0439190864562988, 1684252539.3417323], "version": 0.2, "tvm_version": "0.13.dev0"}
{"input": ["cuda -keys=cuda,gpu -arch=sm_75 -max_num_threads=1024 -thread_warp_size=32", "template_matmul", [900, 800, 700, [1, 16, 32, 48, 64, 80, 96, 112, 128], "cuda", "float32"], {}], "config": {"index": 2351, "code_hash": null, "entity": [["tile_i", "ot", 32], ["tile_j", "ot", 1], ["tile_k", "ot", 32], ["order", "ot", 3]]}, "result": [[0.008399824, 0.008852351999999999, 0.009120016], 0, 0.9981532096862793, 1684252539.9380069], "version": 0.2, "tvm_version": "0.13.dev0"}
{"input": ["cuda -keys=cuda,gpu -arch=sm_75 -max_num_threads=1024 -thread_warp_size=32", "template_matmul", [900, 800, 700, [1, 16, 32, 48, 64, 80, 96, 112, 128], "cuda", "float32"], {}], "config": {"index": 816, "code_hash": null, "entity": [["tile_i", "ot", 96], ["tile_j", "ot", 1], ["tile_k", "ot", 16], ["order", "ot", 1]]}, "result": [[0.009996607499999999, 0.00999728, 0.010038496000000001], 0, 0.9662535190582275, 1684252540.5410876], "version": 0.2, "tvm_version": "0.13.dev0"}
{"input": ["cuda -keys=cuda,gpu -arch=sm_75 -max_num_threads=1024 -thread_warp_size=32", "template_matmul", [900, 800, 700, [1, 16, 32, 48, 64, 80, 96, 112, 128], "cuda", "float32"], {}], "config": {"index": 1332, "code_hash": null, "entity": [["tile_i", "ot", 1], ["tile_j", "ot", 64], ["tile_k", "ot", 112], ["order", "ot", 1]]}, "result": [[0.119092285, 0.1191178205, 0.119125038], 0, 2.210583448410034, 1684252542.3605816], "version": 0.2, "tvm_version": "0.13.dev0"}
{"input": ["cuda -keys=cuda,gpu -arch=sm_75 -max_num_threads=1024 -thread_warp_size=32", "template_matmul", [900, 800, 700, [1, 16, 32, 48, 64, 80, 96, 112, 128], "cuda", "float32"], {}], "config": {"index": 2394, "code_hash": null, "entity": [["tile_i", "ot", 1], ["tile_j", "ot", 80], ["tile_k", "ot", 32], ["order", "ot", 3]]}, "result": [[0.043533073, 0.0435448795, 0.043570224500000004], 0, 1.3119299411773682, 1684252543.8471713], "version": 0.2, "tvm_version": "0.13.dev0"}
{"input": ["cuda -keys=cuda,gpu -arch=sm_75 -max_num_threads=1024 -thread_warp_size=32", "template_matmul", [900, 800, 700, [1, 16, 32, 48, 64, 80, 96, 112, 128], "cuda", "float32"], {}], "config": {"index": 2929, "code_hash": null, "entity": [["tile_i", "ot", 64], ["tile_j", "ot", 16], ["tile_k", "ot", 1], ["order", "ot", 4]]}, "result": [[0.033804222, 0.033806831, 0.0338073615], 0, 1.2124669551849365, 1684252544.711087], "version": 0.2, "tvm_version": "0.13.dev0"}
{"input": ["cuda -keys=cuda,gpu -arch=sm_75 -max_num_threads=1024 -thread_warp_size=32", "template_matmul", [900, 800, 700, [1, 16, 32, 48, 64, 80, 96, 112, 128], "cuda", "float32"], {}], "config": {"index": 1395, "code_hash": null, "entity": [["tile_i", "ot", 1], ["tile_j", "ot", 32], ["tile_k", "ot", 128], ["order", "ot", 1]]}, "result": [[0.117025711, 0.1170538405, 0.117086418], 0, 2.180723190307617, 1684252546.501145], "version": 0.2, "tvm_version": "0.13.dev0"}
{"input": ["cuda -keys=cuda,gpu -arch=sm_75 -max_num_threads=1024 -thread_warp_size=32", "template_matmul", [900, 800, 700, [1, 16, 32, 48, 64, 80, 96, 112, 128], "cuda", "float32"], {}], "config": {"index": 1413, "code_hash": null, "entity": [["tile_i", "ot", 1], ["tile_j", "ot", 64], ["tile_k", "ot", 128], ["order", "ot", 1]]}, "result": [[0.1196935345, 0.1196963805, 0.11974928250000001], 0, 2.210364580154419, 1684252548.3102047], "version": 0.2, "tvm_version": "0.13.dev0"}
{"input": ["cuda -keys=cuda,gpu -arch=sm_75 -max_num_threads=1024 -thread_warp_size=32", "template_matmul", [900, 800, 700, [1, 16, 32, 48, 64, 80, 96, 112, 128], "cuda", "float32"], {}], "config": {"index": 1414, "code_hash": null, "entity": [["tile_i", "ot", 16], ["tile_j", "ot", 64], ["tile_k", "ot", 128], ["order", "ot", 1]]}, "result": [[0.012082176, 0.012088352, 0.01211816], 0, 1.02366304397583, 1684252548.939164], "version": 0.2, "tvm_version": "0.13.dev0"}
{"input": ["cuda -keys=cuda,gpu -arch=sm_75 -max_num_threads=1024 -thread_warp_size=32", "template_matmul", [900, 800, 700, [1, 16, 32, 48, 64, 80, 96, 112, 128], "cuda", "float32"], {}], "config": {"index": 1956, "code_hash": null, "entity": [["tile_i", "ot", 48], ["tile_j", "ot", 16], ["tile_k", "ot", 96], ["order", "ot", 2]]}, "result": [[0.0129176795, 0.0129221435, 0.0129341115], 0, 0.9268643856048584, 1684252549.993397], "version": 0.2, "tvm_version": "0.13.dev0"}
{"input": ["cuda -keys=cuda,gpu -arch=sm_75 -max_num_threads=1024 -thread_warp_size=32", "template_matmul", [900, 800, 700, [1, 16, 32, 48, 64, 80, 96, 112, 128], "cuda", "float32"], {}], "config": {"index": 3503, "code_hash": null, "entity": [["tile_i", "ot", 32], ["tile_j", "ot", 32], ["tile_k", "ot", 112], ["order", "ot", 4]]}, "result": [[0.036945713, 0.036964176, 0.0393250235], 0, 1.220374584197998, 1684252550.919688], "version": 0.2, "tvm_version": "0.13.dev0"}
{"input": ["cuda -keys=cuda,gpu -arch=sm_75 -max_num_threads=1024 -thread_warp_size=32", "template_matmul", [900, 800, 700, [1, 16, 32, 48, 64, 80, 96, 112, 128], "cuda", "float32"], {}], "config": {"index": 2547, "code_hash": null, "entity": [["tile_i", "ot", 1], ["tile_j", "ot", 64], ["tile_k", "ot", 64], ["order", "ot", 3]]}, "result": [[0.119904243, 0.1199542845, 0.1200127715], 0, 2.199662685394287, 1684252553.3053422], "version": 0.2, "tvm_version": "0.13.dev0"}
{"input": ["cuda -keys=cuda,gpu -arch=sm_75 -max_num_threads=1024 -thread_warp_size=32", "template_matmul", [900, 800, 700, [1, 16, 32, 48, 64, 80, 96, 112, 128], "cuda", "float32"], {}], "config": {"index": 504, "code_hash": null, "entity": [["tile_i", "ot", 1], ["tile_j", "ot", 32], ["tile_k", "ot", 96], ["order", "ot", 0]]}, "result": [[0.117558273, 0.11757055649999999, 0.1175862425], 0, 2.1998484134674072, 1684252555.098161], "version": 0.2, "tvm_version": "0.13.dev0"}
{"input": ["cuda -keys=cuda,gpu -arch=sm_75 -max_num_threads=1024 -thread_warp_size=32", "template_matmul", [900, 800, 700, [1, 16, 32, 48, 64, 80, 96, 112, 128], "cuda", "float32"], {}], "config": {"index": 1548, "code_hash": null, "entity": [["tile_i", "ot", 1], ["tile_j", "ot", 16], ["tile_k", "ot", 16], ["order", "ot", 2]]}, "result": [[0.045147838499999995, 0.045160736, 0.045290496500000006], 0, 1.376455545425415, 1684252556.0925043], "version": 0.2, "tvm_version": "0.13.dev0"}
{"input": ["cuda -keys=cuda,gpu -arch=sm_75 -max_num_threads=1024 -thread_warp_size=32", "template_matmul", [900, 800, 700, [1, 16, 32, 48, 64, 80, 96, 112, 128], "cuda", "float32"], {}], "config": {"index": 3087, "code_hash": null, "entity": [["tile_i", "ot", 1], ["tile_j", "ot", 16], ["tile_k", "ot", 32], ["order", "ot", 4]]}, "result": [[0.11420569600000001, 0.114207283, 0.1143524475], 0, 2.1166141033172607, 1684252557.8487403], "version": 0.2, "tvm_version": "0.13.dev0"}
{"input": ["cuda -keys=cuda,gpu -arch=sm_75 -max_num_threads=1024 -thread_warp_size=32", "template_matmul", [900, 800, 700, [1, 16, 32, 48, 64, 80, 96, 112, 128], "cuda", "float32"], {}], "config": {"index": 2583, "code_hash": null, "entity": [["tile_i", "ot", 1], ["tile_j", "ot", 128], ["tile_k", "ot", 64], ["order", "ot", 3]]}, "result": [[0.121207901, 0.121218048, 0.121232574], 0, 2.2806575298309326, 1684252559.7004035], "version": 0.2, "tvm_version": "0.13.dev0"}
{"input": ["cuda -keys=cuda,gpu -arch=sm_75 -max_num_threads=1024 -thread_warp_size=32", "template_matmul", [900, 800, 700, [1, 16, 32, 48, 64, 80, 96, 112, 128], "cuda", "float32"], {}], "config": {"index": 1053, "code_hash": null, "entity": [["tile_i", "ot", 1], ["tile_j", "ot", 1], ["tile_k", "ot", 64], ["order", "ot", 1]]}, "result": [[0.147681961, 0.1477066495, 0.1477275085], 0, 2.5572597980499268, 1684252561.82062], "version": 0.2, "tvm_version": "0.13.dev0"}
{"input": ["cuda -keys=cuda,gpu -arch=sm_75 -max_num_threads=1024 -thread_warp_size=32", "template_matmul", [900, 800, 700, [1, 16, 32, 48, 64, 80, 96, 112, 128], "cuda", "float32"], {}], "config": {"index": 549, "code_hash": null, "entity": [["tile_i", "ot", 1], ["tile_j", "ot", 112], ["tile_k", "ot", 96], ["order", "ot", 0]]}, "result": [[0.11862209300000001, 0.1186293255, 0.11864328], 0, 2.2119438648223877, 1684252563.6309173], "version": 0.2, "tvm_version": "0.13.dev0"}
{"input": ["cuda -keys=cuda,gpu -arch=sm_75 -max_num_threads=1024 -thread_warp_size=32", "template_matmul", [900, 800, 700, [1, 16, 32, 48, 64, 80, 96, 112, 128], "cuda", "float32"], {}], "config": {"index": 2142, "code_hash": null, "entity": [["tile_i", "ot", 1], ["tile_j", "ot", 64], ["tile_k", "ot", 128], ["order", "ot", 2]]}, "result": [[0.119533966, 0.119643745, 0.1197339855], 0, 2.524371862411499, 1684252566.2891667], "version": 0.2, "tvm_version": "0.13.dev0"}
{"input": ["cuda -keys=cuda,gpu -arch=sm_75 -max_num_threads=1024 -thread_warp_size=32", "template_matmul", [900, 800, 700, [1, 16, 32, 48, 64, 80, 96, 112, 128], "cuda", "float32"], {}], "config": {"index": 2362, "code_hash": null, "entity": [["tile_i", "ot", 64], ["tile_j", "ot", 16], ["tile_k", "ot", 32], ["order", "ot", 3]]}, "result": [[0.009341216, 0.0093429755, 0.009362431499999999], 0, 1.3051395416259766, 1684252566.91493], "version": 0.2, "tvm_version": "0.13.dev0"}
{"input": ["cuda -keys=cuda,gpu -arch=sm_75 -max_num_threads=1024 -thread_warp_size=32", "template_matmul", [900, 800, 700, [1, 16, 32, 48, 64, 80, 96, 112, 128], "cuda", "float32"], {}], "config": {"index": 1552, "code_hash": null, "entity": [["tile_i", "ot", 64], ["tile_j", "ot", 16], ["tile_k", "ot", 16], ["order", "ot", 2]]}, "result": [[0.0031768795000000002, 0.0031774719999999998, 0.003177792], 0, 1.2332961559295654, 1684252567.4612877], "version": 0.2, "tvm_version": "0.13.dev0"}
{"input": ["cuda -keys=cuda,gpu -arch=sm_75 -max_num_threads=1024 -thread_warp_size=32", "template_matmul", [900, 800, 700, [1, 16, 32, 48, 64, 80, 96, 112, 128], "cuda", "float32"], {}], "config": {"index": 2350, "code_hash": null, "entity": [["tile_i", "ot", 16], ["tile_j", "ot", 1], ["tile_k", "ot", 32], ["order", "ot", 3]]}, "result": [[0.0092002715, 0.009270272, 0.009439552], 0, 1.3238391876220703, 1684252568.0793424], "version": 0.2, "tvm_version": "0.13.dev0"}
{"input": ["cuda -keys=cuda,gpu -arch=sm_75 -max_num_threads=1024 -thread_warp_size=32", "template_matmul", [900, 800, 700, [1, 16, 32, 48, 64, 80, 96, 112, 128], "cuda", "float32"], {}], "config": {"index": 2305, "code_hash": null, "entity": [["tile_i", "ot", 16], ["tile_j", "ot", 64], ["tile_k", "ot", 16], ["order", "ot", 3]]}, "result": [[0.00442592, 0.004426608, 0.004426928], 0, 1.232926607131958, 1684252568.6330638], "version": 0.2, "tvm_version": "0.13.dev0"}
{"input": ["cuda -keys=cuda,gpu -arch=sm_75 -max_num_threads=1024 -thread_warp_size=32", "template_matmul", [900, 800, 700, [1, 16, 32, 48, 64, 80, 96, 112, 128], "cuda", "float32"], {}], "config": {"index": 823, "code_hash": null, "entity": [["tile_i", "ot", 64], ["tile_j", "ot", 16], ["tile_k", "ot", 16], ["order", "ot", 1]]}, "result": [[0.0031774719999999998, 0.0031784315, 0.0031784955], 0, 1.2410557270050049, 1684252569.1849606], "version": 0.2, "tvm_version": "0.13.dev0"}
{"input": ["cuda -keys=cuda,gpu -arch=sm_75 -max_num_threads=1024 -thread_warp_size=32", "template_matmul", [900, 800, 700, [1, 16, 32, 48, 64, 80, 96, 112, 128], "cuda", "float32"], {}], "config": {"index": 2442, "code_hash": null, "entity": [["tile_i", "ot", 48], ["tile_j", "ot", 16], ["tile_k", "ot", 48], ["order", "ot", 3]]}, "result": [[0.0125019035, 0.012502016, 0.012523376000000001], 0, 1.309333086013794, 1684252569.8148987], "version": 0.2, "tvm_version": "0.13.dev0"}
{"input": ["cuda -keys=cuda,gpu -arch=sm_75 -max_num_threads=1024 -thread_warp_size=32", "template_matmul", [900, 800, 700, [1, 16, 32, 48, 64, 80, 96, 112, 128], "cuda", "float32"], {}], "config": {"index": 823, "code_hash": null, "entity": [["tile_i", "ot", 64], ["tile_j", "ot", 16], ["tile_k", "ot", 16], ["order", "ot", 1]]}, "result": [[0.003444848, 0.003445472, 0.003455136], 0, 1.2237062454223633, 1684252570.3489273], "version": 0.2, "tvm_version": "0.13.dev0"}
{"input": ["cuda -keys=cuda,gpu -arch=sm_75 -max_num_threads=1024 -thread_warp_size=32", "template_matmul", [900, 800, 700, [1, 16, 32, 48, 64, 80, 96, 112, 128], "cuda", "float32"], {}], "config": {"index": 2271, "code_hash": null, "entity": [["tile_i", "ot", 48], ["tile_j", "ot", 1], ["tile_k", "ot", 16], ["order", "ot", 3]]}, "result": [[0.0108557115, 0.010857472, 0.0108668], 0, 1.2927522659301758, 1684252570.960351], "version": 0.2, "tvm_version": "0.13.dev0"}
{"input": ["cuda -keys=cuda,gpu -arch=sm_75 -max_num_threads=1024 -thread_warp_size=32", "template_matmul", [900, 800, 700, [1, 16, 32, 48, 64, 80, 96, 112, 128], "cuda", "float32"], {}], "config": {"index": 499, "code_hash": null, "entity": [["tile_i", "ot", 64], ["tile_j", "ot", 16], ["tile_k", "ot", 96], ["order", "ot", 0]]}, "result": [[0.0095948475, 0.00959856, 0.0096314875], 0, 1.3213748931884766, 1684252571.5668879], "version": 0.2, "tvm_version": "0.13.dev0"}
{"input": ["cuda -keys=cuda,gpu -arch=sm_75 -max_num_threads=1024 -thread_warp_size=32", "template_matmul", [900, 800, 700, [1, 16, 32, 48, 64, 80, 96, 112, 128], "cuda", "float32"], {}], "config": {"index": 1552, "code_hash": null, "entity": [["tile_i", "ot", 64], ["tile_j", "ot", 16], ["tile_k", "ot", 16], ["order", "ot", 2]]}, "result": [[0.0031795195, 0.0031804800000000003, 0.0031805435000000003], 0, 1.2338941097259521, 1684252572.096578], "version": 0.2, "tvm_version": "0.13.dev0"}
{"input": ["cuda -keys=cuda,gpu -arch=sm_75 -max_num_threads=1024 -thread_warp_size=32", "template_matmul", [900, 800, 700, [1, 16, 32, 48, 64, 80, 96, 112, 128], "cuda", "float32"], {}], "config": {"index": 3502, "code_hash": null, "entity": [["tile_i", "ot", 16], ["tile_j", "ot", 32], ["tile_k", "ot", 112], ["order", "ot", 4]]}, "result": [[0.036074497000000004, 0.036090781999999995, 0.0360990715], 0, 1.5613491535186768, 1684252572.9837387], "version": 0.2, "tvm_version": "0.13.dev0"}
{"input": ["cuda -keys=cuda,gpu -arch=sm_75 -max_num_threads=1024 -thread_warp_size=32", "template_matmul", [900, 800, 700, [1, 16, 32, 48, 64, 80, 96, 112, 128], "cuda", "float32"], {}], "config": {"index": 2386, "code_hash": null, "entity": [["tile_i", "ot", 16], ["tile_j", "ot", 64], ["tile_k", "ot", 32], ["order", "ot", 3]]}, "result": [[0.011554159999999999, 0.011563568, 0.0115886715], 0, 1.3018927574157715, 1684252573.6047018], "version": 0.2, "tvm_version": "0.13.dev0"}
{"input": ["cuda -keys=cuda,gpu -arch=sm_75 -max_num_threads=1024 -thread_warp_size=32", "template_matmul", [900, 800, 700, [1, 16, 32, 48, 64, 80, 96, 112, 128], "cuda", "float32"], {}], "config": {"index": 2197, "code_hash": null, "entity": [["tile_i", "ot", 16], ["tile_j", "ot", 16], ["tile_k", "ot", 1], ["order", "ot", 3]]}, "result": [[0.0108985915, 0.0109183835, 0.0109270715], 0, 1.344069480895996, 1684252574.2436564], "version": 0.2, "tvm_version": "0.13.dev0"}
{"input": ["cuda -keys=cuda,gpu -arch=sm_75 -max_num_threads=1024 -thread_warp_size=32", "template_matmul", [900, 800, 700, [1, 16, 32, 48, 64, 80, 96, 112, 128], "cuda", "float32"], {}], "config": {"index": 893, "code_hash": null, "entity": [["tile_i", "ot", 32], ["tile_j", "ot", 1], ["tile_k", "ot", 32], ["order", "ot", 1]]}, "result": [[0.0086004635, 0.0089108475, 0.008921728], 0, 1.4497690200805664, 1684252575.8169088], "version": 0.2, "tvm_version": "0.13.dev0"}
{"input": ["cuda -keys=cuda,gpu -arch=sm_75 -max_num_threads=1024 -thread_warp_size=32", "template_matmul", [900, 800, 700, [1, 16, 32, 48, 64, 80, 96, 112, 128], "cuda", "float32"], {}], "config": {"index": 1818, "code_hash": null, "entity": [["tile_i", "ot", 1], ["tile_j", "ot", 64], ["tile_k", "ot", 64], ["order", "ot", 2]]}, "result": [[0.119706802, 0.1199662395, 0.1200544505], 0, 2.6747400760650635, 1684252577.7066333], "version": 0.2, "tvm_version": "0.13.dev0"}
{"input": ["cuda -keys=cuda,gpu -arch=sm_75 -max_num_threads=1024 -thread_warp_size=32", "template_matmul", [900, 800, 700, [1, 16, 32, 48, 64, 80, 96, 112, 128], "cuda", "float32"], {}], "config": {"index": 84, "code_hash": null, "entity": [["tile_i", "ot", 48], ["tile_j", "ot", 1], ["tile_k", "ot", 16], ["order", "ot", 0]]}, "result": [[0.0108860795, 0.010887167500000001, 0.010888192], 0, 1.4047930240631104, 1684252578.3409698], "version": 0.2, "tvm_version": "0.13.dev0"}
{"input": ["cuda -keys=cuda,gpu -arch=sm_75 -max_num_threads=1024 -thread_warp_size=32", "template_matmul", [900, 800, 700, [1, 16, 32, 48, 64, 80, 96, 112, 128], "cuda", "float32"], {}], "config": {"index": 499, "code_hash": null, "entity": [["tile_i", "ot", 64], ["tile_j", "ot", 16], ["tile_k", "ot", 96], ["order", "ot", 0]]}, "result": [[0.0095967835, 0.0095999355, 0.009619104], 0, 1.438133955001831, 1684252578.969146], "version": 0.2, "tvm_version": "0.13.dev0"}
{"input": ["cuda -keys=cuda,gpu -arch=sm_75 -max_num_threads=1024 -thread_warp_size=32", "template_matmul", [900, 800, 700, [1, 16, 32, 48, 64, 80, 96, 112, 128], "cuda", "float32"], {}], "config": {"index": 93, "code_hash": null, "entity": [["tile_i", "ot", 48], ["tile_j", "ot", 16], ["tile_k", "ot", 16], ["order", "ot", 0]]}, "result": [[0.0040911675, 0.00409424, 0.0040949275], 0, 1.3515822887420654, 1684252579.5199928], "version": 0.2, "tvm_version": "0.13.dev0"}
{"input": ["cuda -keys=cuda,gpu -arch=sm_75 -max_num_threads=1024 -thread_warp_size=32", "template_matmul", [900, 800, 700, [1, 16, 32, 48, 64, 80, 96, 112, 128], "cuda", "float32"], {}], "config": {"index": 1576, "code_hash": null, "entity": [["tile_i", "ot", 16], ["tile_j", "ot", 64], ["tile_k", "ot", 16], ["order", "ot", 2]]}, "result": [[0.004426752, 0.004428192, 0.0044288800000000005], 0, 1.3306241035461426, 1684252580.0725975], "version": 0.2, "tvm_version": "0.13.dev0"}
{"input": ["cuda -keys=cuda,gpu -arch=sm_75 -max_num_threads=1024 -thread_warp_size=32", "template_matmul", [900, 800, 700, [1, 16, 32, 48, 64, 80, 96, 112, 128], "cuda", "float32"], {}], "config": {"index": 2872, "code_hash": null, "entity": [["tile_i", "ot", 16], ["tile_j", "ot", 64], ["tile_k", "ot", 128], ["order", "ot", 3]]}, "result": [[0.012082176, 0.0120869435, 0.0121068], 0, 1.4427518844604492, 1684252580.7134526], "version": 0.2, "tvm_version": "0.13.dev0"}
{"input": ["cuda -keys=cuda,gpu -arch=sm_75 -max_num_threads=1024 -thread_warp_size=32", "template_matmul", [900, 800, 700, [1, 16, 32, 48, 64, 80, 96, 112, 128], "cuda", "float32"], {}], "config": {"index": 3008, "code_hash": null, "entity": [["tile_i", "ot", 32], ["tile_j", "ot", 16], ["tile_k", "ot", 16], ["order", "ot", 4]]}, "result": [[0.0315784795, 0.0315871045, 0.031612911], 0, 1.5954968929290771, 1684252581.5566938], "version": 0.2, "tvm_version": "0.13.dev0"}
{"input": ["cuda -keys=cuda,gpu -arch=sm_75 -max_num_threads=1024 -thread_warp_size=32", "template_matmul", [900, 800, 700, [1, 16, 32, 48, 64, 80, 96, 112, 128], "cuda", "float32"], {}], "config": {"index": 2848, "code_hash": null, "entity": [["tile_i", "ot", 64], ["tile_j", "ot", 16], ["tile_k", "ot", 128], ["order", "ot", 3]]}, "result": [[0.0097886875, 0.0097894235, 0.0098243995], 0, 1.4374847412109375, 1684252582.159761], "version": 0.2, "tvm_version": "0.13.dev0"}
{"input": ["cuda -keys=cuda,gpu -arch=sm_75 -max_num_threads=1024 -thread_warp_size=32", "template_matmul", [900, 800, 700, [1, 16, 32, 48, 64, 80, 96, 112, 128], "cuda", "float32"], {}], "config": {"index": 1090, "code_hash": null, "entity": [["tile_i", "ot", 16], ["tile_j", "ot", 64], ["tile_k", "ot", 64], ["order", "ot", 1]]}, "result": [[0.011700336, 0.0117010555, 0.0117363995], 0, 1.4289343357086182, 1684252582.785596], "version": 0.2, "tvm_version": "0.13.dev0"}
{"input": ["cuda -keys=cuda,gpu -arch=sm_75 -max_num_threads=1024 -thread_warp_size=32", "template_matmul", [900, 800, 700, [1, 16, 32, 48, 64, 80, 96, 112, 128], "cuda", "float32"], {}], "config": {"index": 811, "code_hash": null, "entity": [["tile_i", "ot", 16], ["tile_j", "ot", 1], ["tile_k", "ot", 16], ["order", "ot", 1]]}, "result": [[0.0111728635, 0.0111902395, 0.011192463500000001], 0, 1.4072575569152832, 1684252583.4132168], "version": 0.2, "tvm_version": "0.13.dev0"}
{"input": ["cuda -keys=cuda,gpu -arch=sm_75 -max_num_threads=1024 -thread_warp_size=32", "template_matmul", [900, 800, 700, [1, 16, 32, 48, 64, 80, 96, 112, 128], "cuda", "float32"], {}], "config": {"index": 2841, "code_hash": null, "entity": [["tile_i", "ot", 96], ["tile_j", "ot", 1], ["tile_k", "ot", 128], ["order", "ot", 3]]}, "result": [[0.012192064, 0.01236824, 0.012499119500000001], 0, 1.4677600860595703, 1684252584.043149], "version": 0.2, "tvm_version": "0.13.dev0"}
{"input": ["cuda -keys=cuda,gpu -arch=sm_75 -max_num_threads=1024 -thread_warp_size=32", "template_matmul", [900, 800, 700, [1, 16, 32, 48, 64, 80, 96, 112, 128], "cuda", "float32"], {}], "config": {"index": 813, "code_hash": null, "entity": [["tile_i", "ot", 48], ["tile_j", "ot", 1], ["tile_k", "ot", 16], ["order", "ot", 1]]}, "result": [[0.010855295999999999, 0.0108556955, 0.0108751035], 0, 1.4543101787567139, 1684252584.6666894], "version": 0.2, "tvm_version": "0.13.dev0"}
{"input": ["cuda -keys=cuda,gpu -arch=sm_75 -max_num_threads=1024 -thread_warp_size=32", "template_matmul", [900, 800, 700, [1, 16, 32, 48, 64, 80, 96, 112, 128], "cuda", "float32"], {}], "config": {"index": 2278, "code_hash": null, "entity": [["tile_i", "ot", 16], ["tile_j", "ot", 16], ["tile_k", "ot", 16], ["order", "ot", 3]]}, "result": [[0.0048054560000000005, 0.004807680000000001, 0.004810704000000001], 0, 1.3768439292907715, 1684252585.2276125], "version": 0.2, "tvm_version": "0.13.dev0"}
{"input": ["cuda -keys=cuda,gpu -arch=sm_75 -max_num_threads=1024 -thread_warp_size=32", "template_matmul", [900, 800, 700, [1, 16, 32, 48, 64, 80, 96, 112, 128], "cuda", "float32"], {}], "config": {"index": 3503, "code_hash": null, "entity": [["tile_i", "ot", 32], ["tile_j", "ot", 32], ["tile_k", "ot", 112], ["order", "ot", 4]]}, "result": [[0.037059982, 0.037131248, 0.0371529425], 0, 1.7038514614105225, 1684252586.1343129], "version": 0.2, "tvm_version": "0.13.dev0"}
{"input": ["cuda -keys=cuda,gpu -arch=sm_75 -max_num_threads=1024 -thread_warp_size=32", "template_matmul", [900, 800, 700, [1, 16, 32, 48, 64, 80, 96, 112, 128], "cuda", "float32"], {}], "config": {"index": 2280, "code_hash": null, "entity": [["tile_i", "ot", 48], ["tile_j", "ot", 16], ["tile_k", "ot", 16], ["order", "ot", 3]]}, "result": [[0.004093759999999999, 0.0040942075000000005, 0.004094272], 0, 1.3307056427001953, 1684252586.69514], "version": 0.2, "tvm_version": "0.13.dev0"}
{"input": ["cuda -keys=cuda,gpu -arch=sm_75 -max_num_threads=1024 -thread_warp_size=32", "template_matmul", [900, 800, 700, [1, 16, 32, 48, 64, 80, 96, 112, 128], "cuda", "float32"], {}], "config": {"index": 1962, "code_hash": null, "entity": [["tile_i", "ot", 1], ["tile_j", "ot", 32], ["tile_k", "ot", 96], ["order", "ot", 2]]}, "result": [[0.1174261625, 0.117567665, 0.1175692975], 0, 2.5429470539093018, 1684252589.3716772], "version": 0.2, "tvm_version": "0.13.dev0"}
{"input": ["cuda -keys=cuda,gpu -arch=sm_75 -max_num_threads=1024 -thread_warp_size=32", "template_matmul", [900, 800, 700, [1, 16, 32, 48, 64, 80, 96, 112, 128], "cuda", "float32"], {}], "config": {"index": 1576, "code_hash": null, "entity": [["tile_i", "ot", 16], ["tile_j", "ot", 64], ["tile_k", "ot", 16], ["order", "ot", 2]]}, "result": [[0.00442664, 0.0044282395, 0.004429407999999999], 0, 1.251589059829712, 1684252589.938143], "version": 0.2, "tvm_version": "0.13.dev0"}
{"input": ["cuda -keys=cuda,gpu -arch=sm_75 -max_num_threads=1024 -thread_warp_size=32", "template_matmul", [900, 800, 700, [1, 16, 32, 48, 64, 80, 96, 112, 128], "cuda", "float32"], {}], "config": {"index": 1552, "code_hash": null, "entity": [["tile_i", "ot", 64], ["tile_j", "ot", 16], ["tile_k", "ot", 16], ["order", "ot", 2]]}, "result": [[0.0031755355, 0.00317704, 0.0031771675], 0, 1.2451236248016357, 1684252590.4855082], "version": 0.2, "tvm_version": "0.13.dev0"}
{"input": ["cuda -keys=cuda,gpu -arch=sm_75 -max_num_threads=1024 -thread_warp_size=32", "template_matmul", [900, 800, 700, [1, 16, 32, 48, 64, 80, 96, 112, 128], "cuda", "float32"], {}], "config": {"index": 84, "code_hash": null, "entity": [["tile_i", "ot", 48], ["tile_j", "ot", 1], ["tile_k", "ot", 16], ["order", "ot", 0]]}, "result": [[0.01087952, 0.010884096, 0.0108906075], 0, 1.3124797344207764, 1684252591.1072402], "version": 0.2, "tvm_version": "0.13.dev0"}
{"input": ["cuda -keys=cuda,gpu -arch=sm_75 -max_num_threads=1024 -thread_warp_size=32", "template_matmul", [900, 800, 700, [1, 16, 32, 48, 64, 80, 96, 112, 128], "cuda", "float32"], {}], "config": {"index": 1786, "code_hash": null, "entity": [["tile_i", "ot", 64], ["tile_j", "ot", 1], ["tile_k", "ot", 64], ["order", "ot", 2]]}, "result": [[0.009889568000000001, 0.009921232, 0.0099769435], 0, 1.317500114440918, 1684252591.7200131], "version": 0.2, "tvm_version": "0.13.dev0"}
{"input": ["cuda -keys=cuda,gpu -arch=sm_75 -max_num_threads=1024 -thread_warp_size=32", "template_matmul", [900, 800, 700, [1, 16, 32, 48, 64, 80, 96, 112, 128], "cuda", "float32"], {}], "config": {"index": 2278, "code_hash": null, "entity": [["tile_i", "ot", 16], ["tile_j", "ot", 16], ["tile_k", "ot", 16], ["order", "ot", 3]]}, "result": [[0.0048037115, 0.0048084, 0.004808656], 0, 1.2647345066070557, 1684252592.2863078], "version": 0.2, "tvm_version": "0.13.dev0"}
{"input": ["cuda -keys=cuda,gpu -arch=sm_75 -max_num_threads=1024 -thread_warp_size=32", "template_matmul", [900, 800, 700, [1, 16, 32, 48, 64, 80, 96, 112, 128], "cuda", "float32"], {}], "config": {"index": 1057, "code_hash": null, "entity": [["tile_i", "ot", 64], ["tile_j", "ot", 1], ["tile_k", "ot", 64], ["order", "ot", 1]]}, "result": [[0.0099068315, 0.010181632000000001, 0.010305536], 0, 1.3162815570831299, 1684252592.9020026], "version": 0.2, "tvm_version": "0.13.dev0"}
{"input": ["cuda -keys=cuda,gpu -arch=sm_75 -max_num_threads=1024 -thread_warp_size=32", "template_matmul", [900, 800, 700, [1, 16, 32, 48, 64, 80, 96, 112, 128], "cuda", "float32"], {}], "config": {"index": 4296, "code_hash": null, "entity": [["tile_i", "ot", 48], ["tile_j", "ot", 1], ["tile_k", "ot", 128], ["order", "ot", 5]]}, "result": [[0.0373577115, 0.0373602255, 0.0373681445], 0, 1.599463701248169, 1684252593.8278866], "version": 0.2, "tvm_version": "0.13.dev0"}
{"input": ["cuda -keys=cuda,gpu -arch=sm_75 -max_num_threads=1024 -thread_warp_size=32", "template_matmul", [900, 800, 700, [1, 16, 32, 48, 64, 80, 96, 112, 128], "cuda", "float32"], {}], "config": {"index": 903, "code_hash": null, "entity": [["tile_i", "ot", 48], ["tile_j", "ot", 16], ["tile_k", "ot", 32], ["order", "ot", 1]]}, "result": [[0.01274256, 0.012748767499999999, 0.012762528], 0, 1.333251714706421, 1684252594.4800427], "version": 0.2, "tvm_version": "0.13.dev0"}
{"input": ["cuda -keys=cuda,gpu -arch=sm_75 -max_num_threads=1024 -thread_warp_size=32", "template_matmul", [900, 800, 700, [1, 16, 32, 48, 64, 80, 96, 112, 128], "cuda", "float32"], {}], "config": {"index": 1387, "code_hash": null, "entity": [["tile_i", "ot", 16], ["tile_j", "ot", 16], ["tile_k", "ot", 128], ["order", "ot", 1]]}, "result": [[0.011352064, 0.011368304000000001, 0.0114189755], 0, 1.306562900543213, 1684252595.1067631], "version": 0.2, "tvm_version": "0.13.dev0"}
{"input": ["cuda -keys=cuda,gpu -arch=sm_75 -max_num_threads=1024 -thread_warp_size=32", "template_matmul", [900, 800, 700, [1, 16, 32, 48, 64, 80, 96, 112, 128], "cuda", "float32"], {}], "config": {"index": 2286, "code_hash": null, "entity": [["tile_i", "ot", 1], ["tile_j", "ot", 32], ["tile_k", "ot", 16], ["order", "ot", 3]]}, "result": [[0.043971134, 0.0439739035, 0.0439746245], 0, 1.6617190837860107, 1684252596.089534], "version": 0.2, "tvm_version": "0.13.dev0"}
{"input": ["cuda -keys=cuda,gpu -arch=sm_75 -max_num_threads=1024 -thread_warp_size=32", "template_matmul", [900, 800, 700, [1, 16, 32, 48, 64, 80, 96, 112, 128], "cuda", "float32"], {}], "config": {"index": 2432, "code_hash": null, "entity": [["tile_i", "ot", 32], ["tile_j", "ot", 1], ["tile_k", "ot", 48], ["order", "ot", 3]]}, "result": [[0.0180491845, 0.018055023, 0.018056192], 0, 1.3759427070617676, 1684252596.7819326], "version": 0.2, "tvm_version": "0.13.dev0"}
{"input": ["cuda -keys=cuda,gpu -arch=sm_75 -max_num_threads=1024 -thread_warp_size=32", "template_matmul", [900, 800, 700, [1, 16, 32, 48, 64, 80, 96, 112, 128], "cuda", "float32"], {}], "config": {"index": 199, "code_hash": null, "entity": [["tile_i", "ot", 16], ["tile_j", "ot", 64], ["tile_k", "ot", 32], ["order", "ot", 0]]}, "result": [[0.011553744, 0.0115550715, 0.011571199999999999], 0, 1.334092617034912, 1684252597.415364], "version": 0.2, "tvm_version": "0.13.dev0"}
{"input": ["cuda -keys=cuda,gpu -arch=sm_75 -max_num_threads=1024 -thread_warp_size=32", "template_matmul", [900, 800, 700, [1, 16, 32, 48, 64, 80, 96, 112, 128], "cuda", "float32"], {}], "config": {"index": 2281, "code_hash": null, "entity": [["tile_i", "ot", 64], ["tile_j", "ot", 16], ["tile_k", "ot", 16], ["order", "ot", 3]]}, "result": [[0.0031773920000000002, 0.0031784955, 0.0031785755], 0, 1.1808526515960693, 1684252597.9648125], "version": 0.2, "tvm_version": "0.13.dev0"}
{"input": ["cuda -keys=cuda,gpu -arch=sm_75 -max_num_threads=1024 -thread_warp_size=32", "template_matmul", [900, 800, 700, [1, 16, 32, 48, 64, 80, 96, 112, 128], "cuda", "float32"], {}], "config": {"index": 3007, "code_hash": null, "entity": [["tile_i", "ot", 16], ["tile_j", "ot", 16], ["tile_k", "ot", 16], ["order", "ot", 4]]}, "result": [[0.030484479499999998, 0.030486014999999998, 0.0304864005], 0, 1.5398473739624023, 1684252598.833351], "version": 0.2, "tvm_version": "0.13.dev0"}
{"input": ["cuda -keys=cuda,gpu -arch=sm_75 -max_num_threads=1024 -thread_warp_size=32", "template_matmul", [900, 800, 700, [1, 16, 32, 48, 64, 80, 96, 112, 128], "cuda", "float32"], {}], "config": {"index": 1543, "code_hash": null, "entity": [["tile_i", "ot", 64], ["tile_j", "ot", 1], ["tile_k", "ot", 16], ["order", "ot", 2]]}, "result": [[0.00879216, 0.0089118715, 0.009011296], 0, 1.225693941116333, 1684252600.2572343], "version": 0.2, "tvm_version": "0.13.dev0"}
{"input": ["cuda -keys=cuda,gpu -arch=sm_75 -max_num_threads=1024 -thread_warp_size=32", "template_matmul", [900, 800, 700, [1, 16, 32, 48, 64, 80, 96, 112, 128], "cuda", "float32"], {}], "config": {"index": 2281, "code_hash": null, "entity": [["tile_i", "ot", 64], ["tile_j", "ot", 16], ["tile_k", "ot", 16], ["order", "ot", 3]]}, "result": [[0.003179408, 0.0031802555, 0.0031805435000000003], 0, 1.190864086151123, 1684252600.797986], "version": 0.2, "tvm_version": "0.13.dev0"}
{"input": ["cuda -keys=cuda,gpu -arch=sm_75 -max_num_threads=1024 -thread_warp_size=32", "template_matmul", [900, 800, 700, [1, 16, 32, 48, 64, 80, 96, 112, 128], "cuda", "float32"], {}], "config": {"index": 166, "code_hash": null, "entity": [["tile_i", "ot", 64], ["tile_j", "ot", 1], ["tile_k", "ot", 32], ["order", "ot", 0]]}, "result": [[0.0093789115, 0.009381888, 0.009541807999999999], 0, 1.2589280605316162, 1684252601.4101226], "version": 0.2, "tvm_version": "0.13.dev0"}
{"input": ["cuda -keys=cuda,gpu -arch=sm_75 -max_num_threads=1024 -thread_warp_size=32", "template_matmul", [900, 800, 700, [1, 16, 32, 48, 64, 80, 96, 112, 128], "cuda", "float32"], {}], "config": {"index": 2848, "code_hash": null, "entity": [["tile_i", "ot", 64], ["tile_j", "ot", 16], ["tile_k", "ot", 128], ["order", "ot", 3]]}, "result": [[0.009790464, 0.009791088, 0.009821184], 0, 1.3192296028137207, 1684252602.023324], "version": 0.2, "tvm_version": "0.13.dev0"}
{"input": ["cuda -keys=cuda,gpu -arch=sm_75 -max_num_threads=1024 -thread_warp_size=32", "template_matmul", [900, 800, 700, [1, 16, 32, 48, 64, 80, 96, 112, 128], "cuda", "float32"], {}], "config": {"index": 2281, "code_hash": null, "entity": [["tile_i", "ot", 64], ["tile_j", "ot", 16], ["tile_k", "ot", 16], ["order", "ot", 3]]}, "result": [[0.0031774719999999998, 0.0031776955, 0.003178512], 0, 1.2139623165130615, 1684252602.5661232], "version": 0.2, "tvm_version": "0.13.dev0"}
{"input": ["cuda -keys=cuda,gpu -arch=sm_75 -max_num_threads=1024 -thread_warp_size=32", "template_matmul", [900, 800, 700, [1, 16, 32, 48, 64, 80, 96, 112, 128], "cuda", "float32"], {}], "config": {"index": 1316, "code_hash": null, "entity": [["tile_i", "ot", 32], ["tile_j", "ot", 32], ["tile_k", "ot", 112], ["order", "ot", 1]]}, "result": [[0.010034000000000001, 0.010034560000000001, 0.0100578075], 0, 1.290818452835083, 1684252603.1847858], "version": 0.2, "tvm_version": "0.13.dev0"}
{"input": ["cuda -keys=cuda,gpu -arch=sm_75 -max_num_threads=1024 -thread_warp_size=32", "template_matmul", [900, 800, 700, [1, 16, 32, 48, 64, 80, 96, 112, 128], "cuda", "float32"], {}], "config": {"index": 1053, "code_hash": null, "entity": [["tile_i", "ot", 1], ["tile_j", "ot", 1], ["tile_k", "ot", 64], ["order", "ot", 1]]}, "result": [[0.14765769950000002, 0.147667892, 0.14772097750000002], 0, 2.75321626663208, 1684252605.3213937], "version": 0.2, "tvm_version": "0.13.dev0"}
{"input": ["cuda -keys=cuda,gpu -arch=sm_75 -max_num_threads=1024 -thread_warp_size=32", "template_matmul", [900, 800, 700, [1, 16, 32, 48, 64, 80, 96, 112, 128], "cuda", "float32"], {}], "config": {"index": 2845, "code_hash": null, "entity": [["tile_i", "ot", 16], ["tile_j", "ot", 16], ["tile_k", "ot", 128], ["order", "ot", 3]]}, "result": [[0.0113832155, 0.011383808, 0.011432959500000001], 0, 1.3629100322723389, 1684252605.9680033], "version": 0.2, "tvm_version": "0.13.dev0"}
{"input": ["cuda -keys=cuda,gpu -arch=sm_75 -max_num_threads=1024 -thread_warp_size=32", "template_matmul", [900, 800, 700, [1, 16, 32, 48, 64, 80, 96, 112, 128], "cuda", "float32"], {}], "config": {"index": 1576, "code_hash": null, "entity": [["tile_i", "ot", 16], ["tile_j", "ot", 64], ["tile_k", "ot", 16], ["order", "ot", 2]]}, "result": [[0.0044288475, 0.0044298235, 0.004430672], 0, 1.2131741046905518, 1684252606.5115724], "version": 0.2, "tvm_version": "0.13.dev0"}
{"input": ["cuda -keys=cuda,gpu -arch=sm_75 -max_num_threads=1024 -thread_warp_size=32", "template_matmul", [900, 800, 700, [1, 16, 32, 48, 64, 80, 96, 112, 128], "cuda", "float32"], {}], "config": {"index": 2281, "code_hash": null, "entity": [["tile_i", "ot", 64], ["tile_j", "ot", 16], ["tile_k", "ot", 16], ["order", "ot", 3]]}, "result": [[0.003175328, 0.0031775995, 0.0031784955], 0, 1.2108747959136963, 1684252607.0486395], "version": 0.2, "tvm_version": "0.13.dev0"}
{"input": ["cuda -keys=cuda,gpu -arch=sm_75 -max_num_threads=1024 -thread_warp_size=32", "template_matmul", [900, 800, 700, [1, 16, 32, 48, 64, 80, 96, 112, 128], "cuda", "float32"], {}], "config": {"index": 893, "code_hash": null, "entity": [["tile_i", "ot", 32], ["tile_j", "ot", 1], ["tile_k", "ot", 32], ["order", "ot", 1]]}, "result": [[0.00848896, 0.0086609915, 0.0087731675], 0, 1.2606995105743408, 1684252607.64345], "version": 0.2, "tvm_version": "0.13.dev0"}
{"input": ["cuda -keys=cuda,gpu -arch=sm_75 -max_num_threads=1024 -thread_warp_size=32", "template_matmul", [900, 800, 700, [1, 16, 32, 48, 64, 80, 96, 112, 128], "cuda", "float32"], {}], "config": {"index": 4330, "code_hash": null, "entity": [["tile_i", "ot", 16], ["tile_j", "ot", 64], ["tile_k", "ot", 128], ["order", "ot", 5]]}, "result": [[0.0417751045, 0.041826305, 0.041830558500000004], 0, 1.5668866634368896, 1684252618.9818373], "version": 0.2, "tvm_version": "0.13.dev0"}
{"input": ["cuda -keys=cuda,gpu -arch=sm_75 -max_num_threads=1024 -thread_warp_size=32", "template_matmul", [900, 800, 700, [1, 16, 32, 48, 64, 80, 96, 112, 128], "cuda", "float32"], {}], "config": {"index": 174, "code_hash": null, "entity": [["tile_i", "ot", 48], ["tile_j", "ot", 16], ["tile_k", "ot", 32], ["order", "ot", 0]]}, "result": [[0.0127477435, 0.01274808, 0.012757184000000001], 0, 1.2868523597717285, 1684252619.6269708], "version": 0.2, "tvm_version": "0.13.dev0"}
{"input": ["cuda -keys=cuda,gpu -arch=sm_75 -max_num_threads=1024 -thread_warp_size=32", "template_matmul", [900, 800, 700, [1, 16, 32, 48, 64, 80, 96, 112, 128], "cuda", "float32"], {}], "config": {"index": 4248, "code_hash": null, "entity": [["tile_i", "ot", 1], ["tile_j", "ot", 64], ["tile_k", "ot", 112], ["order", "ot", 5]]}, "result": [[0.150908981, 0.1509994505, 0.1510104675], 0, 2.7764415740966797, 1684252622.5530295], "version": 0.2, "tvm_version": "0.13.dev0"}
{"input": ["cuda -keys=cuda,gpu -arch=sm_75 -max_num_threads=1024 -thread_warp_size=32", "template_matmul", [900, 800, 700, [1, 16, 32, 48, 64, 80, 96, 112, 128], "cuda", "float32"], {}], "config": {"index": 2362, "code_hash": null, "entity": [["tile_i", "ot", 64], ["tile_j", "ot", 16], ["tile_k", "ot", 32], ["order", "ot", 3]]}, "result": [[0.009341151999999998, 0.009345024, 0.0093757275], 0, 1.2450692653656006, 1684252623.1676583], "version": 0.2, "tvm_version": "0.13.dev0"}
{"input": ["cuda -keys=cuda,gpu -arch=sm_75 -max_num_threads=1024 -thread_warp_size=32", "template_matmul", [900, 800, 700, [1, 16, 32, 48, 64, 80, 96, 112, 128], "cuda", "float32"], {}], "config": {"index": 2271, "code_hash": null, "entity": [["tile_i", "ot", 48], ["tile_j", "ot", 1], ["tile_k", "ot", 16], ["order", "ot", 3]]}, "result": [[0.010859616, 0.0108598555, 0.010879856], 0, 1.1981167793273926, 1684252623.8008058], "version": 0.2, "tvm_version": "0.13.dev0"}
{"input": ["cuda -keys=cuda,gpu -arch=sm_75 -max_num_threads=1024 -thread_warp_size=32", "template_matmul", [900, 800, 700, [1, 16, 32, 48, 64, 80, 96, 112, 128], "cuda", "float32"], {}], "config": {"index": 1549, "code_hash": null, "entity": [["tile_i", "ot", 16], ["tile_j", "ot", 16], ["tile_k", "ot", 16], ["order", "ot", 2]]}, "result": [[0.0048075834999999996, 0.004809216, 0.004812592], 0, 1.2178325653076172, 1684252624.3680117], "version": 0.2, "tvm_version": "0.13.dev0"}
{"input": ["cuda -keys=cuda,gpu -arch=sm_75 -max_num_threads=1024 -thread_warp_size=32", "template_matmul", [900, 800, 700, [1, 16, 32, 48, 64, 80, 96, 112, 128], "cuda", "float32"], {}], "config": {"index": 2872, "code_hash": null, "entity": [["tile_i", "ot", 16], ["tile_j", "ot", 64], ["tile_k", "ot", 128], ["order", "ot", 3]]}, "result": [[0.0120729595, 0.01207808, 0.012109264], 0, 1.2874138355255127, 1684252625.011841], "version": 0.2, "tvm_version": "0.13.dev0"}
{"input": ["cuda -keys=cuda,gpu -arch=sm_75 -max_num_threads=1024 -thread_warp_size=32", "template_matmul", [900, 800, 700, [1, 16, 32, 48, 64, 80, 96, 112, 128], "cuda", "float32"], {}], "config": {"index": 1414, "code_hash": null, "entity": [["tile_i", "ot", 16], ["tile_j", "ot", 64], ["tile_k", "ot", 128], ["order", "ot", 1]]}, "result": [[0.0120676955, 0.012078239999999999, 0.012110383499999999], 0, 1.2835254669189453, 1684252625.646937], "version": 0.2, "tvm_version": "0.13.dev0"}
{"input": ["cuda -keys=cuda,gpu -arch=sm_75 -max_num_threads=1024 -thread_warp_size=32", "template_matmul", [900, 800, 700, [1, 16, 32, 48, 64, 80, 96, 112, 128], "cuda", "float32"], {}], "config": {"index": 2278, "code_hash": null, "entity": [["tile_i", "ot", 16], ["tile_j", "ot", 16], ["tile_k", "ot", 16], ["order", "ot", 3]]}, "result": [[0.0048107195, 0.004811039499999999, 0.0048133755000000005], 0, 1.129098892211914, 1684252626.2008543], "version": 0.2, "tvm_version": "0.13.dev0"}
{"input": ["cuda -keys=cuda,gpu -arch=sm_75 -max_num_threads=1024 -thread_warp_size=32", "template_matmul", [900, 800, 700, [1, 16, 32, 48, 64, 80, 96, 112, 128], "cuda", "float32"], {}], "config": {"index": 2281, "code_hash": null, "entity": [["tile_i", "ot", 64], ["tile_j", "ot", 16], ["tile_k", "ot", 16], ["order", "ot", 3]]}, "result": [[0.0031764315, 0.0031787515000000002, 0.0031792155], 0, 1.0926635265350342, 1684252626.7250361], "version": 0.2, "tvm_version": "0.13.dev0"}
{"input": ["cuda -keys=cuda,gpu -arch=sm_75 -max_num_threads=1024 -thread_warp_size=32", "template_matmul", [900, 800, 700, [1, 16, 32, 48, 64, 80, 96, 112, 128], "cuda", "float32"], {}], "config": {"index": 2281, "code_hash": null, "entity": [["tile_i", "ot", 64], ["tile_j", "ot", 16], ["tile_k", "ot", 16], ["order", "ot", 3]]}, "result": [[0.003178112, 0.0031801915, 0.003181296], 0, 1.0635910034179688, 1684252627.2657506], "version": 0.2, "tvm_version": "0.13.dev0"}
{"input": ["cuda -keys=cuda,gpu -arch=sm_75 -max_num_threads=1024 -thread_warp_size=32", "template_matmul", [900, 800, 700, [1, 16, 32, 48, 64, 80, 96, 112, 128], "cuda", "float32"], {}], "config": {"index": 1794, "code_hash": null, "entity": [["tile_i", "ot", 48], ["tile_j", "ot", 16], ["tile_k", "ot", 64], ["order", "ot", 2]]}, "result": [[0.0148750875, 0.014876704000000001, 0.014893055499999999], 0, 1.3168179988861084, 1684252627.9466019], "version": 0.2, "tvm_version": "0.13.dev0"}
{"input": ["cuda -keys=cuda,gpu -arch=sm_75 -max_num_threads=1024 -thread_warp_size=32", "template_matmul", [900, 800, 700, [1, 16, 32, 48, 64, 80, 96, 112, 128], "cuda", "float32"], {}], "config": {"index": 823, "code_hash": null, "entity": [["tile_i", "ot", 64], ["tile_j", "ot", 16], ["tile_k", "ot", 16], ["order", "ot", 1]]}, "result": [[0.0031774719999999998, 0.0031784795, 0.0031795195], 0, 1.1779773235321045, 1684252628.489848], "version": 0.2, "tvm_version": "0.13.dev0"}
{"input": ["cuda -keys=cuda,gpu -arch=sm_75 -max_num_threads=1024 -thread_warp_size=32", "template_matmul", [900, 800, 700, [1, 16, 32, 48, 64, 80, 96, 112, 128], "cuda", "float32"], {}], "config": {"index": 84, "code_hash": null, "entity": [["tile_i", "ot", 48], ["tile_j", "ot", 1], ["tile_k", "ot", 16], ["order", "ot", 0]]}, "result": [[0.010868895500000001, 0.010877216, 0.010889488], 0, 1.2323648929595947, 1684252629.111156], "version": 0.2, "tvm_version": "0.13.dev0"}
{"input": ["cuda -keys=cuda,gpu -arch=sm_75 -max_num_threads=1024 -thread_warp_size=32", "template_matmul", [900, 800, 700, [1, 16, 32, 48, 64, 80, 96, 112, 128], "cuda", "float32"], {}], "config": {"index": 118, "code_hash": null, "entity": [["tile_i", "ot", 16], ["tile_j", "ot", 64], ["tile_k", "ot", 16], ["order", "ot", 0]]}, "result": [[0.0044256155000000005, 0.0044314075, 0.004431632], 0, 0.9356019496917725, 1684252630.2146287], "version": 0.2, "tvm_version": "0.13.dev0"}
{"input": ["cuda -keys=cuda,gpu -arch=sm_75 -max_num_threads=1024 -thread_warp_size=32", "template_matmul", [900, 800, 700, [1, 16, 32, 48, 64, 80, 96, 112, 128], "cuda", "float32"], {}], "config": {"index": 94, "code_hash": null, "entity": [["tile_i", "ot", 64], ["tile_j", "ot", 16], ["tile_k", "ot", 16], ["order", "ot", 0]]}, "result": [[0.003174688, 0.0031751839999999997, 0.0031770075], 0, 1.0043933391571045, 1684252630.7616127], "version": 0.2, "tvm_version": "0.13.dev0"}
{"input": ["cuda -keys=cuda,gpu -arch=sm_75 -max_num_threads=1024 -thread_warp_size=32", "template_matmul", [900, 800, 700, [1, 16, 32, 48, 64, 80, 96, 112, 128], "cuda", "float32"], {}], "config": {"index": 816, "code_hash": null, "entity": [["tile_i", "ot", 96], ["tile_j", "ot", 1], ["tile_k", "ot", 16], ["order", "ot", 1]]}, "result": [[0.0099580955, 0.009995264, 0.009997584], 0, 1.0420000553131104, 1684252631.3852937], "version": 0.2, "tvm_version": "0.13.dev0"}
{"input": ["cuda -keys=cuda,gpu -arch=sm_75 -max_num_threads=1024 -thread_warp_size=32", "template_matmul", [900, 800, 700, [1, 16, 32, 48, 64, 80, 96, 112, 128], "cuda", "float32"], {}], "config": {"index": 811, "code_hash": null, "entity": [["tile_i", "ot", 16], ["tile_j", "ot", 1], ["tile_k", "ot", 16], ["order", "ot", 1]]}, "result": [[0.0113825755, 0.0113837755, 0.0113911835], 0, 1.0507652759552002, 1684252632.031325], "version": 0.2, "tvm_version": "0.13.dev0"}
{"input": ["cuda -keys=cuda,gpu -arch=sm_75 -max_num_threads=1024 -thread_warp_size=32", "template_matmul", [900, 800, 700, [1, 16, 32, 48, 64, 80, 96, 112, 128], "cuda", "float32"], {}], "config": {"index": 1948, "code_hash": null, "entity": [["tile_i", "ot", 64], ["tile_j", "ot", 1], ["tile_k", "ot", 96], ["order", "ot", 2]]}, "result": [[0.011011072, 0.0111759355, 0.011182288], 0, 1.076972246170044, 1684252632.6594467], "version": 0.2, "tvm_version": "0.13.dev0"}
{"input": ["cuda -keys=cuda,gpu -arch=sm_75 -max_num_threads=1024 -thread_warp_size=32", "template_matmul", [900, 800, 700, [1, 16, 32, 48, 64, 80, 96, 112, 128], "cuda", "float32"], {}], "config": {"index": 2272, "code_hash": null, "entity": [["tile_i", "ot", 64], ["tile_j", "ot", 1], ["tile_k", "ot", 16], ["order", "ot", 3]]}, "result": [[0.0089420795, 0.009001744, 0.0090060795], 0, 1.024000883102417, 1684252633.2556186], "version": 0.2, "tvm_version": "0.13.dev0"}
