results/cuda_XGBTuner_mm.log
{"input": ["cuda -keys=cuda,gpu -arch=sm_75 -max_num_threads=1024 -thread_warp_size=32", "template_matmul", [900, 800, 700, [1, 16, 32, 48, 64, 80, 96, 112, 128], "cuda", "float32"], {}], "config": {"index": 2232, "code_hash": null, "entity": [["tile_i", "ot", 1], ["tile_j", "ot", 80], ["tile_k", "ot", 1], ["order", "ot", 3]]}, "result": [[0.113038528, 0.113082588, 0.117401535], 0, 2.2563531398773193, 1684252644.0258], "version": 0.2, "tvm_version": "0.13.dev0"}
{"input": ["cuda -keys=cuda,gpu -arch=sm_75 -max_num_threads=1024 -thread_warp_size=32", "template_matmul", [900, 800, 700, [1, 16, 32, 48, 64, 80, 96, 112, 128], "cuda", "float32"], {}], "config": {"index": 2685, "code_hash": null, "entity": [["tile_i", "ot", 48], ["tile_j", "ot", 16], ["tile_k", "ot", 96], ["order", "ot", 3]]}, "result": [[0.012919808, 0.012923631500000001, 0.012926591500000001], 0, 1.110525369644165, 1684252644.6816392], "version": 0.2, "tvm_version": "0.13.dev0"}
{"input": ["cuda -keys=cuda,gpu -arch=sm_75 -max_num_threads=1024 -thread_warp_size=32", "template_matmul", [900, 800, 700, [1, 16, 32, 48, 64, 80, 96, 112, 128], "cuda", "float32"], {}], "config": {"index": 855, "code_hash": null, "entity": [["tile_i", "ot", 1], ["tile_j", "ot", 80], ["tile_k", "ot", 16], ["order", "ot", 1]]}, "result": [[0.0449443855, 0.0449461135, 0.044951553], 0, 1.4561553001403809, 1684252645.659096], "version": 0.2, "tvm_version": "0.13.dev0"}
{"input": ["cuda -keys=cuda,gpu -arch=sm_75 -max_num_threads=1024 -thread_warp_size=32", "template_matmul", [900, 800, 700, [1, 16, 32, 48, 64, 80, 96, 112, 128], "cuda", "float32"], {}], "config": {"index": 2782, "code_hash": null, "entity": [["tile_i", "ot", 16], ["tile_j", "ot", 48], ["tile_k", "ot", 112], ["order", "ot", 3]]}, "result": [[0.0128211675, 0.012823552, 0.0128541915], 0, 1.1365289688110352, 1684252646.2882736], "version": 0.2, "tvm_version": "0.13.dev0"}
{"input": ["cuda -keys=cuda,gpu -arch=sm_75 -max_num_threads=1024 -thread_warp_size=32", "template_matmul", [900, 800, 700, [1, 16, 32, 48, 64, 80, 96, 112, 128], "cuda", "float32"], {}], "config": {"index": 1368, "code_hash": null, "entity": [["tile_i", "ot", 1], ["tile_j", "ot", 128], ["tile_k", "ot", 112], ["order", "ot", 1]]}, "result": [[0.12071337850000001, 0.123289215, 0.12332032], 0, 2.3216755390167236, 1684252648.1094732], "version": 0.2, "tvm_version": "0.13.dev0"}
{"input": ["cuda -keys=cuda,gpu -arch=sm_75 -max_num_threads=1024 -thread_warp_size=32", "template_matmul", [900, 800, 700, [1, 16, 32, 48, 64, 80, 96, 112, 128], "cuda", "float32"], {}], "config": {"index": 3098, "code_hash": null, "entity": [["tile_i", "ot", 32], ["tile_j", "ot", 32], ["tile_k", "ot", 32], ["order", "ot", 4]]}, "result": [[0.034124767, 0.0341462095, 0.036541183], 0, 1.1816174983978271, 1684252649.463785], "version": 0.2, "tvm_version": "0.13.dev0"}
{"input": ["cuda -keys=cuda,gpu -arch=sm_75 -max_num_threads=1024 -thread_warp_size=32", "template_matmul", [900, 800, 700, [1, 16, 32, 48, 64, 80, 96, 112, 128], "cuda", "float32"], {}], "config": {"index": 1712, "code_hash": null, "entity": [["tile_i", "ot", 32], ["tile_j", "ot", 16], ["tile_k", "ot", 48], ["order", "ot", 2]]}, "result": [[0.009507472, 0.00950784, 0.010214032], 0, 0.9229929447174072, 1684252650.0636568], "version": 0.2, "tvm_version": "0.13.dev0"}
{"input": ["cuda -keys=cuda,gpu -arch=sm_75 -max_num_threads=1024 -thread_warp_size=32", "template_matmul", [900, 800, 700, [1, 16, 32, 48, 64, 80, 96, 112, 128], "cuda", "float32"], {}], "config": {"index": 1946, "code_hash": null, "entity": [["tile_i", "ot", 32], ["tile_j", "ot", 1], ["tile_k", "ot", 96], ["order", "ot", 2]]}, "result": [[0.018253839, 0.018273279, 0.0182791995], 0, 1.0428626537322998, 1684252650.7741425], "version": 0.2, "tvm_version": "0.13.dev0"}
{"input": ["cuda -keys=cuda,gpu -arch=sm_75 -max_num_threads=1024 -thread_warp_size=32", "template_matmul", [900, 800, 700, [1, 16, 32, 48, 64, 80, 96, 112, 128], "cuda", "float32"], {}], "config": {"index": 4139, "code_hash": null, "entity": [["tile_i", "ot", 128], ["tile_j", "ot", 1], ["tile_k", "ot", 96], ["order", "ot", 5]]}, "result": [[0.028793695, 0.0289476315, 0.028992336], 0, 1.1907720565795898, 1684252652.236203], "version": 0.2, "tvm_version": "0.13.dev0"}
{"input": ["cuda -keys=cuda,gpu -arch=sm_75 -max_num_threads=1024 -thread_warp_size=32", "template_matmul", [900, 800, 700, [1, 16, 32, 48, 64, 80, 96, 112, 128], "cuda", "float32"], {}], "config": {"index": 2692, "code_hash": null, "entity": [["tile_i", "ot", 16], ["tile_j", "ot", 32], ["tile_k", "ot", 96], ["order", "ot", 3]]}, "result": [[0.011440879499999999, 0.011442416, 0.011500399500000001], 0, 1.0301668643951416, 1684252652.8522866], "version": 0.2, "tvm_version": "0.13.dev0"}
{"input": ["cuda -keys=cuda,gpu -arch=sm_75 -max_num_threads=1024 -thread_warp_size=32", "template_matmul", [900, 800, 700, [1, 16, 32, 48, 64, 80, 96, 112, 128], "cuda", "float32"], {}], "config": {"index": 895, "code_hash": null, "entity": [["tile_i", "ot", 64], ["tile_j", "ot", 1], ["tile_k", "ot", 32], ["order", "ot", 1]]}, "result": [[0.009292127499999999, 0.0094446715, 0.009454767999999999], 0, 0.9941256046295166, 1684252653.444582], "version": 0.2, "tvm_version": "0.13.dev0"}
{"input": ["cuda -keys=cuda,gpu -arch=sm_75 -max_num_threads=1024 -thread_warp_size=32", "template_matmul", [900, 800, 700, [1, 16, 32, 48, 64, 80, 96, 112, 128], "cuda", "float32"], {}], "config": {"index": 3890, "code_hash": null, "entity": [["tile_i", "ot", 32], ["tile_j", "ot", 1], ["tile_k", "ot", 48], ["order", "ot", 5]]}, "result": [[0.058079807000000004, 0.0595332485, 0.059729919], 0, 1.6257927417755127, 1684252654.5793343], "version": 0.2, "tvm_version": "0.13.dev0"}
{"input": ["cuda -keys=cuda,gpu -arch=sm_75 -max_num_threads=1024 -thread_warp_size=32", "template_matmul", [900, 800, 700, [1, 16, 32, 48, 64, 80, 96, 112, 128], "cuda", "float32"], {}], "config": {"index": 3528, "code_hash": null, "entity": [["tile_i", "ot", 1], ["tile_j", "ot", 80], ["tile_k", "ot", 112], ["order", "ot", 4]]}, "result": [[0.1755330505, 0.17653187550000002, 0.183708923], 0, 2.9592010974884033, 1684252657.054399], "version": 0.2, "tvm_version": "0.13.dev0"}
{"input": ["cuda -keys=cuda,gpu -arch=sm_75 -max_num_threads=1024 -thread_warp_size=32", "template_matmul", [900, 800, 700, [1, 16, 32, 48, 64, 80, 96, 112, 128], "cuda", "float32"], {}], "config": {"index": 1948, "code_hash": null, "entity": [["tile_i", "ot", 64], ["tile_j", "ot", 1], ["tile_k", "ot", 96], ["order", "ot", 2]]}, "result": [[0.0118116635, 0.012629808000000001, 0.0128338075], 0, 1.0422124862670898, 1684252657.7072732], "version": 0.2, "tvm_version": "0.13.dev0"}
{"input": ["cuda -keys=cuda,gpu -arch=sm_75 -max_num_threads=1024 -thread_warp_size=32", "template_matmul", [900, 800, 700, [1, 16, 32, 48, 64, 80, 96, 112, 128], "cuda", "float32"], {}], "config": {"index": 2178, "code_hash": null, "entity": [["tile_i", "ot", 1], ["tile_j", "ot", 128], ["tile_k", "ot", 128], ["order", "ot", 2]]}, "result": [[0.1206327055, 0.12066201750000001, 0.12142265299999999], 0, 2.2817330360412598, 1684252660.1370375], "version": 0.2, "tvm_version": "0.13.dev0"}
{"input": ["cuda -keys=cuda,gpu -arch=sm_75 -max_num_threads=1024 -thread_warp_size=32", "template_matmul", [900, 800, 700, [1, 16, 32, 48, 64, 80, 96, 112, 128], "cuda", "float32"], {}], "config": {"index": 3982, "code_hash": null, "entity": [["tile_i", "ot", 64], ["tile_j", "ot", 16], ["tile_k", "ot", 64], ["order", "ot", 5]]}, "result": [[0.036745697, 0.0367503355, 0.036785151999999995], 0, 1.3580658435821533, 1684252661.0269837], "version": 0.2, "tvm_version": "0.13.dev0"}
{"input": ["cuda -keys=cuda,gpu -arch=sm_75 -max_num_threads=1024 -thread_warp_size=32", "template_matmul", [900, 800, 700, [1, 16, 32, 48, 64, 80, 96, 112, 128], "cuda", "float32"], {}], "config": {"index": 3260, "code_hash": null, "entity": [["tile_i", "ot", 32], ["tile_j", "ot", 32], ["tile_k", "ot", 64], ["order", "ot", 4]]}, "result": [[0.0363427845, 0.0363429905, 0.0363653105], 0, 1.3999371528625488, 1684252661.9213345], "version": 0.2, "tvm_version": "0.13.dev0"}
{"input": ["cuda -keys=cuda,gpu -arch=sm_75 -max_num_threads=1024 -thread_warp_size=32", "template_matmul", [900, 800, 700, [1, 16, 32, 48, 64, 80, 96, 112, 128], "cuda", "float32"], {}], "config": {"index": 1786, "code_hash": null, "entity": [["tile_i", "ot", 64], ["tile_j", "ot", 1], ["tile_k", "ot", 64], ["order", "ot", 2]]}, "result": [[0.0098191355, 0.0098772315, 0.009887408], 0, 1.0979278087615967, 1684252662.5316434], "version": 0.2, "tvm_version": "0.13.dev0"}
{"input": ["cuda -keys=cuda,gpu -arch=sm_75 -max_num_threads=1024 -thread_warp_size=32", "template_matmul", [900, 800, 700, [1, 16, 32, 48, 64, 80, 96, 112, 128], "cuda", "float32"], {}], "config": {"index": 3978, "code_hash": null, "entity": [["tile_i", "ot", 1], ["tile_j", "ot", 16], ["tile_k", "ot", 64], ["order", "ot", 5]]}, "result": [[0.1172809905, 0.11728691100000001, 0.1173094405], 0, 2.2294976711273193, 1684252664.3284495], "version": 0.2, "tvm_version": "0.13.dev0"}
{"input": ["cuda -keys=cuda,gpu -arch=sm_75 -max_num_threads=1024 -thread_warp_size=32", "template_matmul", [900, 800, 700, [1, 16, 32, 48, 64, 80, 96, 112, 128], "cuda", "float32"], {}], "config": {"index": 1143, "code_hash": null, "entity": [["tile_i", "ot", 1], ["tile_j", "ot", 16], ["tile_k", "ot", 80], ["order", "ot", 1]]}, "result": [[0.0872806395, 0.087284332, 0.088138397], 0, 1.9387331008911133, 1684252665.8020463], "version": 0.2, "tvm_version": "0.13.dev0"}
{"input": ["cuda -keys=cuda,gpu -arch=sm_75 -max_num_threads=1024 -thread_warp_size=32", "template_matmul", [900, 800, 700, [1, 16, 32, 48, 64, 80, 96, 112, 128], "cuda", "float32"], {}], "config": {"index": 3177, "code_hash": null, "entity": [["tile_i", "ot", 1], ["tile_j", "ot", 32], ["tile_k", "ot", 48], ["order", "ot", 4]]}, "result": [[0.1393961485, 0.14035681149999998, 0.14305732699999998], 0, 2.5260884761810303, 1684252667.8457088], "version": 0.2, "tvm_version": "0.13.dev0"}
{"input": ["cuda -keys=cuda,gpu -arch=sm_75 -max_num_threads=1024 -thread_warp_size=32", "template_matmul", [900, 800, 700, [1, 16, 32, 48, 64, 80, 96, 112, 128], "cuda", "float32"], {}], "config": {"index": 2674, "code_hash": null, "entity": [["tile_i", "ot", 16], ["tile_j", "ot", 1], ["tile_k", "ot", 96], ["order", "ot", 3]]}, "result": [[0.035973953, 0.040187904, 0.041531391], 0, 1.7848443984985352, 1684252674.8285291], "version": 0.2, "tvm_version": "0.13.dev0"}
{"input": ["cuda -keys=cuda,gpu -arch=sm_75 -max_num_threads=1024 -thread_warp_size=32", "template_matmul", [900, 800, 700, [1, 16, 32, 48, 64, 80, 96, 112, 128], "cuda", "float32"], {}], "config": {"index": 2511, "code_hash": null, "entity": [["tile_i", "ot", 1], ["tile_j", "ot", 1], ["tile_k", "ot", 64], ["order", "ot", 3]]}, "result": [[0.147658752, 0.147728378, 0.14775036600000002], 0, 2.9315710067749023, 1684252676.968878], "version": 0.2, "tvm_version": "0.13.dev0"}
{"input": ["cuda -keys=cuda,gpu -arch=sm_75 -max_num_threads=1024 -thread_warp_size=32", "template_matmul", [900, 800, 700, [1, 16, 32, 48, 64, 80, 96, 112, 128], "cuda", "float32"], {}], "config": {"index": 2673, "code_hash": null, "entity": [["tile_i", "ot", 1], ["tile_j", "ot", 1], ["tile_k", "ot", 96], ["order", "ot", 3]]}, "result": [[0.1522583005, 0.152266281, 0.152267776], 0, 3.0073490142822266, 1684252679.149731], "version": 0.2, "tvm_version": "0.13.dev0"}
{"input": ["cuda -keys=cuda,gpu -arch=sm_75 -max_num_threads=1024 -thread_warp_size=32", "template_matmul", [900, 800, 700, [1, 16, 32, 48, 64, 80, 96, 112, 128], "cuda", "float32"], {}], "config": {"index": 2835, "code_hash": null, "entity": [["tile_i", "ot", 1], ["tile_j", "ot", 1], ["tile_k", "ot", 128], ["order", "ot", 3]]}, "result": [[0.15639537, 0.15653916899999998, 0.15659213249999998], 0, 3.070063591003418, 1684252681.3947144], "version": 0.2, "tvm_version": "0.13.dev0"}
{"input": ["cuda -keys=cuda,gpu -arch=sm_75 -max_num_threads=1024 -thread_warp_size=32", "template_matmul", [900, 800, 700, [1, 16, 32, 48, 64, 80, 96, 112, 128], "cuda", "float32"], {}], "config": {"index": 2754, "code_hash": null, "entity": [["tile_i", "ot", 1], ["tile_j", "ot", 1], ["tile_k", "ot", 112], ["order", "ot", 3]]}, "result": [[0.1565880275, 0.156617294, 0.157236221], 0, 3.0530407428741455, 1684252683.6193812], "version": 0.2, "tvm_version": "0.13.dev0"}
{"input": ["cuda -keys=cuda,gpu -arch=sm_75 -max_num_threads=1024 -thread_warp_size=32", "template_matmul", [900, 800, 700, [1, 16, 32, 48, 64, 80, 96, 112, 128], "cuda", "float32"], {}], "config": {"index": 1782, "code_hash": null, "entity": [["tile_i", "ot", 1], ["tile_j", "ot", 1], ["tile_k", "ot", 64], ["order", "ot", 2]]}, "result": [[0.147653625, 0.1477212215, 0.1477251125], 0, 2.911202907562256, 1684252685.7376742], "version": 0.2, "tvm_version": "0.13.dev0"}
{"input": ["cuda -keys=cuda,gpu -arch=sm_75 -max_num_threads=1024 -thread_warp_size=32", "template_matmul", [900, 800, 700, [1, 16, 32, 48, 64, 80, 96, 112, 128], "cuda", "float32"], {}], "config": {"index": 2512, "code_hash": null, "entity": [["tile_i", "ot", 16], ["tile_j", "ot", 1], ["tile_k", "ot", 64], ["order", "ot", 3]]}, "result": [[0.0355823665, 0.038068687, 0.038751377], 0, 1.7447974681854248, 1684252686.6475432], "version": 0.2, "tvm_version": "0.13.dev0"}
{"input": ["cuda -keys=cuda,gpu -arch=sm_75 -max_num_threads=1024 -thread_warp_size=32", "template_matmul", [900, 800, 700, [1, 16, 32, 48, 64, 80, 96, 112, 128], "cuda", "float32"], {}], "config": {"index": 2675, "code_hash": null, "entity": [["tile_i", "ot", 32], ["tile_j", "ot", 1], ["tile_k", "ot", 96], ["order", "ot", 3]]}, "result": [[0.018220511999999998, 0.0182234725, 0.018230272], 0, 1.517185926437378, 1684252687.362116], "version": 0.2, "tvm_version": "0.13.dev0"}
{"input": ["cuda -keys=cuda,gpu -arch=sm_75 -max_num_threads=1024 -thread_warp_size=32", "template_matmul", [900, 800, 700, [1, 16, 32, 48, 64, 80, 96, 112, 128], "cuda", "float32"], {}], "config": {"index": 2836, "code_hash": null, "entity": [["tile_i", "ot", 16], ["tile_j", "ot", 1], ["tile_k", "ot", 128], ["order", "ot", 3]]}, "result": [[0.0360456005, 0.0360486715, 0.036083694], 0, 1.717883586883545, 1684252688.2540264], "version": 0.2, "tvm_version": "0.13.dev0"}
{"input": ["cuda -keys=cuda,gpu -arch=sm_75 -max_num_threads=1024 -thread_warp_size=32", "template_matmul", [900, 800, 700, [1, 16, 32, 48, 64, 80, 96, 112, 128], "cuda", "float32"], {}], "config": {"index": 2755, "code_hash": null, "entity": [["tile_i", "ot", 16], ["tile_j", "ot", 1], ["tile_k", "ot", 112], ["order", "ot", 3]]}, "result": [[0.0360537755, 0.0360563505, 0.036059135], 0, 1.7542877197265625, 1684252689.1677227], "version": 0.2, "tvm_version": "0.13.dev0"}
{"input": ["cuda -keys=cuda,gpu -arch=sm_75 -max_num_threads=1024 -thread_warp_size=32", "template_matmul", [900, 800, 700, [1, 16, 32, 48, 64, 80, 96, 112, 128], "cuda", "float32"], {}], "config": {"index": 2593, "code_hash": null, "entity": [["tile_i", "ot", 16], ["tile_j", "ot", 1], ["tile_k", "ot", 80], ["order", "ot", 3]]}, "result": [[0.035869517999999996, 0.0358695525, 0.0358931995], 0, 1.7145941257476807, 1684252690.049596], "version": 0.2, "tvm_version": "0.13.dev0"}
{"input": ["cuda -keys=cuda,gpu -arch=sm_75 -max_num_threads=1024 -thread_warp_size=32", "template_matmul", [900, 800, 700, [1, 16, 32, 48, 64, 80, 96, 112, 128], "cuda", "float32"], {}], "config": {"index": 2592, "code_hash": null, "entity": [["tile_i", "ot", 1], ["tile_j", "ot", 1], ["tile_k", "ot", 80], ["order", "ot", 3]]}, "result": [[0.097577171, 0.09759182699999999, 0.097676193], 0, 2.404653310775757, 1684252691.6194854], "version": 0.2, "tvm_version": "0.13.dev0"}
{"input": ["cuda -keys=cuda,gpu -arch=sm_75 -max_num_threads=1024 -thread_warp_size=32", "template_matmul", [900, 800, 700, [1, 16, 32, 48, 64, 80, 96, 112, 128], "cuda", "float32"], {}], "config": {"index": 2431, "code_hash": null, "entity": [["tile_i", "ot", 16], ["tile_j", "ot", 1], ["tile_k", "ot", 48], ["order", "ot", 3]]}, "result": [[0.03535667, 0.03535939, 0.0353618735], 0, 1.687304973602295, 1684252692.5107796], "version": 0.2, "tvm_version": "0.13.dev0"}
{"input": ["cuda -keys=cuda,gpu -arch=sm_75 -max_num_threads=1024 -thread_warp_size=32", "template_matmul", [900, 800, 700, [1, 16, 32, 48, 64, 80, 96, 112, 128], "cuda", "float32"], {}], "config": {"index": 324, "code_hash": null, "entity": [["tile_i", "ot", 1], ["tile_j", "ot", 1], ["tile_k", "ot", 64], ["order", "ot", 0]]}, "result": [[0.147662857, 0.1476987455, 0.14775028950000002], 0, 2.9456324577331543, 1684252694.6363218], "version": 0.2, "tvm_version": "0.13.dev0"}
{"input": ["cuda -keys=cuda,gpu -arch=sm_75 -max_num_threads=1024 -thread_warp_size=32", "template_matmul", [900, 800, 700, [1, 16, 32, 48, 64, 80, 96, 112, 128], "cuda", "float32"], {}], "config": {"index": 2430, "code_hash": null, "entity": [["tile_i", "ot", 1], ["tile_j", "ot", 1], ["tile_k", "ot", 48], ["order", "ot", 3]]}, "result": [[0.147298309, 0.1473359375, 0.1474427795], 0, 2.9090099334716797, 1684252696.7571785], "version": 0.2, "tvm_version": "0.13.dev0"}
{"input": ["cuda -keys=cuda,gpu -arch=sm_75 -max_num_threads=1024 -thread_warp_size=32", "template_matmul", [900, 800, 700, [1, 16, 32, 48, 64, 80, 96, 112, 128], "cuda", "float32"], {}], "config": {"index": 2683, "code_hash": null, "entity": [["tile_i", "ot", 16], ["tile_j", "ot", 16], ["tile_k", "ot", 96], ["order", "ot", 3]]}, "result": [[0.0111616, 0.0111743515, 0.011223727999999999], 0, 1.4597163200378418, 1684252697.3852484], "version": 0.2, "tvm_version": "0.13.dev0"}
{"input": ["cuda -keys=cuda,gpu -arch=sm_75 -max_num_threads=1024 -thread_warp_size=32", "template_matmul", [900, 800, 700, [1, 16, 32, 48, 64, 80, 96, 112, 128], "cuda", "float32"], {}], "config": {"index": 2350, "code_hash": null, "entity": [["tile_i", "ot", 16], ["tile_j", "ot", 1], ["tile_k", "ot", 32], ["order", "ot", 3]]}, "result": [[0.009979904, 0.009980048, 0.010048607499999999], 0, 1.3736166954040527, 1684252698.9123404], "version": 0.2, "tvm_version": "0.13.dev0"}
{"input": ["cuda -keys=cuda,gpu -arch=sm_75 -max_num_threads=1024 -thread_warp_size=32", "template_matmul", [900, 800, 700, [1, 16, 32, 48, 64, 80, 96, 112, 128], "cuda", "float32"], {}], "config": {"index": 2349, "code_hash": null, "entity": [["tile_i", "ot", 1], ["tile_j", "ot", 1], ["tile_k", "ot", 32], ["order", "ot", 3]]}, "result": [[0.0953030545, 0.0953140945, 0.09533132899999999], 0, 2.340411424636841, 1684252700.4885662], "version": 0.2, "tvm_version": "0.13.dev0"}
{"input": ["cuda -keys=cuda,gpu -arch=sm_75 -max_num_threads=1024 -thread_warp_size=32", "template_matmul", [900, 800, 700, [1, 16, 32, 48, 64, 80, 96, 112, 128], "cuda", "float32"], {}], "config": {"index": 2513, "code_hash": null, "entity": [["tile_i", "ot", 32], ["tile_j", "ot", 1], ["tile_k", "ot", 64], ["order", "ot", 3]]}, "result": [[0.018111488000000002, 0.018115583, 0.018118656], 0, 1.4952878952026367, 1684252701.201859], "version": 0.2, "tvm_version": "0.13.dev0"}
{"input": ["cuda -keys=cuda,gpu -arch=sm_75 -max_num_threads=1024 -thread_warp_size=32", "template_matmul", [900, 800, 700, [1, 16, 32, 48, 64, 80, 96, 112, 128], "cuda", "float32"], {}], "config": {"index": 2188, "code_hash": null, "entity": [["tile_i", "ot", 16], ["tile_j", "ot", 1], ["tile_k", "ot", 1], ["order", "ot", 3]]}, "result": [[0.039091007, 0.040060927999999996, 0.040128513], 0, 1.6878197193145752, 1684252702.1553314], "version": 0.2, "tvm_version": "0.13.dev0"}
{"input": ["cuda -keys=cuda,gpu -arch=sm_75 -max_num_threads=1024 -thread_warp_size=32", "template_matmul", [900, 800, 700, [1, 16, 32, 48, 64, 80, 96, 112, 128], "cuda", "float32"], {}], "config": {"index": 2187, "code_hash": null, "entity": [["tile_i", "ot", 1], ["tile_j", "ot", 1], ["tile_k", "ot", 1], ["order", "ot", 3]]}, "result": [[0.096604156, 0.09794150500000001, 0.0984524765], 0, 2.3485498428344727, 1684252703.7589731], "version": 0.2, "tvm_version": "0.13.dev0"}
{"input": ["cuda -keys=cuda,gpu -arch=sm_75 -max_num_threads=1024 -thread_warp_size=32", "template_matmul", [900, 800, 700, [1, 16, 32, 48, 64, 80, 96, 112, 128], "cuda", "float32"], {}], "config": {"index": 1783, "code_hash": null, "entity": [["tile_i", "ot", 16], ["tile_j", "ot", 1], ["tile_k", "ot", 64], ["order", "ot", 2]]}, "result": [[0.0355505445, 0.035563247500000006, 0.035572559], 0, 1.662466287612915, 1684252704.6714818], "version": 0.2, "tvm_version": "0.13.dev0"}
{"input": ["cuda -keys=cuda,gpu -arch=sm_75 -max_num_threads=1024 -thread_warp_size=32", "template_matmul", [900, 800, 700, [1, 16, 32, 48, 64, 80, 96, 112, 128], "cuda", "float32"], {}], "config": {"index": 1784, "code_hash": null, "entity": [["tile_i", "ot", 32], ["tile_j", "ot", 1], ["tile_k", "ot", 64], ["order", "ot", 2]]}, "result": [[0.018151327, 0.0196881595, 0.019801263500000003], 0, 1.5351977348327637, 1684252705.4205225], "version": 0.2, "tvm_version": "0.13.dev0"}
{"input": ["cuda -keys=cuda,gpu -arch=sm_75 -max_num_threads=1024 -thread_warp_size=32", "template_matmul", [900, 800, 700, [1, 16, 32, 48, 64, 80, 96, 112, 128], "cuda", "float32"], {}], "config": {"index": 891, "code_hash": null, "entity": [["tile_i", "ot", 1], ["tile_j", "ot", 1], ["tile_k", "ot", 32], ["order", "ot", 1]]}, "result": [[0.095289726, 0.09529241899999999, 0.0952959365], 0, 2.3341052532196045, 1684252706.9923344], "version": 0.2, "tvm_version": "0.13.dev0"}
{"input": ["cuda -keys=cuda,gpu -arch=sm_75 -max_num_threads=1024 -thread_warp_size=32", "template_matmul", [900, 800, 700, [1, 16, 32, 48, 64, 80, 96, 112, 128], "cuda", "float32"], {}], "config": {"index": 2682, "code_hash": null, "entity": [["tile_i", "ot", 1], ["tile_j", "ot", 16], ["tile_k", "ot", 96], ["order", "ot", 3]]}, "result": [[0.102498352, 0.10326220700000001, 0.10452243], 0, 2.428990364074707, 1684252708.6213946], "version": 0.2, "tvm_version": "0.13.dev0"}
{"input": ["cuda -keys=cuda,gpu -arch=sm_75 -max_num_threads=1024 -thread_warp_size=32", "template_matmul", [900, 800, 700, [1, 16, 32, 48, 64, 80, 96, 112, 128], "cuda", "float32"], {}], "config": {"index": 892, "code_hash": null, "entity": [["tile_i", "ot", 16], ["tile_j", "ot", 1], ["tile_k", "ot", 32], ["order", "ot", 1]]}, "result": [[0.009173888, 0.0092642555, 0.009335136], 0, 1.3712224960327148, 1684252709.2131], "version": 0.2, "tvm_version": "0.13.dev0"}
{"input": ["cuda -keys=cuda,gpu -arch=sm_75 -max_num_threads=1024 -thread_warp_size=32", "template_matmul", [900, 800, 700, [1, 16, 32, 48, 64, 80, 96, 112, 128], "cuda", "float32"], {}], "config": {"index": 2440, "code_hash": null, "entity": [["tile_i", "ot", 16], ["tile_j", "ot", 16], ["tile_k", "ot", 48], ["order", "ot", 3]]}, "result": [[0.010901616000000001, 0.0109375675, 0.0109485435], 0, 1.4209253787994385, 1684252709.857083], "version": 0.2, "tvm_version": "0.13.dev0"}
{"input": ["cuda -keys=cuda,gpu -arch=sm_75 -max_num_threads=1024 -thread_warp_size=32", "template_matmul", [900, 800, 700, [1, 16, 32, 48, 64, 80, 96, 112, 128], "cuda", "float32"], {}], "config": {"index": 2269, "code_hash": null, "entity": [["tile_i", "ot", 16], ["tile_j", "ot", 1], ["tile_k", "ot", 16], ["order", "ot", 3]]}, "result": [[0.0111845435, 0.011185152, 0.0112108], 0, 1.3981742858886719, 1684252710.4757242], "version": 0.2, "tvm_version": "0.13.dev0"}
{"input": ["cuda -keys=cuda,gpu -arch=sm_75 -max_num_threads=1024 -thread_warp_size=32", "template_matmul", [900, 800, 700, [1, 16, 32, 48, 64, 80, 96, 112, 128], "cuda", "float32"], {}], "config": {"index": 2268, "code_hash": null, "entity": [["tile_i", "ot", 1], ["tile_j", "ot", 1], ["tile_k", "ot", 16], ["order", "ot", 3]]}, "result": [[0.09655603, 0.0965919035, 0.0966081465], 0, 2.3387765884399414, 1684252712.035889], "version": 0.2, "tvm_version": "0.13.dev0"}
{"input": ["cuda -keys=cuda,gpu -arch=sm_75 -max_num_threads=1024 -thread_warp_size=32", "template_matmul", [900, 800, 700, [1, 16, 32, 48, 64, 80, 96, 112, 128], "cuda", "float32"], {}], "config": {"index": 2677, "code_hash": null, "entity": [["tile_i", "ot", 64], ["tile_j", "ot", 1], ["tile_k", "ot", 96], ["order", "ot", 3]]}, "result": [[0.011745519500000001, 0.012173824, 0.012245984], 0, 1.4078683853149414, 1684252712.661651], "version": 0.2, "tvm_version": "0.13.dev0"}
{"input": ["cuda -keys=cuda,gpu -arch=sm_75 -max_num_threads=1024 -thread_warp_size=32", "template_matmul", [900, 800, 700, [1, 16, 32, 48, 64, 80, 96, 112, 128], "cuda", "float32"], {}], "config": {"index": 2439, "code_hash": null, "entity": [["tile_i", "ot", 1], ["tile_j", "ot", 16], ["tile_k", "ot", 48], ["order", "ot", 3]]}, "result": [[0.09866854050000001, 0.099190353, 0.10269516749999999], 0, 2.3754489421844482, 1684252714.2589064], "version": 0.2, "tvm_version": "0.13.dev0"}
{"input": ["cuda -keys=cuda,gpu -arch=sm_75 -max_num_threads=1024 -thread_warp_size=32", "template_matmul", [900, 800, 700, [1, 16, 32, 48, 64, 80, 96, 112, 128], "cuda", "float32"], {}], "config": {"index": 486, "code_hash": null, "entity": [["tile_i", "ot", 1], ["tile_j", "ot", 1], ["tile_k", "ot", 96], ["order", "ot", 0]]}, "result": [[0.154690628, 0.162088821, 0.162433029], 0, 3.010511636734009, 1684252716.5089438], "version": 0.2, "tvm_version": "0.13.dev0"}
{"input": ["cuda -keys=cuda,gpu -arch=sm_75 -max_num_threads=1024 -thread_warp_size=32", "template_matmul", [900, 800, 700, [1, 16, 32, 48, 64, 80, 96, 112, 128], "cuda", "float32"], {}], "config": {"index": 2676, "code_hash": null, "entity": [["tile_i", "ot", 48], ["tile_j", "ot", 1], ["tile_k", "ot", 96], ["order", "ot", 3]]}, "result": [[0.0147088315, 0.0151066235, 0.0154708], 0, 1.5641016960144043, 1684252718.2819626], "version": 0.2, "tvm_version": "0.13.dev0"}
{"input": ["cuda -keys=cuda,gpu -arch=sm_75 -max_num_threads=1024 -thread_warp_size=32", "template_matmul", [900, 800, 700, [1, 16, 32, 48, 64, 80, 96, 112, 128], "cuda", "float32"], {}], "config": {"index": 648, "code_hash": null, "entity": [["tile_i", "ot", 1], ["tile_j", "ot", 1], ["tile_k", "ot", 128], ["order", "ot", 0]]}, "result": [[0.15785797099999999, 0.1607303465, 0.169310699], 0, 3.2716381549835205, 1684252720.6724536], "version": 0.2, "tvm_version": "0.13.dev0"}
{"input": ["cuda -keys=cuda,gpu -arch=sm_75 -max_num_threads=1024 -thread_warp_size=32", "template_matmul", [900, 800, 700, [1, 16, 32, 48, 64, 80, 96, 112, 128], "cuda", "float32"], {}], "config": {"index": 2837, "code_hash": null, "entity": [["tile_i", "ot", 32], ["tile_j", "ot", 1], ["tile_k", "ot", 128], ["order", "ot", 3]]}, "result": [[0.0201298885, 0.021043247, 0.0211098555], 0, 1.7298898696899414, 1684252721.4549944], "version": 0.2, "tvm_version": "0.13.dev0"}
{"input": ["cuda -keys=cuda,gpu -arch=sm_75 -max_num_threads=1024 -thread_warp_size=32", "template_matmul", [900, 800, 700, [1, 16, 32, 48, 64, 80, 96, 112, 128], "cuda", "float32"], {}], "config": {"index": 2756, "code_hash": null, "entity": [["tile_i", "ot", 32], ["tile_j", "ot", 1], ["tile_k", "ot", 112], ["order", "ot", 3]]}, "result": [[0.0201474075, 0.0201686725, 0.021040752000000003], 0, 1.71321439743042, 1684252722.2185242], "version": 0.2, "tvm_version": "0.13.dev0"}
{"input": ["cuda -keys=cuda,gpu -arch=sm_75 -max_num_threads=1024 -thread_warp_size=32", "template_matmul", [900, 800, 700, [1, 16, 32, 48, 64, 80, 96, 112, 128], "cuda", "float32"], {}], "config": {"index": 2844, "code_hash": null, "entity": [["tile_i", "ot", 1], ["tile_j", "ot", 16], ["tile_k", "ot", 128], ["order", "ot", 3]]}, "result": [[0.11598432149999999, 0.1170904005, 0.11712707500000001], 0, 2.755718946456909, 1684252744.7006702], "version": 0.2, "tvm_version": "0.13.dev0"}
{"input": ["cuda -keys=cuda,gpu -arch=sm_75 -max_num_threads=1024 -thread_warp_size=32", "template_matmul", [900, 800, 700, [1, 16, 32, 48, 64, 80, 96, 112, 128], "cuda", "float32"], {}], "config": {"index": 2763, "code_hash": null, "entity": [["tile_i", "ot", 1], ["tile_j", "ot", 16], ["tile_k", "ot", 112], ["order", "ot", 3]]}, "result": [[0.1039911495, 0.1045422055, 0.104872467], 0, 2.6420228481292725, 1684252746.4260514], "version": 0.2, "tvm_version": "0.13.dev0"}
{"input": ["cuda -keys=cuda,gpu -arch=sm_75 -max_num_threads=1024 -thread_warp_size=32", "template_matmul", [900, 800, 700, [1, 16, 32, 48, 64, 80, 96, 112, 128], "cuda", "float32"], {}], "config": {"index": 893, "code_hash": null, "entity": [["tile_i", "ot", 32], ["tile_j", "ot", 1], ["tile_k", "ot", 32], ["order", "ot", 1]]}, "result": [[0.0086681755, 0.0088842235, 0.008994976], 0, 1.5453693866729736, 1684252747.016426], "version": 0.2, "tvm_version": "0.13.dev0"}
{"input": ["cuda -keys=cuda,gpu -arch=sm_75 -max_num_threads=1024 -thread_warp_size=32", "template_matmul", [900, 800, 700, [1, 16, 32, 48, 64, 80, 96, 112, 128], "cuda", "float32"], {}], "config": {"index": 2351, "code_hash": null, "entity": [["tile_i", "ot", 32], ["tile_j", "ot", 1], ["tile_k", "ot", 32], ["order", "ot", 3]]}, "result": [[0.008378368, 0.008759296000000001, 0.008897312], 0, 1.5093731880187988, 1684252747.6245456], "version": 0.2, "tvm_version": "0.13.dev0"}
{"input": ["cuda -keys=cuda,gpu -arch=sm_75 -max_num_threads=1024 -thread_warp_size=32", "template_matmul", [900, 800, 700, [1, 16, 32, 48, 64, 80, 96, 112, 128], "cuda", "float32"], {}], "config": {"index": 2189, "code_hash": null, "entity": [["tile_i", "ot", 32], ["tile_j", "ot", 1], ["tile_k", "ot", 1], ["order", "ot", 3]]}, "result": [[0.0182953755, 0.0183052805, 0.018305744000000002], 0, 1.5917930603027344, 1684252748.3407583], "version": 0.2, "tvm_version": "0.13.dev0"}
{"input": ["cuda -keys=cuda,gpu -arch=sm_75 -max_num_threads=1024 -thread_warp_size=32", "template_matmul", [900, 800, 700, [1, 16, 32, 48, 64, 80, 96, 112, 128], "cuda", "float32"], {}], "config": {"index": 1703, "code_hash": null, "entity": [["tile_i", "ot", 32], ["tile_j", "ot", 1], ["tile_k", "ot", 48], ["order", "ot", 2]]}, "result": [[0.018023424, 0.018030416, 0.018030559499999998], 0, 1.6104233264923096, 1684252749.041938], "version": 0.2, "tvm_version": "0.13.dev0"}
{"input": ["cuda -keys=cuda,gpu -arch=sm_75 -max_num_threads=1024 -thread_warp_size=32", "template_matmul", [900, 800, 700, [1, 16, 32, 48, 64, 80, 96, 112, 128], "cuda", "float32"], {}], "config": {"index": 1702, "code_hash": null, "entity": [["tile_i", "ot", 16], ["tile_j", "ot", 1], ["tile_k", "ot", 48], ["order", "ot", 2]]}, "result": [[0.035343246, 0.035350288, 0.035351966500000005], 0, 1.7554521560668945, 1684252749.9229903], "version": 0.2, "tvm_version": "0.13.dev0"}
{"input": ["cuda -keys=cuda,gpu -arch=sm_75 -max_num_threads=1024 -thread_warp_size=32", "template_matmul", [900, 800, 700, [1, 16, 32, 48, 64, 80, 96, 112, 128], "cuda", "float32"], {}], "config": {"index": 1701, "code_hash": null, "entity": [["tile_i", "ot", 1], ["tile_j", "ot", 1], ["tile_k", "ot", 48], ["order", "ot", 2]]}, "result": [[0.147453781, 0.1474642025, 0.1486758575], 0, 3.075340509414673, 1684252752.0808508], "version": 0.2, "tvm_version": "0.13.dev0"}
{"input": ["cuda -keys=cuda,gpu -arch=sm_75 -max_num_threads=1024 -thread_warp_size=32", "template_matmul", [900, 800, 700, [1, 16, 32, 48, 64, 80, 96, 112, 128], "cuda", "float32"], {}], "config": {"index": 2515, "code_hash": null, "entity": [["tile_i", "ot", 64], ["tile_j", "ot", 1], ["tile_k", "ot", 64], ["order", "ot", 3]]}, "result": [[0.009902128, 0.009966480000000002, 0.010121215499999999], 0, 1.5393218994140625, 1684252752.7083764], "version": 0.2, "tvm_version": "0.13.dev0"}
{"input": ["cuda -keys=cuda,gpu -arch=sm_75 -max_num_threads=1024 -thread_warp_size=32", "template_matmul", [900, 800, 700, [1, 16, 32, 48, 64, 80, 96, 112, 128], "cuda", "float32"], {}], "config": {"index": 4132, "code_hash": null, "entity": [["tile_i", "ot", 16], ["tile_j", "ot", 1], ["tile_k", "ot", 96], ["order", "ot", 5]]}, "result": [[0.103888893, 0.103897102, 0.103905281], 0, 2.4764997959136963, 1684252754.3445082], "version": 0.2, "tvm_version": "0.13.dev0"}
{"input": ["cuda -keys=cuda,gpu -arch=sm_75 -max_num_threads=1024 -thread_warp_size=32", "template_matmul", [900, 800, 700, [1, 16, 32, 48, 64, 80, 96, 112, 128], "cuda", "float32"], {}], "config": {"index": 814, "code_hash": null, "entity": [["tile_i", "ot", 64], ["tile_j", "ot", 1], ["tile_k", "ot", 16], ["order", "ot", 1]]}, "result": [[0.008850432, 0.008925184, 0.009109840000000001], 0, 1.2783098220825195, 1684252755.7984607], "version": 0.2, "tvm_version": "0.13.dev0"}
{"input": ["cuda -keys=cuda,gpu -arch=sm_75 -max_num_threads=1024 -thread_warp_size=32", "template_matmul", [900, 800, 700, [1, 16, 32, 48, 64, 80, 96, 112, 128], "cuda", "float32"], {}], "config": {"index": 567, "code_hash": null, "entity": [["tile_i", "ot", 1], ["tile_j", "ot", 1], ["tile_k", "ot", 112], ["order", "ot", 0]]}, "result": [[0.1587832945, 0.15916674800000002, 0.1605345305], 0, 3.0404152870178223, 1684252758.1023972], "version": 0.2, "tvm_version": "0.13.dev0"}
{"input": ["cuda -keys=cuda,gpu -arch=sm_75 -max_num_threads=1024 -thread_warp_size=32", "template_matmul", [900, 800, 700, [1, 16, 32, 48, 64, 80, 96, 112, 128], "cuda", "float32"], {}], "config": {"index": 733, "code_hash": null, "entity": [["tile_i", "ot", 64], ["tile_j", "ot", 1], ["tile_k", "ot", 1], ["order", "ot", 1]]}, "result": [[0.009848832, 0.009849439500000001, 0.009872384], 0, 1.3173515796661377, 1684252758.7301135], "version": 0.2, "tvm_version": "0.13.dev0"}
{"input": ["cuda -keys=cuda,gpu -arch=sm_75 -max_num_threads=1024 -thread_warp_size=32", "template_matmul", [900, 800, 700, [1, 16, 32, 48, 64, 80, 96, 112, 128], "cuda", "float32"], {}], "config": {"index": 1944, "code_hash": null, "entity": [["tile_i", "ot", 1], ["tile_j", "ot", 1], ["tile_k", "ot", 96], ["order", "ot", 2]]}, "result": [[0.155696304, 0.15671925350000002, 0.15803698700000002], 0, 2.9256367683410645, 1684252781.4692438], "version": 0.2, "tvm_version": "0.13.dev0"}
{"input": ["cuda -keys=cuda,gpu -arch=sm_75 -max_num_threads=1024 -thread_warp_size=32", "template_matmul", [900, 800, 700, [1, 16, 32, 48, 64, 80, 96, 112, 128], "cuda", "float32"], {}], "config": {"index": 2684, "code_hash": null, "entity": [["tile_i", "ot", 32], ["tile_j", "ot", 16], ["tile_k", "ot", 96], ["order", "ot", 3]]}, "result": [[0.010087424000000001, 0.0101403835, 0.0101655995], 0, 1.388314962387085, 1684252782.1305852], "version": 0.2, "tvm_version": "0.13.dev0"}
{"input": ["cuda -keys=cuda,gpu -arch=sm_75 -max_num_threads=1024 -thread_warp_size=32", "template_matmul", [900, 800, 700, [1, 16, 32, 48, 64, 80, 96, 112, 128], "cuda", "float32"], {}], "config": {"index": 729, "code_hash": null, "entity": [["tile_i", "ot", 1], ["tile_j", "ot", 1], ["tile_k", "ot", 1], ["order", "ot", 1]]}, "result": [[0.0990095365, 0.099838333, 0.100092529], 0, 2.3034510612487793, 1684252783.7404087], "version": 0.2, "tvm_version": "0.13.dev0"}
{"input": ["cuda -keys=cuda,gpu -arch=sm_75 -max_num_threads=1024 -thread_warp_size=32", "template_matmul", [900, 800, 700, [1, 16, 32, 48, 64, 80, 96, 112, 128], "cuda", "float32"], {}], "config": {"index": 2432, "code_hash": null, "entity": [["tile_i", "ot", 32], ["tile_j", "ot", 1], ["tile_k", "ot", 48], ["order", "ot", 3]]}, "result": [[0.018329599000000002, 0.018337791, 0.018369535], 0, 1.4461376667022705, 1684252784.4787805], "version": 0.2, "tvm_version": "0.13.dev0"}
{"input": ["cuda -keys=cuda,gpu -arch=sm_75 -max_num_threads=1024 -thread_warp_size=32", "template_matmul", [900, 800, 700, [1, 16, 32, 48, 64, 80, 96, 112, 128], "cuda", "float32"], {}], "config": {"index": 2106, "code_hash": null, "entity": [["tile_i", "ot", 1], ["tile_j", "ot", 1], ["tile_k", "ot", 128], ["order", "ot", 2]]}, "result": [[0.161155624, 0.1611893005, 0.161257156], 0, 3.0277013778686523, 1684252786.75465], "version": 0.2, "tvm_version": "0.13.dev0"}
{"input": ["cuda -keys=cuda,gpu -arch=sm_75 -max_num_threads=1024 -thread_warp_size=32", "template_matmul", [900, 800, 700, [1, 16, 32, 48, 64, 80, 96, 112, 128], "cuda", "float32"], {}], "config": {"index": 810, "code_hash": null, "entity": [["tile_i", "ot", 1], ["tile_j", "ot", 1], ["tile_k", "ot", 16], ["order", "ot", 1]]}, "result": [[0.099185661, 0.0993000335, 0.09932390549999999], 0, 2.313995361328125, 1684252788.3737621], "version": 0.2, "tvm_version": "0.13.dev0"}
{"input": ["cuda -keys=cuda,gpu -arch=sm_75 -max_num_threads=1024 -thread_warp_size=32", "template_matmul", [900, 800, 700, [1, 16, 32, 48, 64, 80, 96, 112, 128], "cuda", "float32"], {}], "config": {"index": 1620, "code_hash": null, "entity": [["tile_i", "ot", 1], ["tile_j", "ot", 1], ["tile_k", "ot", 32], ["order", "ot", 2]]}, "result": [[0.09801409900000001, 0.1006684185, 0.1065588455], 0, 2.332773447036743, 1684252789.9995825], "version": 0.2, "tvm_version": "0.13.dev0"}
{"input": ["cuda -keys=cuda,gpu -arch=sm_75 -max_num_threads=1024 -thread_warp_size=32", "template_matmul", [900, 800, 700, [1, 16, 32, 48, 64, 80, 96, 112, 128], "cuda", "float32"], {}], "config": {"index": 2191, "code_hash": null, "entity": [["tile_i", "ot", 64], ["tile_j", "ot", 1], ["tile_k", "ot", 1], ["order", "ot", 3]]}, "result": [[0.010107904, 0.0101539675, 0.0101934555], 0, 1.3204519748687744, 1684252790.6294281], "version": 0.2, "tvm_version": "0.13.dev0"}
{"input": ["cuda -keys=cuda,gpu -arch=sm_75 -max_num_threads=1024 -thread_warp_size=32", "template_matmul", [900, 800, 700, [1, 16, 32, 48, 64, 80, 96, 112, 128], "cuda", "float32"], {}], "config": {"index": 980, "code_hash": null, "entity": [["tile_i", "ot", 128], ["tile_j", "ot", 1], ["tile_k", "ot", 48], ["order", "ot", 1]]}, "result": [[0.0105410555, 0.01057024, 0.010684319999999999], 0, 1.3288483619689941, 1684252791.2496238], "version": 0.2, "tvm_version": "0.13.dev0"}
{"input": ["cuda -keys=cuda,gpu -arch=sm_75 -max_num_threads=1024 -thread_warp_size=32", "template_matmul", [900, 800, 700, [1, 16, 32, 48, 64, 80, 96, 112, 128], "cuda", "float32"], {}], "config": {"index": 2353, "code_hash": null, "entity": [["tile_i", "ot", 64], ["tile_j", "ot", 1], ["tile_k", "ot", 32], ["order", "ot", 3]]}, "result": [[0.009781248, 0.009801728000000001, 0.0099520795], 0, 1.4747283458709717, 1684252799.5899763], "version": 0.2, "tvm_version": "0.13.dev0"}
{"input": ["cuda -keys=cuda,gpu -arch=sm_75 -max_num_threads=1024 -thread_warp_size=32", "template_matmul", [900, 800, 700, [1, 16, 32, 48, 64, 80, 96, 112, 128], "cuda", "float32"], {}], "config": {"index": 2272, "code_hash": null, "entity": [["tile_i", "ot", 64], ["tile_j", "ot", 1], ["tile_k", "ot", 16], ["order", "ot", 3]]}, "result": [[0.008892416, 0.0091179835, 0.009549936], 0, 1.4362778663635254, 1684252800.2263231], "version": 0.2, "tvm_version": "0.13.dev0"}
{"input": ["cuda -keys=cuda,gpu -arch=sm_75 -max_num_threads=1024 -thread_warp_size=32", "template_matmul", [900, 800, 700, [1, 16, 32, 48, 64, 80, 96, 112, 128], "cuda", "float32"], {}], "config": {"index": 812, "code_hash": null, "entity": [["tile_i", "ot", 32], ["tile_j", "ot", 1], ["tile_k", "ot", 16], ["order", "ot", 1]]}, "result": [[0.010873248, 0.0110853915, 0.011122688], 0, 1.429814338684082, 1684252800.8437412], "version": 0.2, "tvm_version": "0.13.dev0"}
{"input": ["cuda -keys=cuda,gpu -arch=sm_75 -max_num_threads=1024 -thread_warp_size=32", "template_matmul", [900, 800, 700, [1, 16, 32, 48, 64, 80, 96, 112, 128], "cuda", "float32"], {}], "config": {"index": 1624, "code_hash": null, "entity": [["tile_i", "ot", 64], ["tile_j", "ot", 1], ["tile_k", "ot", 32], ["order", "ot", 2]]}, "result": [[0.009437184, 0.00971576, 0.009986575999999999], 0, 1.4141712188720703, 1684252801.4751966], "version": 0.2, "tvm_version": "0.13.dev0"}
{"input": ["cuda -keys=cuda,gpu -arch=sm_75 -max_num_threads=1024 -thread_warp_size=32", "template_matmul", [900, 800, 700, [1, 16, 32, 48, 64, 80, 96, 112, 128], "cuda", "float32"], {}], "config": {"index": 731, "code_hash": null, "entity": [["tile_i", "ot", 32], ["tile_j", "ot", 1], ["tile_k", "ot", 1], ["order", "ot", 1]]}, "result": [[0.0186023195, 0.0186402395, 0.018828512], 0, 1.440598726272583, 1684252802.186421], "version": 0.2, "tvm_version": "0.13.dev0"}
{"input": ["cuda -keys=cuda,gpu -arch=sm_75 -max_num_threads=1024 -thread_warp_size=32", "template_matmul", [900, 800, 700, [1, 16, 32, 48, 64, 80, 96, 112, 128], "cuda", "float32"], {}], "config": {"index": 2270, "code_hash": null, "entity": [["tile_i", "ot", 32], ["tile_j", "ot", 1], ["tile_k", "ot", 16], ["order", "ot", 3]]}, "result": [[0.012050895499999999, 0.012792832, 0.0128637595], 0, 1.3680634498596191, 1684252802.834787], "version": 0.2, "tvm_version": "0.13.dev0"}
{"input": ["cuda -keys=cuda,gpu -arch=sm_75 -max_num_threads=1024 -thread_warp_size=32", "template_matmul", [900, 800, 700, [1, 16, 32, 48, 64, 80, 96, 112, 128], "cuda", "float32"], {}], "config": {"index": 1543, "code_hash": null, "entity": [["tile_i", "ot", 64], ["tile_j", "ot", 1], ["tile_k", "ot", 16], ["order", "ot", 2]]}, "result": [[0.008959152, 0.0090916955, 0.0092116475], 0, 1.4146614074707031, 1684252803.4372191], "version": 0.2, "tvm_version": "0.13.dev0"}
{"input": ["cuda -keys=cuda,gpu -arch=sm_75 -max_num_threads=1024 -thread_warp_size=32", "template_matmul", [900, 800, 700, [1, 16, 32, 48, 64, 80, 96, 112, 128], "cuda", "float32"], {}], "config": {"index": 3080, "code_hash": null, "entity": [["tile_i", "ot", 32], ["tile_j", "ot", 1], ["tile_k", "ot", 32], ["order", "ot", 4]]}, "result": [[0.0548730885, 0.055183361, 0.0551892165], 0, 1.8857927322387695, 1684252804.544834], "version": 0.2, "tvm_version": "0.13.dev0"}
{"input": ["cuda -keys=cuda,gpu -arch=sm_75 -max_num_threads=1024 -thread_warp_size=32", "template_matmul", [900, 800, 700, [1, 16, 32, 48, 64, 80, 96, 112, 128], "cuda", "float32"], {}], "config": {"index": 902, "code_hash": null, "entity": [["tile_i", "ot", 32], ["tile_j", "ot", 16], ["tile_k", "ot", 32], ["order", "ot", 1]]}, "result": [[0.0104180955, 0.010431488, 0.0104622075], 0, 1.4357705116271973, 1684252805.1789854], "version": 0.2, "tvm_version": "0.13.dev0"}
{"input": ["cuda -keys=cuda,gpu -arch=sm_75 -max_num_threads=1024 -thread_warp_size=32", "template_matmul", [900, 800, 700, [1, 16, 32, 48, 64, 80, 96, 112, 128], "cuda", "float32"], {}], "config": {"index": 1622, "code_hash": null, "entity": [["tile_i", "ot", 32], ["tile_j", "ot", 1], ["tile_k", "ot", 32], ["order", "ot", 2]]}, "result": [[0.008457216, 0.008899824, 0.0091176955], 0, 1.40728759765625, 1684252805.7838], "version": 0.2, "tvm_version": "0.13.dev0"}
{"input": ["cuda -keys=cuda,gpu -arch=sm_75 -max_num_threads=1024 -thread_warp_size=32", "template_matmul", [900, 800, 700, [1, 16, 32, 48, 64, 80, 96, 112, 128], "cuda", "float32"], {}], "config": {"index": 896, "code_hash": null, "entity": [["tile_i", "ot", 80], ["tile_j", "ot", 1], ["tile_k", "ot", 32], ["order", "ot", 1]]}, "result": [[0.010842415499999999, 0.011022975499999999, 0.0110884795], 0, 1.4511833190917969, 1684252806.4292846], "version": 0.2, "tvm_version": "0.13.dev0"}
{"input": ["cuda -keys=cuda,gpu -arch=sm_75 -max_num_threads=1024 -thread_warp_size=32", "template_matmul", [900, 800, 700, [1, 16, 32, 48, 64, 80, 96, 112, 128], "cuda", "float32"], {}], "config": {"index": 1541, "code_hash": null, "entity": [["tile_i", "ot", 32], ["tile_j", "ot", 1], ["tile_k", "ot", 16], ["order", "ot", 2]]}, "result": [[0.0111278075, 0.0117585915, 0.011781408], 0, 1.4380145072937012, 1684252807.0634956], "version": 0.2, "tvm_version": "0.13.dev0"}
{"input": ["cuda -keys=cuda,gpu -arch=sm_75 -max_num_threads=1024 -thread_warp_size=32", "template_matmul", [900, 800, 700, [1, 16, 32, 48, 64, 80, 96, 112, 128], "cuda", "float32"], {}], "config": {"index": 976, "code_hash": null, "entity": [["tile_i", "ot", 64], ["tile_j", "ot", 1], ["tile_k", "ot", 48], ["order", "ot", 1]]}, "result": [[0.00976576, 0.010031535999999999, 0.010208224], 0, 1.43355393409729, 1684252807.6968288], "version": 0.2, "tvm_version": "0.13.dev0"}
{"input": ["cuda -keys=cuda,gpu -arch=sm_75 -max_num_threads=1024 -thread_warp_size=32", "template_matmul", [900, 800, 700, [1, 16, 32, 48, 64, 80, 96, 112, 128], "cuda", "float32"], {}], "config": {"index": 2999, "code_hash": null, "entity": [["tile_i", "ot", 32], ["tile_j", "ot", 1], ["tile_k", "ot", 16], ["order", "ot", 4]]}, "result": [[0.054493137, 0.055103134, 0.055153793], 0, 1.8876688480377197, 1684252808.802987], "version": 0.2, "tvm_version": "0.13.dev0"}
{"input": ["cuda -keys=cuda,gpu -arch=sm_75 -max_num_threads=1024 -thread_warp_size=32", "template_matmul", [900, 800, 700, [1, 16, 32, 48, 64, 80, 96, 112, 128], "cuda", "float32"], {}], "config": {"index": 2441, "code_hash": null, "entity": [["tile_i", "ot", 32], ["tile_j", "ot", 16], ["tile_k", "ot", 48], ["order", "ot", 3]]}, "result": [[0.0094004315, 0.0096204795, 0.009660287500000002], 0, 1.4230403900146484, 1684252809.4117172], "version": 0.2, "tvm_version": "0.13.dev0"}
{"input": ["cuda -keys=cuda,gpu -arch=sm_75 -max_num_threads=1024 -thread_warp_size=32", "template_matmul", [900, 800, 700, [1, 16, 32, 48, 64, 80, 96, 112, 128], "cuda", "float32"], {}], "config": {"index": 1705, "code_hash": null, "entity": [["tile_i", "ot", 64], ["tile_j", "ot", 1], ["tile_k", "ot", 48], ["order", "ot", 2]]}, "result": [[0.009939968, 0.0100120475, 0.0100367675], 0, 1.43316650390625, 1684252810.030511], "version": 0.2, "tvm_version": "0.13.dev0"}
{"input": ["cuda -keys=cuda,gpu -arch=sm_75 -max_num_threads=1024 -thread_warp_size=32", "template_matmul", [900, 800, 700, [1, 16, 32, 48, 64, 80, 96, 112, 128], "cuda", "float32"], {}], "config": {"index": 811, "code_hash": null, "entity": [["tile_i", "ot", 16], ["tile_j", "ot", 1], ["tile_k", "ot", 16], ["order", "ot", 1]]}, "result": [[0.0112950235, 0.0115679995, 0.011594575499999999], 0, 1.46079421043396, 1684252811.6737707], "version": 0.2, "tvm_version": "0.13.dev0"}
{"input": ["cuda -keys=cuda,gpu -arch=sm_75 -max_num_threads=1024 -thread_warp_size=32", "template_matmul", [900, 800, 700, [1, 16, 32, 48, 64, 80, 96, 112, 128], "cuda", "float32"], {}], "config": {"index": 904, "code_hash": null, "entity": [["tile_i", "ot", 64], ["tile_j", "ot", 16], ["tile_k", "ot", 32], ["order", "ot", 1]]}, "result": [[0.009365504, 0.0096018075, 0.0096958395], 0, 1.4814703464508057, 1684252812.2911065], "version": 0.2, "tvm_version": "0.13.dev0"}
{"input": ["cuda -keys=cuda,gpu -arch=sm_75 -max_num_threads=1024 -thread_warp_size=32", "template_matmul", [900, 800, 700, [1, 16, 32, 48, 64, 80, 96, 112, 128], "cuda", "float32"], {}], "config": {"index": 821, "code_hash": null, "entity": [["tile_i", "ot", 32], ["tile_j", "ot", 16], ["tile_k", "ot", 16], ["order", "ot", 1]]}, "result": [[0.0035358714999999996, 0.0035411674999999997, 0.0044622075], 0, 1.463209629058838, 1684252812.8651862], "version": 0.2, "tvm_version": "0.13.dev0"}
{"input": ["cuda -keys=cuda,gpu -arch=sm_75 -max_num_threads=1024 -thread_warp_size=32", "template_matmul", [900, 800, 700, [1, 16, 32, 48, 64, 80, 96, 112, 128], "cuda", "float32"], {}], "config": {"index": 815, "code_hash": null, "entity": [["tile_i", "ot", 80], ["tile_j", "ot", 1], ["tile_k", "ot", 16], ["order", "ot", 1]]}, "result": [[0.0107791355, 0.0107796475, 0.0108636155], 0, 1.494469404220581, 1684252813.5044017], "version": 0.2, "tvm_version": "0.13.dev0"}
{"input": ["cuda -keys=cuda,gpu -arch=sm_75 -max_num_threads=1024 -thread_warp_size=32", "template_matmul", [900, 800, 700, [1, 16, 32, 48, 64, 80, 96, 112, 128], "cuda", "float32"], {}], "config": {"index": 2434, "code_hash": null, "entity": [["tile_i", "ot", 64], ["tile_j", "ot", 1], ["tile_k", "ot", 48], ["order", "ot", 3]]}, "result": [[0.009750736, 0.0099973115, 0.0100185115], 0, 1.4800395965576172, 1684252814.117507], "version": 0.2, "tvm_version": "0.13.dev0"}
{"input": ["cuda -keys=cuda,gpu -arch=sm_75 -max_num_threads=1024 -thread_warp_size=32", "template_matmul", [900, 800, 700, [1, 16, 32, 48, 64, 80, 96, 112, 128], "cuda", "float32"], {}], "config": {"index": 977, "code_hash": null, "entity": [["tile_i", "ot", 80], ["tile_j", "ot", 1], ["tile_k", "ot", 48], ["order", "ot", 1]]}, "result": [[0.012403807499999999, 0.012470095499999998, 0.013269632], 0, 1.517763376235962, 1684252814.7620528], "version": 0.2, "tvm_version": "0.13.dev0"}
{"input": ["cuda -keys=cuda,gpu -arch=sm_75 -max_num_threads=1024 -thread_warp_size=32", "template_matmul", [900, 800, 700, [1, 16, 32, 48, 64, 80, 96, 112, 128], "cuda", "float32"], {}], "config": {"index": 740, "code_hash": null, "entity": [["tile_i", "ot", 32], ["tile_j", "ot", 16], ["tile_k", "ot", 1], ["order", "ot", 1]]}, "result": [[0.0099226395, 0.010608768, 0.011544688], 0, 1.5722222328186035, 1684252815.4089735], "version": 0.2, "tvm_version": "0.13.dev0"}
{"input": ["cuda -keys=cuda,gpu -arch=sm_75 -max_num_threads=1024 -thread_warp_size=32", "template_matmul", [900, 800, 700, [1, 16, 32, 48, 64, 80, 96, 112, 128], "cuda", "float32"], {}], "config": {"index": 901, "code_hash": null, "entity": [["tile_i", "ot", 16], ["tile_j", "ot", 16], ["tile_k", "ot", 32], ["order", "ot", 1]]}, "result": [[0.011096816, 0.0111514555, 0.01121792], 0, 1.5124409198760986, 1684252816.0366817], "version": 0.2, "tvm_version": "0.13.dev0"}
{"input": ["cuda -keys=cuda,gpu -arch=sm_75 -max_num_threads=1024 -thread_warp_size=32", "template_matmul", [900, 800, 700, [1, 16, 32, 48, 64, 80, 96, 112, 128], "cuda", "float32"], {}], "config": {"index": 3323, "code_hash": null, "entity": [["tile_i", "ot", 32], ["tile_j", "ot", 1], ["tile_k", "ot", 80], ["order", "ot", 4]]}, "result": [[0.05436211, 0.0552304645, 0.055258655500000003], 0, 1.9427859783172607, 1684252817.1534092], "version": 0.2, "tvm_version": "0.13.dev0"}
{"input": ["cuda -keys=cuda,gpu -arch=sm_75 -max_num_threads=1024 -thread_warp_size=32", "template_matmul", [900, 800, 700, [1, 16, 32, 48, 64, 80, 96, 112, 128], "cuda", "float32"], {}], "config": {"index": 1462, "code_hash": null, "entity": [["tile_i", "ot", 64], ["tile_j", "ot", 1], ["tile_k", "ot", 1], ["order", "ot", 2]]}, "result": [[0.010800527499999999, 0.010984448, 0.011785216], 0, 1.5277152061462402, 1684252817.8081493], "version": 0.2, "tvm_version": "0.13.dev0"}
{"input": ["cuda -keys=cuda,gpu -arch=sm_75 -max_num_threads=1024 -thread_warp_size=32", "template_matmul", [900, 800, 700, [1, 16, 32, 48, 64, 80, 96, 112, 128], "cuda", "float32"], {}], "config": {"index": 974, "code_hash": null, "entity": [["tile_i", "ot", 32], ["tile_j", "ot", 1], ["tile_k", "ot", 48], ["order", "ot", 1]]}, "result": [[0.018398048, 0.01859552, 0.0187269115], 0, 1.5714340209960938, 1684252818.5266995], "version": 0.2, "tvm_version": "0.13.dev0"}
{"input": ["cuda -keys=cuda,gpu -arch=sm_75 -max_num_threads=1024 -thread_warp_size=32", "template_matmul", [900, 800, 700, [1, 16, 32, 48, 64, 80, 96, 112, 128], "cuda", "float32"], {}], "config": {"index": 894, "code_hash": null, "entity": [["tile_i", "ot", 48], ["tile_j", "ot", 1], ["tile_k", "ot", 32], ["order", "ot", 1]]}, "result": [[0.011270288000000002, 0.011417407499999999, 0.01147904], 0, 1.5044188499450684, 1684252819.1612306], "version": 0.2, "tvm_version": "0.13.dev0"}
{"input": ["cuda -keys=cuda,gpu -arch=sm_75 -max_num_threads=1024 -thread_warp_size=32", "template_matmul", [900, 800, 700, [1, 16, 32, 48, 64, 80, 96, 112, 128], "cuda", "float32"], {}], "config": {"index": 1460, "code_hash": null, "entity": [["tile_i", "ot", 32], ["tile_j", "ot", 1], ["tile_k", "ot", 1], ["order", "ot", 2]]}, "result": [[0.0185931355, 0.0186009595, 0.0195758075], 0, 1.5459933280944824, 1684252819.8546257], "version": 0.2, "tvm_version": "0.13.dev0"}
{"input": ["cuda -keys=cuda,gpu -arch=sm_75 -max_num_threads=1024 -thread_warp_size=32", "template_matmul", [900, 800, 700, [1, 16, 32, 48, 64, 80, 96, 112, 128], "cuda", "float32"], {}], "config": {"index": 823, "code_hash": null, "entity": [["tile_i", "ot", 64], ["tile_j", "ot", 16], ["tile_k", "ot", 16], ["order", "ot", 1]]}, "result": [[0.0031815355, 0.0031846394999999997, 0.0041071035], 0, 1.4249093532562256, 1684252820.4280012], "version": 0.2, "tvm_version": "0.13.dev0"}
{"input": ["cuda -keys=cuda,gpu -arch=sm_75 -max_num_threads=1024 -thread_warp_size=32", "template_matmul", [900, 800, 700, [1, 16, 32, 48, 64, 80, 96, 112, 128], "cuda", "float32"], {}], "config": {"index": 742, "code_hash": null, "entity": [["tile_i", "ot", 64], ["tile_j", "ot", 16], ["tile_k", "ot", 1], ["order", "ot", 1]]}, "result": [[0.009529343499999999, 0.009769983999999999, 0.009804448], 0, 1.453852653503418, 1684252821.0233004], "version": 0.2, "tvm_version": "0.13.dev0"}
{"input": ["cuda -keys=cuda,gpu -arch=sm_75 -max_num_threads=1024 -thread_warp_size=32", "template_matmul", [900, 800, 700, [1, 16, 32, 48, 64, 80, 96, 112, 128], "cuda", "float32"], {}], "config": {"index": 730, "code_hash": null, "entity": [["tile_i", "ot", 16], ["tile_j", "ot", 1], ["tile_k", "ot", 1], ["order", "ot", 1]]}, "result": [[0.036493198, 0.0366393125, 0.037296127], 0, 1.714228630065918, 1684252821.9277313], "version": 0.2, "tvm_version": "0.13.dev0"}
{"input": ["cuda -keys=cuda,gpu -arch=sm_75 -max_num_threads=1024 -thread_warp_size=32", "template_matmul", [900, 800, 700, [1, 16, 32, 48, 64, 80, 96, 112, 128], "cuda", "float32"], {}], "config": {"index": 734, "code_hash": null, "entity": [["tile_i", "ot", 80], ["tile_j", "ot", 1], ["tile_k", "ot", 1], ["order", "ot", 1]]}, "result": [[0.012312272, 0.012717056, 0.013257327999999999], 0, 1.4331297874450684, 1684252823.580027], "version": 0.2, "tvm_version": "0.13.dev0"}
{"input": ["cuda -keys=cuda,gpu -arch=sm_75 -max_num_threads=1024 -thread_warp_size=32", "template_matmul", [900, 800, 700, [1, 16, 32, 48, 64, 80, 96, 112, 128], "cuda", "float32"], {}], "config": {"index": 3089, "code_hash": null, "entity": [["tile_i", "ot", 32], ["tile_j", "ot", 16], ["tile_k", "ot", 32], ["order", "ot", 4]]}, "result": [[0.032606208500000004, 0.032948223, 0.0332534865], 0, 1.678964376449585, 1684252824.449189], "version": 0.2, "tvm_version": "0.13.dev0"}
{"input": ["cuda -keys=cuda,gpu -arch=sm_75 -max_num_threads=1024 -thread_warp_size=32", "template_matmul", [900, 800, 700, [1, 16, 32, 48, 64, 80, 96, 112, 128], "cuda", "float32"], {}], "config": {"index": 1138, "code_hash": null, "entity": [["tile_i", "ot", 64], ["tile_j", "ot", 1], ["tile_k", "ot", 80], ["order", "ot", 1]]}, "result": [[0.010892848, 0.01096168, 0.011777024], 0, 1.485255241394043, 1684252825.1208725], "version": 0.2, "tvm_version": "0.13.dev0"}
{"input": ["cuda -keys=cuda,gpu -arch=sm_75 -max_num_threads=1024 -thread_warp_size=32", "template_matmul", [900, 800, 700, [1, 16, 32, 48, 64, 80, 96, 112, 128], "cuda", "float32"], {}], "config": {"index": 2596, "code_hash": null, "entity": [["tile_i", "ot", 64], ["tile_j", "ot", 1], ["tile_k", "ot", 80], ["order", "ot", 3]]}, "result": [[0.00987952, 0.010146767499999999, 0.010173439500000001], 0, 1.4747459888458252, 1684252825.753345], "version": 0.2, "tvm_version": "0.13.dev0"}
{"input": ["cuda -keys=cuda,gpu -arch=sm_75 -max_num_threads=1024 -thread_warp_size=32", "template_matmul", [900, 800, 700, [1, 16, 32, 48, 64, 80, 96, 112, 128], "cuda", "float32"], {}], "config": {"index": 3079, "code_hash": null, "entity": [["tile_i", "ot", 16], ["tile_j", "ot", 1], ["tile_k", "ot", 32], ["order", "ot", 4]]}, "result": [[0.1085666885, 0.10895944199999999, 0.11011307499999999], 0, 2.553027868270874, 1684252827.4885674], "version": 0.2, "tvm_version": "0.13.dev0"}
{"input": ["cuda -keys=cuda,gpu -arch=sm_75 -max_num_threads=1024 -thread_warp_size=32", "template_matmul", [900, 800, 700, [1, 16, 32, 48, 64, 80, 96, 112, 128], "cuda", "float32"], {}], "config": {"index": 975, "code_hash": null, "entity": [["tile_i", "ot", 48], ["tile_j", "ot", 1], ["tile_k", "ot", 48], ["order", "ot", 1]]}, "result": [[0.013628159999999999, 0.0137259195, 0.0137533435], 0, 1.5189433097839355, 1684252828.1805887], "version": 0.2, "tvm_version": "0.13.dev0"}
{"input": ["cuda -keys=cuda,gpu -arch=sm_75 -max_num_threads=1024 -thread_warp_size=32", "template_matmul", [900, 800, 700, [1, 16, 32, 48, 64, 80, 96, 112, 128], "cuda", "float32"], {}], "config": {"index": 2443, "code_hash": null, "entity": [["tile_i", "ot", 64], ["tile_j", "ot", 16], ["tile_k", "ot", 48], ["order", "ot", 3]]}, "result": [[0.009274368000000002, 0.009308591500000001, 0.0093122555], 0, 1.4441289901733398, 1684252828.7836132], "version": 0.2, "tvm_version": "0.13.dev0"}
{"input": ["cuda -keys=cuda,gpu -arch=sm_75 -max_num_threads=1024 -thread_warp_size=32", "template_matmul", [900, 800, 700, [1, 16, 32, 48, 64, 80, 96, 112, 128], "cuda", "float32"], {}], "config": {"index": 1631, "code_hash": null, "entity": [["tile_i", "ot", 32], ["tile_j", "ot", 16], ["tile_k", "ot", 32], ["order", "ot", 2]]}, "result": [[0.0093982235, 0.0093992955, 0.00942712], 0, 1.4120190143585205, 1684252829.3953743], "version": 0.2, "tvm_version": "0.13.dev0"}
{"input": ["cuda -keys=cuda,gpu -arch=sm_75 -max_num_threads=1024 -thread_warp_size=32", "template_matmul", [900, 800, 700, [1, 16, 32, 48, 64, 80, 96, 112, 128], "cuda", "float32"], {}], "config": {"index": 2522, "code_hash": null, "entity": [["tile_i", "ot", 32], ["tile_j", "ot", 16], ["tile_k", "ot", 64], ["order", "ot", 3]]}, "result": [[0.0095398235, 0.010402031499999999, 0.0104079195], 0, 1.4504220485687256, 1684252830.0165243], "version": 0.2, "tvm_version": "0.13.dev0"}
{"input": ["cuda -keys=cuda,gpu -arch=sm_75 -max_num_threads=1024 -thread_warp_size=32", "template_matmul", [900, 800, 700, [1, 16, 32, 48, 64, 80, 96, 112, 128], "cuda", "float32"], {}], "config": {"index": 813, "code_hash": null, "entity": [["tile_i", "ot", 48], ["tile_j", "ot", 1], ["tile_k", "ot", 16], ["order", "ot", 1]]}, "result": [[0.0109385595, 0.010956992, 0.011847824], 0, 1.4646110534667969, 1684252830.661818], "version": 0.2, "tvm_version": "0.13.dev0"}
{"input": ["cuda -keys=cuda,gpu -arch=sm_75 -max_num_threads=1024 -thread_warp_size=32", "template_matmul", [900, 800, 700, [1, 16, 32, 48, 64, 80, 96, 112, 128], "cuda", "float32"], {}], "config": {"index": 2360, "code_hash": null, "entity": [["tile_i", "ot", 32], ["tile_j", "ot", 16], ["tile_k", "ot", 32], ["order", "ot", 3]]}, "result": [[0.0093982715, 0.009398528000000001, 0.0094368635], 0, 1.4280259609222412, 1684252831.2748764], "version": 0.2, "tvm_version": "0.13.dev0"}
{"input": ["cuda -keys=cuda,gpu -arch=sm_75 -max_num_threads=1024 -thread_warp_size=32", "template_matmul", [900, 800, 700, [1, 16, 32, 48, 64, 80, 96, 112, 128], "cuda", "float32"], {}], "config": {"index": 1714, "code_hash": null, "entity": [["tile_i", "ot", 64], ["tile_j", "ot", 16], ["tile_k", "ot", 48], ["order", "ot", 2]]}, "result": [[0.009278639500000001, 0.009289728, 0.009310144], 0, 1.4539849758148193, 1684252831.8933141], "version": 0.2, "tvm_version": "0.13.dev0"}
{"input": ["cuda -keys=cuda,gpu -arch=sm_75 -max_num_threads=1024 -thread_warp_size=32", "template_matmul", [900, 800, 700, [1, 16, 32, 48, 64, 80, 96, 112, 128], "cuda", "float32"], {}], "config": {"index": 3008, "code_hash": null, "entity": [["tile_i", "ot", 32], ["tile_j", "ot", 16], ["tile_k", "ot", 16], ["order", "ot", 4]]}, "result": [[0.03156904, 0.031574016499999996, 0.0315906085], 0, 1.6590471267700195, 1684252832.7406387], "version": 0.2, "tvm_version": "0.13.dev0"}
{"input": ["cuda -keys=cuda,gpu -arch=sm_75 -max_num_threads=1024 -thread_warp_size=32", "template_matmul", [900, 800, 700, [1, 16, 32, 48, 64, 80, 96, 112, 128], "cuda", "float32"], {}], "config": {"index": 2352, "code_hash": null, "entity": [["tile_i", "ot", 48], ["tile_j", "ot", 1], ["tile_k", "ot", 32], ["order", "ot", 3]]}, "result": [[0.012176192, 0.0131896635, 0.013234175499999999], 0, 1.4854702949523926, 1684252833.400673], "version": 0.2, "tvm_version": "0.13.dev0"}
{"input": ["cuda -keys=cuda,gpu -arch=sm_75 -max_num_threads=1024 -thread_warp_size=32", "template_matmul", [900, 800, 700, [1, 16, 32, 48, 64, 80, 96, 112, 128], "cuda", "float32"], {}], "config": {"index": 732, "code_hash": null, "entity": [["tile_i", "ot", 48], ["tile_j", "ot", 1], ["tile_k", "ot", 1], ["order", "ot", 1]]}, "result": [[0.012896256, 0.012995039500000001, 0.01306352], 0, 1.516216516494751, 1684252834.1125875], "version": 0.2, "tvm_version": "0.13.dev0"}
{"input": ["cuda -keys=cuda,gpu -arch=sm_75 -max_num_threads=1024 -thread_warp_size=32", "template_matmul", [900, 800, 700, [1, 16, 32, 48, 64, 80, 96, 112, 128], "cuda", "float32"], {}], "config": {"index": 1550, "code_hash": null, "entity": [["tile_i", "ot", 32], ["tile_j", "ot", 16], ["tile_k", "ot", 16], ["order", "ot", 2]]}, "result": [[0.0035335040000000002, 0.0035363675, 0.003542176], 0, 1.4152698516845703, 1684252834.661972], "version": 0.2, "tvm_version": "0.13.dev0"}
{"input": ["cuda -keys=cuda,gpu -arch=sm_75 -max_num_threads=1024 -thread_warp_size=32", "template_matmul", [900, 800, 700, [1, 16, 32, 48, 64, 80, 96, 112, 128], "cuda", "float32"], {}], "config": {"index": 2998, "code_hash": null, "entity": [["tile_i", "ot", 16], ["tile_j", "ot", 1], ["tile_k", "ot", 16], ["order", "ot", 4]]}, "result": [[0.096728195, 0.0968314895, 0.0992747035], 0, 2.3805086612701416, 1684252837.2581437], "version": 0.2, "tvm_version": "0.13.dev0"}
{"input": ["cuda -keys=cuda,gpu -arch=sm_75 -max_num_threads=1024 -thread_warp_size=32", "template_matmul", [900, 800, 700, [1, 16, 32, 48, 64, 80, 96, 112, 128], "cuda", "float32"], {}], "config": {"index": 983, "code_hash": null, "entity": [["tile_i", "ot", 32], ["tile_j", "ot", 16], ["tile_k", "ot", 48], ["order", "ot", 1]]}, "result": [[0.009357312, 0.009396176000000001, 0.009396528], 0, 1.4371860027313232, 1684252837.9020407], "version": 0.2, "tvm_version": "0.13.dev0"}
{"input": ["cuda -keys=cuda,gpu -arch=sm_75 -max_num_threads=1024 -thread_warp_size=32", "template_matmul", [900, 800, 700, [1, 16, 32, 48, 64, 80, 96, 112, 128], "cuda", "float32"], {}], "config": {"index": 1136, "code_hash": null, "entity": [["tile_i", "ot", 32], ["tile_j", "ot", 1], ["tile_k", "ot", 80], ["order", "ot", 1]]}, "result": [[0.018286575, 0.018293920499999998, 0.018298127999999997], 0, 1.5186681747436523, 1684252838.6453557], "version": 0.2, "tvm_version": "0.13.dev0"}
{"input": ["cuda -keys=cuda,gpu -arch=sm_75 -max_num_threads=1024 -thread_warp_size=32", "template_matmul", [900, 800, 700, [1, 16, 32, 48, 64, 80, 96, 112, 128], "cuda", "float32"], {}], "config": {"index": 2686, "code_hash": null, "entity": [["tile_i", "ot", 64], ["tile_j", "ot", 16], ["tile_k", "ot", 96], ["order", "ot", 3]]}, "result": [[0.009593631500000002, 0.009598784, 0.009621359500000001], 0, 1.4403700828552246, 1684252839.2896614], "version": 0.2, "tvm_version": "0.13.dev0"}
{"input": ["cuda -keys=cuda,gpu -arch=sm_75 -max_num_threads=1024 -thread_warp_size=32", "template_matmul", [900, 800, 700, [1, 16, 32, 48, 64, 80, 96, 112, 128], "cuda", "float32"], {}], "config": {"index": 2354, "code_hash": null, "entity": [["tile_i", "ot", 80], ["tile_j", "ot", 1], ["tile_k", "ot", 32], ["order", "ot", 3]]}, "result": [[0.011600928, 0.0116283835, 0.011633983499999999], 0, 1.458397626876831, 1684252839.9197555], "version": 0.2, "tvm_version": "0.13.dev0"}
{"input": ["cuda -keys=cuda,gpu -arch=sm_75 -max_num_threads=1024 -thread_warp_size=32", "template_matmul", [900, 800, 700, [1, 16, 32, 48, 64, 80, 96, 112, 128], "cuda", "float32"], {}], "config": {"index": 973, "code_hash": null, "entity": [["tile_i", "ot", 16], ["tile_j", "ot", 1], ["tile_k", "ot", 48], ["order", "ot", 1]]}, "result": [[0.039069473, 0.0393451535, 0.039636512500000005], 0, 1.7738292217254639, 1684252840.8867614], "version": 0.2, "tvm_version": "0.13.dev0"}
