results/cuda_GridSearchTuner_mm.log
{"input": ["cuda -keys=cuda,gpu -arch=sm_75 -max_num_threads=1024 -thread_warp_size=32", "template_matmul", [900, 800, 700, [1, 16, 32, 48, 64, 80, 96, 112, 128], "cuda", "float32"], {}], "config": {"index": 0, "code_hash": null, "entity": [["tile_i", "ot", 1], ["tile_j", "ot", 1], ["tile_k", "ot", 1], ["order", "ot", 0]]}, "result": [[0.09699745900000001, 0.09703110499999999, 0.097055023], 0, 2.3661487102508545, 1684252370.509026], "version": 0.2, "tvm_version": "0.13.dev0"}
{"input": ["cuda -keys=cuda,gpu -arch=sm_75 -max_num_threads=1024 -thread_warp_size=32", "template_matmul", [900, 800, 700, [1, 16, 32, 48, 64, 80, 96, 112, 128], "cuda", "float32"], {}], "config": {"index": 1, "code_hash": null, "entity": [["tile_i", "ot", 16], ["tile_j", "ot", 1], ["tile_k", "ot", 1], ["order", "ot", 0]]}, "result": [[0.035950191, 0.0359613455, 0.035964721500000005], 0, 1.5820105075836182, 1684252371.413506], "version": 0.2, "tvm_version": "0.13.dev0"}
{"input": ["cuda -keys=cuda,gpu -arch=sm_75 -max_num_threads=1024 -thread_warp_size=32", "template_matmul", [900, 800, 700, [1, 16, 32, 48, 64, 80, 96, 112, 128], "cuda", "float32"], {}], "config": {"index": 2, "code_hash": null, "entity": [["tile_i", "ot", 32], ["tile_j", "ot", 1], ["tile_k", "ot", 1], ["order", "ot", 0]]}, "result": [[0.018328575, 0.0183395515, 0.0183400475], 0, 1.3404865264892578, 1684252372.099331], "version": 0.2, "tvm_version": "0.13.dev0"}
{"input": ["cuda -keys=cuda,gpu -arch=sm_75 -max_num_threads=1024 -thread_warp_size=32", "template_matmul", [900, 800, 700, [1, 16, 32, 48, 64, 80, 96, 112, 128], "cuda", "float32"], {}], "config": {"index": 3, "code_hash": null, "entity": [["tile_i", "ot", 48], ["tile_j", "ot", 1], ["tile_k", "ot", 1], ["order", "ot", 0]]}, "result": [[0.0129082715, 0.012913455499999999, 0.012914783999999999], 0, 1.3189492225646973, 1684252372.7579706], "version": 0.2, "tvm_version": "0.13.dev0"}
{"input": ["cuda -keys=cuda,gpu -arch=sm_75 -max_num_threads=1024 -thread_warp_size=32", "template_matmul", [900, 800, 700, [1, 16, 32, 48, 64, 80, 96, 112, 128], "cuda", "float32"], {}], "config": {"index": 4, "code_hash": null, "entity": [["tile_i", "ot", 64], ["tile_j", "ot", 1], ["tile_k", "ot", 1], ["order", "ot", 0]]}, "result": [[0.009862992000000001, 0.0098688955, 0.009883968], 0, 1.2195725440979004, 1684252373.353633], "version": 0.2, "tvm_version": "0.13.dev0"}
{"input": ["cuda -keys=cuda,gpu -arch=sm_75 -max_num_threads=1024 -thread_warp_size=32", "template_matmul", [900, 800, 700, [1, 16, 32, 48, 64, 80, 96, 112, 128], "cuda", "float32"], {}], "config": {"index": 5, "code_hash": null, "entity": [["tile_i", "ot", 80], ["tile_j", "ot", 1], ["tile_k", "ot", 1], ["order", "ot", 0]]}, "result": [[0.012346816, 0.012347391999999999, 0.012358688000000001], 0, 1.2838125228881836, 1684252373.9917037], "version": 0.2, "tvm_version": "0.13.dev0"}
{"input": ["cuda -keys=cuda,gpu -arch=sm_75 -max_num_threads=1024 -thread_warp_size=32", "template_matmul", [900, 800, 700, [1, 16, 32, 48, 64, 80, 96, 112, 128], "cuda", "float32"], {}], "config": {"index": 6, "code_hash": null, "entity": [["tile_i", "ot", 96], ["tile_j", "ot", 1], ["tile_k", "ot", 1], ["order", "ot", 0]]}, "result": [[0.01093848, 0.010962944, 0.010973183499999999], 0, 1.2338035106658936, 1684252374.589964], "version": 0.2, "tvm_version": "0.13.dev0"}
{"input": ["cuda -keys=cuda,gpu -arch=sm_75 -max_num_threads=1024 -thread_warp_size=32", "template_matmul", [900, 800, 700, [1, 16, 32, 48, 64, 80, 96, 112, 128], "cuda", "float32"], {}], "config": {"index": 7, "code_hash": null, "entity": [["tile_i", "ot", 112], ["tile_j", "ot", 1], ["tile_k", "ot", 1], ["order", "ot", 0]]}, "result": [[0.0119255035, 0.0119437595, 0.012788448000000001], 0, 1.2618887424468994, 1684252375.2211635], "version": 0.2, "tvm_version": "0.13.dev0"}
{"input": ["cuda -keys=cuda,gpu -arch=sm_75 -max_num_threads=1024 -thread_warp_size=32", "template_matmul", [900, 800, 700, [1, 16, 32, 48, 64, 80, 96, 112, 128], "cuda", "float32"], {}], "config": {"index": 8, "code_hash": null, "entity": [["tile_i", "ot", 128], ["tile_j", "ot", 1], ["tile_k", "ot", 1], ["order", "ot", 0]]}, "result": [[0.010592096, 0.010604528, 0.01063928], 0, 1.2283711433410645, 1684252375.8050673], "version": 0.2, "tvm_version": "0.13.dev0"}
{"input": ["cuda -keys=cuda,gpu -arch=sm_75 -max_num_threads=1024 -thread_warp_size=32", "template_matmul", [900, 800, 700, [1, 16, 32, 48, 64, 80, 96, 112, 128], "cuda", "float32"], {}], "config": {"index": 9, "code_hash": null, "entity": [["tile_i", "ot", 1], ["tile_j", "ot", 16], ["tile_k", "ot", 1], ["order", "ot", 0]]}, "result": [[0.0875388485, 0.087560188, 0.08756206500000001], 0, 2.110602617263794, 1684252377.2631335], "version": 0.2, "tvm_version": "0.13.dev0"}
{"input": ["cuda -keys=cuda,gpu -arch=sm_75 -max_num_threads=1024 -thread_warp_size=32", "template_matmul", [900, 800, 700, [1, 16, 32, 48, 64, 80, 96, 112, 128], "cuda", "float32"], {}], "config": {"index": 10, "code_hash": null, "entity": [["tile_i", "ot", 16], ["tile_j", "ot", 16], ["tile_k", "ot", 1], ["order", "ot", 0]]}, "result": [[0.0109373435, 0.01093832, 0.0109541755], 0, 1.2589502334594727, 1684252377.8643584], "version": 0.2, "tvm_version": "0.13.dev0"}
{"input": ["cuda -keys=cuda,gpu -arch=sm_75 -max_num_threads=1024 -thread_warp_size=32", "template_matmul", [900, 800, 700, [1, 16, 32, 48, 64, 80, 96, 112, 128], "cuda", "float32"], {}], "config": {"index": 11, "code_hash": null, "entity": [["tile_i", "ot", 32], ["tile_j", "ot", 16], ["tile_k", "ot", 1], ["order", "ot", 0]]}, "result": [[0.009638912, 0.009649056, 0.0096544795], 0, 1.2414450645446777, 1684252378.459353], "version": 0.2, "tvm_version": "0.13.dev0"}
{"input": ["cuda -keys=cuda,gpu -arch=sm_75 -max_num_threads=1024 -thread_warp_size=32", "template_matmul", [900, 800, 700, [1, 16, 32, 48, 64, 80, 96, 112, 128], "cuda", "float32"], {}], "config": {"index": 12, "code_hash": null, "entity": [["tile_i", "ot", 48], ["tile_j", "ot", 16], ["tile_k", "ot", 1], ["order", "ot", 0]]}, "result": [[0.0129798555, 0.012984319499999999, 0.013001055499999999], 0, 1.288057565689087, 1684252379.079498], "version": 0.2, "tvm_version": "0.13.dev0"}
{"input": ["cuda -keys=cuda,gpu -arch=sm_75 -max_num_threads=1024 -thread_warp_size=32", "template_matmul", [900, 800, 700, [1, 16, 32, 48, 64, 80, 96, 112, 128], "cuda", "float32"], {}], "config": {"index": 13, "code_hash": null, "entity": [["tile_i", "ot", 64], ["tile_j", "ot", 16], ["tile_k", "ot", 1], ["order", "ot", 0]]}, "result": [[0.009513072, 0.0103478555, 0.010367744], 0, 1.2833747863769531, 1684252379.697804], "version": 0.2, "tvm_version": "0.13.dev0"}
{"input": ["cuda -keys=cuda,gpu -arch=sm_75 -max_num_threads=1024 -thread_warp_size=32", "template_matmul", [900, 800, 700, [1, 16, 32, 48, 64, 80, 96, 112, 128], "cuda", "float32"], {}], "config": {"index": 18, "code_hash": null, "entity": [["tile_i", "ot", 1], ["tile_j", "ot", 32], ["tile_k", "ot", 1], ["order", "ot", 0]]}, "result": [[0.1068251875, 0.10767098950000001, 0.11101462549999999], 0, 2.1589372158050537, 1684252382.0591137], "version": 0.2, "tvm_version": "0.13.dev0"}
{"input": ["cuda -keys=cuda,gpu -arch=sm_75 -max_num_threads=1024 -thread_warp_size=32", "template_matmul", [900, 800, 700, [1, 16, 32, 48, 64, 80, 96, 112, 128], "cuda", "float32"], {}], "config": {"index": 19, "code_hash": null, "entity": [["tile_i", "ot", 16], ["tile_j", "ot", 32], ["tile_k", "ot", 1], ["order", "ot", 0]]}, "result": [[0.0121987835, 0.012542975999999999, 0.012914688], 0, 1.1554484367370605, 1684252382.7506754], "version": 0.2, "tvm_version": "0.13.dev0"}
{"input": ["cuda -keys=cuda,gpu -arch=sm_75 -max_num_threads=1024 -thread_warp_size=32", "template_matmul", [900, 800, 700, [1, 16, 32, 48, 64, 80, 96, 112, 128], "cuda", "float32"], {}], "config": {"index": 20, "code_hash": null, "entity": [["tile_i", "ot", 32], ["tile_j", "ot", 32], ["tile_k", "ot", 1], ["order", "ot", 0]]}, "result": [[0.009880576, 0.0098826235, 0.009906928], 0, 1.1538565158843994, 1684252383.385977], "version": 0.2, "tvm_version": "0.13.dev0"}
{"input": ["cuda -keys=cuda,gpu -arch=sm_75 -max_num_threads=1024 -thread_warp_size=32", "template_matmul", [900, 800, 700, [1, 16, 32, 48, 64, 80, 96, 112, 128], "cuda", "float32"], {}], "config": {"index": 27, "code_hash": null, "entity": [["tile_i", "ot", 1], ["tile_j", "ot", 48], ["tile_k", "ot", 1], ["order", "ot", 0]]}, "result": [[0.1081405255, 0.108334579, 0.10920366649999999], 0, 2.1968095302581787, 1684252385.06923], "version": 0.2, "tvm_version": "0.13.dev0"}
{"input": ["cuda -keys=cuda,gpu -arch=sm_75 -max_num_threads=1024 -thread_warp_size=32", "template_matmul", [900, 800, 700, [1, 16, 32, 48, 64, 80, 96, 112, 128], "cuda", "float32"], {}], "config": {"index": 28, "code_hash": null, "entity": [["tile_i", "ot", 16], ["tile_j", "ot", 48], ["tile_k", "ot", 1], ["order", "ot", 0]]}, "result": [[0.012842672000000001, 0.0128877915, 0.0130306555], 0, 1.109363317489624, 1684252385.7009714], "version": 0.2, "tvm_version": "0.13.dev0"}
{"input": ["cuda -keys=cuda,gpu -arch=sm_75 -max_num_threads=1024 -thread_warp_size=32", "template_matmul", [900, 800, 700, [1, 16, 32, 48, 64, 80, 96, 112, 128], "cuda", "float32"], {}], "config": {"index": 36, "code_hash": null, "entity": [["tile_i", "ot", 1], ["tile_j", "ot", 64], ["tile_k", "ot", 1], ["order", "ot", 0]]}, "result": [[0.125207443, 0.1255215225, 0.125569023], 0, 2.2206931114196777, 1684252388.1320252], "version": 0.2, "tvm_version": "0.13.dev0"}
{"input": ["cuda -keys=cuda,gpu -arch=sm_75 -max_num_threads=1024 -thread_warp_size=32", "template_matmul", [900, 800, 700, [1, 16, 32, 48, 64, 80, 96, 112, 128], "cuda", "float32"], {}], "config": {"index": 37, "code_hash": null, "entity": [["tile_i", "ot", 16], ["tile_j", "ot", 64], ["tile_k", "ot", 1], ["order", "ot", 0]]}, "result": [[0.012640255500000001, 0.013357407500000001, 0.0133928955], 0, 1.0548489093780518, 1684252388.8066845], "version": 0.2, "tvm_version": "0.13.dev0"}
{"input": ["cuda -keys=cuda,gpu -arch=sm_75 -max_num_threads=1024 -thread_warp_size=32", "template_matmul", [900, 800, 700, [1, 16, 32, 48, 64, 80, 96, 112, 128], "cuda", "float32"], {}], "config": {"index": 45, "code_hash": null, "entity": [["tile_i", "ot", 1], ["tile_j", "ot", 80], ["tile_k", "ot", 1], ["order", "ot", 0]]}, "result": [[0.1251348495, 0.1251353755, 0.1252423705], 0, 2.273271322250366, 1684252390.694828], "version": 0.2, "tvm_version": "0.13.dev0"}
{"input": ["cuda -keys=cuda,gpu -arch=sm_75 -max_num_threads=1024 -thread_warp_size=32", "template_matmul", [900, 800, 700, [1, 16, 32, 48, 64, 80, 96, 112, 128], "cuda", "float32"], {}], "config": {"index": 54, "code_hash": null, "entity": [["tile_i", "ot", 1], ["tile_j", "ot", 96], ["tile_k", "ot", 1], ["order", "ot", 0]]}, "result": [[0.120768768, 0.129205841, 0.12931071449999998], 0, 2.182190418243408, 1684252393.0322654], "version": 0.2, "tvm_version": "0.13.dev0"}
{"input": ["cuda -keys=cuda,gpu -arch=sm_75 -max_num_threads=1024 -thread_warp_size=32", "template_matmul", [900, 800, 700, [1, 16, 32, 48, 64, 80, 96, 112, 128], "cuda", "float32"], {}], "config": {"index": 63, "code_hash": null, "entity": [["tile_i", "ot", 1], ["tile_j", "ot", 112], ["tile_k", "ot", 1], ["order", "ot", 0]]}, "result": [[0.11737973, 0.1189367065, 0.1222717435], 0, 2.14286208152771, 1684252394.8734055], "version": 0.2, "tvm_version": "0.13.dev0"}
{"input": ["cuda -keys=cuda,gpu -arch=sm_75 -max_num_threads=1024 -thread_warp_size=32", "template_matmul", [900, 800, 700, [1, 16, 32, 48, 64, 80, 96, 112, 128], "cuda", "float32"], {}], "config": {"index": 72, "code_hash": null, "entity": [["tile_i", "ot", 1], ["tile_j", "ot", 128], ["tile_k", "ot", 1], ["order", "ot", 0]]}, "result": [[0.1202346875, 0.12246526299999999, 0.122742767], 0, 2.1682262420654297, 1684252397.1904361], "version": 0.2, "tvm_version": "0.13.dev0"}
{"input": ["cuda -keys=cuda,gpu -arch=sm_75 -max_num_threads=1024 -thread_warp_size=32", "template_matmul", [900, 800, 700, [1, 16, 32, 48, 64, 80, 96, 112, 128], "cuda", "float32"], {}], "config": {"index": 81, "code_hash": null, "entity": [["tile_i", "ot", 1], ["tile_j", "ot", 1], ["tile_k", "ot", 16], ["order", "ot", 0]]}, "result": [[0.096512802, 0.096542686, 0.0968781125], 0, 2.1797938346862793, 1684252399.559173], "version": 0.2, "tvm_version": "0.13.dev0"}
{"input": ["cuda -keys=cuda,gpu -arch=sm_75 -max_num_threads=1024 -thread_warp_size=32", "template_matmul", [900, 800, 700, [1, 16, 32, 48, 64, 80, 96, 112, 128], "cuda", "float32"], {}], "config": {"index": 82, "code_hash": null, "entity": [["tile_i", "ot", 16], ["tile_j", "ot", 1], ["tile_k", "ot", 16], ["order", "ot", 0]]}, "result": [[0.011260448000000001, 0.0112686715, 0.0112784315], 0, 1.303621768951416, 1684252400.1885889], "version": 0.2, "tvm_version": "0.13.dev0"}
{"input": ["cuda -keys=cuda,gpu -arch=sm_75 -max_num_threads=1024 -thread_warp_size=32", "template_matmul", [900, 800, 700, [1, 16, 32, 48, 64, 80, 96, 112, 128], "cuda", "float32"], {}], "config": {"index": 83, "code_hash": null, "entity": [["tile_i", "ot", 32], ["tile_j", "ot", 1], ["tile_k", "ot", 16], ["order", "ot", 0]]}, "result": [[0.010812416, 0.010813903500000001, 0.010817536], 0, 1.2543847560882568, 1684252400.80296], "version": 0.2, "tvm_version": "0.13.dev0"}
{"input": ["cuda -keys=cuda,gpu -arch=sm_75 -max_num_threads=1024 -thread_warp_size=32", "template_matmul", [900, 800, 700, [1, 16, 32, 48, 64, 80, 96, 112, 128], "cuda", "float32"], {}], "config": {"index": 84, "code_hash": null, "entity": [["tile_i", "ot", 48], ["tile_j", "ot", 1], ["tile_k", "ot", 16], ["order", "ot", 0]]}, "result": [[0.0108852795, 0.010900848, 0.010905647999999999], 0, 1.2543766498565674, 1684252401.4210625], "version": 0.2, "tvm_version": "0.13.dev0"}
{"input": ["cuda -keys=cuda,gpu -arch=sm_75 -max_num_threads=1024 -thread_warp_size=32", "template_matmul", [900, 800, 700, [1, 16, 32, 48, 64, 80, 96, 112, 128], "cuda", "float32"], {}], "config": {"index": 85, "code_hash": null, "entity": [["tile_i", "ot", 64], ["tile_j", "ot", 1], ["tile_k", "ot", 16], ["order", "ot", 0]]}, "result": [[0.0087936475, 0.0088641115, 0.009006591500000001], 0, 1.2360460758209229, 1684252402.0107703], "version": 0.2, "tvm_version": "0.13.dev0"}
{"input": ["cuda -keys=cuda,gpu -arch=sm_75 -max_num_threads=1024 -thread_warp_size=32", "template_matmul", [900, 800, 700, [1, 16, 32, 48, 64, 80, 96, 112, 128], "cuda", "float32"], {}], "config": {"index": 86, "code_hash": null, "entity": [["tile_i", "ot", 80], ["tile_j", "ot", 1], ["tile_k", "ot", 16], ["order", "ot", 0]]}, "result": [[0.010418016, 0.0104898395, 0.010520815499999999], 0, 1.2190566062927246, 1684252402.6214519], "version": 0.2, "tvm_version": "0.13.dev0"}
{"input": ["cuda -keys=cuda,gpu -arch=sm_75 -max_num_threads=1024 -thread_warp_size=32", "template_matmul", [900, 800, 700, [1, 16, 32, 48, 64, 80, 96, 112, 128], "cuda", "float32"], {}], "config": {"index": 87, "code_hash": null, "entity": [["tile_i", "ot", 96], ["tile_j", "ot", 1], ["tile_k", "ot", 16], ["order", "ot", 0]]}, "result": [[0.010018879500000001, 0.010022944, 0.010039104], 0, 1.219120979309082, 1684252403.2390287], "version": 0.2, "tvm_version": "0.13.dev0"}
{"input": ["cuda -keys=cuda,gpu -arch=sm_75 -max_num_threads=1024 -thread_warp_size=32", "template_matmul", [900, 800, 700, [1, 16, 32, 48, 64, 80, 96, 112, 128], "cuda", "float32"], {}], "config": {"index": 88, "code_hash": null, "entity": [["tile_i", "ot", 112], ["tile_j", "ot", 1], ["tile_k", "ot", 16], ["order", "ot", 0]]}, "result": [[0.010281984, 0.0103176955, 0.01032192], 0, 1.2516076564788818, 1684252403.841483], "version": 0.2, "tvm_version": "0.13.dev0"}
{"input": ["cuda -keys=cuda,gpu -arch=sm_75 -max_num_threads=1024 -thread_warp_size=32", "template_matmul", [900, 800, 700, [1, 16, 32, 48, 64, 80, 96, 112, 128], "cuda", "float32"], {}], "config": {"index": 89, "code_hash": null, "entity": [["tile_i", "ot", 128], ["tile_j", "ot", 1], ["tile_k", "ot", 16], ["order", "ot", 0]]}, "result": [[0.009926655500000001, 0.009939968, 0.0099693275], 0, 1.271529197692871, 1684252404.4493818], "version": 0.2, "tvm_version": "0.13.dev0"}
{"input": ["cuda -keys=cuda,gpu -arch=sm_75 -max_num_threads=1024 -thread_warp_size=32", "template_matmul", [900, 800, 700, [1, 16, 32, 48, 64, 80, 96, 112, 128], "cuda", "float32"], {}], "config": {"index": 90, "code_hash": null, "entity": [["tile_i", "ot", 1], ["tile_j", "ot", 16], ["tile_k", "ot", 16], ["order", "ot", 0]]}, "result": [[0.045141136000000005, 0.045142353, 0.045146030000000004], 0, 1.6122016906738281, 1684252405.4393225], "version": 0.2, "tvm_version": "0.13.dev0"}
{"input": ["cuda -keys=cuda,gpu -arch=sm_75 -max_num_threads=1024 -thread_warp_size=32", "template_matmul", [900, 800, 700, [1, 16, 32, 48, 64, 80, 96, 112, 128], "cuda", "float32"], {}], "config": {"index": 91, "code_hash": null, "entity": [["tile_i", "ot", 16], ["tile_j", "ot", 16], ["tile_k", "ot", 16], ["order", "ot", 0]]}, "result": [[0.004800032, 0.0048044635, 0.00480736], 0, 1.172842025756836, 1684252405.9910374], "version": 0.2, "tvm_version": "0.13.dev0"}
{"input": ["cuda -keys=cuda,gpu -arch=sm_75 -max_num_threads=1024 -thread_warp_size=32", "template_matmul", [900, 800, 700, [1, 16, 32, 48, 64, 80, 96, 112, 128], "cuda", "float32"], {}], "config": {"index": 92, "code_hash": null, "entity": [["tile_i", "ot", 32], ["tile_j", "ot", 16], ["tile_k", "ot", 16], ["order", "ot", 0]]}, "result": [[0.0035348475, 0.0035356315, 0.003535792], 0, 1.2094449996948242, 1684252406.534058], "version": 0.2, "tvm_version": "0.13.dev0"}
{"input": ["cuda -keys=cuda,gpu -arch=sm_75 -max_num_threads=1024 -thread_warp_size=32", "template_matmul", [900, 800, 700, [1, 16, 32, 48, 64, 80, 96, 112, 128], "cuda", "float32"], {}], "config": {"index": 93, "code_hash": null, "entity": [["tile_i", "ot", 48], ["tile_j", "ot", 16], ["tile_k", "ot", 16], ["order", "ot", 0]]}, "result": [[0.0040867835, 0.0040903355, 0.0040909915], 0, 1.1904761791229248, 1684252407.0863314], "version": 0.2, "tvm_version": "0.13.dev0"}
{"input": ["cuda -keys=cuda,gpu -arch=sm_75 -max_num_threads=1024 -thread_warp_size=32", "template_matmul", [900, 800, 700, [1, 16, 32, 48, 64, 80, 96, 112, 128], "cuda", "float32"], {}], "config": {"index": 94, "code_hash": null, "entity": [["tile_i", "ot", 64], ["tile_j", "ot", 16], ["tile_k", "ot", 16], ["order", "ot", 0]]}, "result": [[0.00403072, 0.0040314875, 0.004032], 0, 1.1884140968322754, 1684252407.6243577], "version": 0.2, "tvm_version": "0.13.dev0"}
{"input": ["cuda -keys=cuda,gpu -arch=sm_75 -max_num_threads=1024 -thread_warp_size=32", "template_matmul", [900, 800, 700, [1, 16, 32, 48, 64, 80, 96, 112, 128], "cuda", "float32"], {}], "config": {"index": 99, "code_hash": null, "entity": [["tile_i", "ot", 1], ["tile_j", "ot", 32], ["tile_k", "ot", 16], ["order", "ot", 0]]}, "result": [[0.0439614065, 0.044279808000000004, 0.0527308805], 0, 1.3775238990783691, 1684252409.1695747], "version": 0.2, "tvm_version": "0.13.dev0"}
{"input": ["cuda -keys=cuda,gpu -arch=sm_75 -max_num_threads=1024 -thread_warp_size=32", "template_matmul", [900, 800, 700, [1, 16, 32, 48, 64, 80, 96, 112, 128], "cuda", "float32"], {}], "config": {"index": 100, "code_hash": null, "entity": [["tile_i", "ot", 16], ["tile_j", "ot", 32], ["tile_k", "ot", 16], ["order", "ot", 0]]}, "result": [[0.004510704, 0.004511744, 0.004525424], 0, 0.9274206161499023, 1684252409.7312076], "version": 0.2, "tvm_version": "0.13.dev0"}
{"input": ["cuda -keys=cuda,gpu -arch=sm_75 -max_num_threads=1024 -thread_warp_size=32", "template_matmul", [900, 800, 700, [1, 16, 32, 48, 64, 80, 96, 112, 128], "cuda", "float32"], {}], "config": {"index": 101, "code_hash": null, "entity": [["tile_i", "ot", 32], ["tile_j", "ot", 32], ["tile_k", "ot", 16], ["order", "ot", 0]]}, "result": [[0.0032313915, 0.00323264, 0.0032348159999999997], 0, 0.8858582973480225, 1684252410.262541], "version": 0.2, "tvm_version": "0.13.dev0"}
{"input": ["cuda -keys=cuda,gpu -arch=sm_75 -max_num_threads=1024 -thread_warp_size=32", "template_matmul", [900, 800, 700, [1, 16, 32, 48, 64, 80, 96, 112, 128], "cuda", "float32"], {}], "config": {"index": 108, "code_hash": null, "entity": [["tile_i", "ot", 1], ["tile_j", "ot", 48], ["tile_k", "ot", 16], ["order", "ot", 0]]}, "result": [[0.0447565915, 0.044762207, 0.0447826385], 0, 1.336348295211792, 1684252411.2670112], "version": 0.2, "tvm_version": "0.13.dev0"}
{"input": ["cuda -keys=cuda,gpu -arch=sm_75 -max_num_threads=1024 -thread_warp_size=32", "template_matmul", [900, 800, 700, [1, 16, 32, 48, 64, 80, 96, 112, 128], "cuda", "float32"], {}], "config": {"index": 109, "code_hash": null, "entity": [["tile_i", "ot", 16], ["tile_j", "ot", 48], ["tile_k", "ot", 16], ["order", "ot", 0]]}, "result": [[0.004416512, 0.0044175355, 0.00441856], 0, 0.9334402084350586, 1684252411.8277931], "version": 0.2, "tvm_version": "0.13.dev0"}
{"input": ["cuda -keys=cuda,gpu -arch=sm_75 -max_num_threads=1024 -thread_warp_size=32", "template_matmul", [900, 800, 700, [1, 16, 32, 48, 64, 80, 96, 112, 128], "cuda", "float32"], {}], "config": {"index": 117, "code_hash": null, "entity": [["tile_i", "ot", 1], ["tile_j", "ot", 64], ["tile_k", "ot", 16], ["order", "ot", 0]]}, "result": [[0.044523521, 0.0445593605, 0.044562431], 0, 1.2840657234191895, 1684252413.2859957], "version": 0.2, "tvm_version": "0.13.dev0"}
{"input": ["cuda -keys=cuda,gpu -arch=sm_75 -max_num_threads=1024 -thread_warp_size=32", "template_matmul", [900, 800, 700, [1, 16, 32, 48, 64, 80, 96, 112, 128], "cuda", "float32"], {}], "config": {"index": 118, "code_hash": null, "entity": [["tile_i", "ot", 16], ["tile_j", "ot", 64], ["tile_k", "ot", 16], ["order", "ot", 0]]}, "result": [[0.004422656, 0.004425024, 0.0044267355], 0, 0.8653600215911865, 1684252413.8231716], "version": 0.2, "tvm_version": "0.13.dev0"}
{"input": ["cuda -keys=cuda,gpu -arch=sm_75 -max_num_threads=1024 -thread_warp_size=32", "template_matmul", [900, 800, 700, [1, 16, 32, 48, 64, 80, 96, 112, 128], "cuda", "float32"], {}], "config": {"index": 126, "code_hash": null, "entity": [["tile_i", "ot", 1], ["tile_j", "ot", 80], ["tile_k", "ot", 16], ["order", "ot", 0]]}, "result": [[0.044935169000000004, 0.0449413905, 0.044942337], 0, 1.3088321685791016, 1684252414.8062108], "version": 0.2, "tvm_version": "0.13.dev0"}
{"input": ["cuda -keys=cuda,gpu -arch=sm_75 -max_num_threads=1024 -thread_warp_size=32", "template_matmul", [900, 800, 700, [1, 16, 32, 48, 64, 80, 96, 112, 128], "cuda", "float32"], {}], "config": {"index": 135, "code_hash": null, "entity": [["tile_i", "ot", 1], ["tile_j", "ot", 96], ["tile_k", "ot", 16], ["order", "ot", 0]]}, "result": [[0.044900718500000006, 0.0449023205, 0.0449122885], 0, 1.3049890995025635, 1684252416.2570765], "version": 0.2, "tvm_version": "0.13.dev0"}
{"input": ["cuda -keys=cuda,gpu -arch=sm_75 -max_num_threads=1024 -thread_warp_size=32", "template_matmul", [900, 800, 700, [1, 16, 32, 48, 64, 80, 96, 112, 128], "cuda", "float32"], {}], "config": {"index": 144, "code_hash": null, "entity": [["tile_i", "ot", 1], ["tile_j", "ot", 112], ["tile_k", "ot", 16], ["order", "ot", 0]]}, "result": [[0.045343486499999995, 0.0453488655, 0.045348976], 0, 1.2731966972351074, 1684252417.6717176], "version": 0.2, "tvm_version": "0.13.dev0"}
{"input": ["cuda -keys=cuda,gpu -arch=sm_75 -max_num_threads=1024 -thread_warp_size=32", "template_matmul", [900, 800, 700, [1, 16, 32, 48, 64, 80, 96, 112, 128], "cuda", "float32"], {}], "config": {"index": 153, "code_hash": null, "entity": [["tile_i", "ot", 1], ["tile_j", "ot", 128], ["tile_k", "ot", 16], ["order", "ot", 0]]}, "result": [[0.045245918, 0.0452510565, 0.045255584499999994], 0, 1.2923357486724854, 1684252418.6814306], "version": 0.2, "tvm_version": "0.13.dev0"}
{"input": ["cuda -keys=cuda,gpu -arch=sm_75 -max_num_threads=1024 -thread_warp_size=32", "template_matmul", [900, 800, 700, [1, 16, 32, 48, 64, 80, 96, 112, 128], "cuda", "float32"], {}], "config": {"index": 162, "code_hash": null, "entity": [["tile_i", "ot", 1], ["tile_j", "ot", 1], ["tile_k", "ot", 32], ["order", "ot", 0]]}, "result": [[0.095242851, 0.0952483825, 0.0952676925], 0, 2.1257834434509277, 1684252420.9823484], "version": 0.2, "tvm_version": "0.13.dev0"}
{"input": ["cuda -keys=cuda,gpu -arch=sm_75 -max_num_threads=1024 -thread_warp_size=32", "template_matmul", [900, 800, 700, [1, 16, 32, 48, 64, 80, 96, 112, 128], "cuda", "float32"], {}], "config": {"index": 163, "code_hash": null, "entity": [["tile_i", "ot", 16], ["tile_j", "ot", 1], ["tile_k", "ot", 32], ["order", "ot", 0]]}, "result": [[0.00944264, 0.00945656, 0.009469408], 0, 1.26025390625, 1684252421.6012483], "version": 0.2, "tvm_version": "0.13.dev0"}
{"input": ["cuda -keys=cuda,gpu -arch=sm_75 -max_num_threads=1024 -thread_warp_size=32", "template_matmul", [900, 800, 700, [1, 16, 32, 48, 64, 80, 96, 112, 128], "cuda", "float32"], {}], "config": {"index": 164, "code_hash": null, "entity": [["tile_i", "ot", 32], ["tile_j", "ot", 1], ["tile_k", "ot", 32], ["order", "ot", 0]]}, "result": [[0.008365152, 0.008451071499999999, 0.008980544], 0, 1.2247490882873535, 1684252422.2024417], "version": 0.2, "tvm_version": "0.13.dev0"}
{"input": ["cuda -keys=cuda,gpu -arch=sm_75 -max_num_threads=1024 -thread_warp_size=32", "template_matmul", [900, 800, 700, [1, 16, 32, 48, 64, 80, 96, 112, 128], "cuda", "float32"], {}], "config": {"index": 165, "code_hash": null, "entity": [["tile_i", "ot", 48], ["tile_j", "ot", 1], ["tile_k", "ot", 32], ["order", "ot", 0]]}, "result": [[0.011162464, 0.0111829115, 0.011233584000000001], 0, 1.2478523254394531, 1684252422.8388107], "version": 0.2, "tvm_version": "0.13.dev0"}
{"input": ["cuda -keys=cuda,gpu -arch=sm_75 -max_num_threads=1024 -thread_warp_size=32", "template_matmul", [900, 800, 700, [1, 16, 32, 48, 64, 80, 96, 112, 128], "cuda", "float32"], {}], "config": {"index": 166, "code_hash": null, "entity": [["tile_i", "ot", 64], ["tile_j", "ot", 1], ["tile_k", "ot", 32], ["order", "ot", 0]]}, "result": [[0.0093383355, 0.009458175499999999, 0.0095160795], 0, 1.2206966876983643, 1684252423.4469585], "version": 0.2, "tvm_version": "0.13.dev0"}
{"input": ["cuda -keys=cuda,gpu -arch=sm_75 -max_num_threads=1024 -thread_warp_size=32", "template_matmul", [900, 800, 700, [1, 16, 32, 48, 64, 80, 96, 112, 128], "cuda", "float32"], {}], "config": {"index": 167, "code_hash": null, "entity": [["tile_i", "ot", 80], ["tile_j", "ot", 1], ["tile_k", "ot", 32], ["order", "ot", 0]]}, "result": [[0.010728752, 0.0107329755, 0.0107796475], 0, 1.2480180263519287, 1684252424.0778358], "version": 0.2, "tvm_version": "0.13.dev0"}
{"input": ["cuda -keys=cuda,gpu -arch=sm_75 -max_num_threads=1024 -thread_warp_size=32", "template_matmul", [900, 800, 700, [1, 16, 32, 48, 64, 80, 96, 112, 128], "cuda", "float32"], {}], "config": {"index": 168, "code_hash": null, "entity": [["tile_i", "ot", 96], ["tile_j", "ot", 1], ["tile_k", "ot", 32], ["order", "ot", 0]]}, "result": [[0.010224736, 0.0102591195, 0.010307503499999999], 0, 1.2287993431091309, 1684252424.700737], "version": 0.2, "tvm_version": "0.13.dev0"}
{"input": ["cuda -keys=cuda,gpu -arch=sm_75 -max_num_threads=1024 -thread_warp_size=32", "template_matmul", [900, 800, 700, [1, 16, 32, 48, 64, 80, 96, 112, 128], "cuda", "float32"], {}], "config": {"index": 169, "code_hash": null, "entity": [["tile_i", "ot", 112], ["tile_j", "ot", 1], ["tile_k", "ot", 32], ["order", "ot", 0]]}, "result": [[0.010560128, 0.010561263999999999, 0.010571776], 0, 1.2533848285675049, 1684252425.3395402], "version": 0.2, "tvm_version": "0.13.dev0"}
{"input": ["cuda -keys=cuda,gpu -arch=sm_75 -max_num_threads=1024 -thread_warp_size=32", "template_matmul", [900, 800, 700, [1, 16, 32, 48, 64, 80, 96, 112, 128], "cuda", "float32"], {}], "config": {"index": 170, "code_hash": null, "entity": [["tile_i", "ot", 128], ["tile_j", "ot", 1], ["tile_k", "ot", 32], ["order", "ot", 0]]}, "result": [[0.010181632000000001, 0.010184575999999999, 0.010215711499999999], 0, 1.2607004642486572, 1684252425.9703202], "version": 0.2, "tvm_version": "0.13.dev0"}
{"input": ["cuda -keys=cuda,gpu -arch=sm_75 -max_num_threads=1024 -thread_warp_size=32", "template_matmul", [900, 800, 700, [1, 16, 32, 48, 64, 80, 96, 112, 128], "cuda", "float32"], {}], "config": {"index": 171, "code_hash": null, "entity": [["tile_i", "ot", 1], ["tile_j", "ot", 16], ["tile_k", "ot", 32], ["order", "ot", 0]]}, "result": [[0.04398571, 0.0439877925, 0.04399155], 0, 1.6157827377319336, 1684252426.9639359], "version": 0.2, "tvm_version": "0.13.dev0"}
{"input": ["cuda -keys=cuda,gpu -arch=sm_75 -max_num_threads=1024 -thread_warp_size=32", "template_matmul", [900, 800, 700, [1, 16, 32, 48, 64, 80, 96, 112, 128], "cuda", "float32"], {}], "config": {"index": 172, "code_hash": null, "entity": [["tile_i", "ot", 16], ["tile_j", "ot", 16], ["tile_k", "ot", 32], ["order", "ot", 0]]}, "result": [[0.0108287675, 0.010844623500000001, 0.010900815500000001], 0, 1.2330362796783447, 1684252427.5897117], "version": 0.2, "tvm_version": "0.13.dev0"}
{"input": ["cuda -keys=cuda,gpu -arch=sm_75 -max_num_threads=1024 -thread_warp_size=32", "template_matmul", [900, 800, 700, [1, 16, 32, 48, 64, 80, 96, 112, 128], "cuda", "float32"], {}], "config": {"index": 173, "code_hash": null, "entity": [["tile_i", "ot", 32], ["tile_j", "ot", 16], ["tile_k", "ot", 32], ["order", "ot", 0]]}, "result": [[0.0093984475, 0.009401999999999999, 0.0094403835], 0, 1.1707603931427002, 1684252428.188968], "version": 0.2, "tvm_version": "0.13.dev0"}
{"input": ["cuda -keys=cuda,gpu -arch=sm_75 -max_num_threads=1024 -thread_warp_size=32", "template_matmul", [900, 800, 700, [1, 16, 32, 48, 64, 80, 96, 112, 128], "cuda", "float32"], {}], "config": {"index": 174, "code_hash": null, "entity": [["tile_i", "ot", 48], ["tile_j", "ot", 16], ["tile_k", "ot", 32], ["order", "ot", 0]]}, "result": [[0.01484904, 0.01495872, 0.014960368], 0, 1.2380950450897217, 1684252428.8575761], "version": 0.2, "tvm_version": "0.13.dev0"}
{"input": ["cuda -keys=cuda,gpu -arch=sm_75 -max_num_threads=1024 -thread_warp_size=32", "template_matmul", [900, 800, 700, [1, 16, 32, 48, 64, 80, 96, 112, 128], "cuda", "float32"], {}], "config": {"index": 175, "code_hash": null, "entity": [["tile_i", "ot", 64], ["tile_j", "ot", 16], ["tile_k", "ot", 32], ["order", "ot", 0]]}, "result": [[0.009345024, 0.0093456315, 0.009377872], 0, 1.1887991428375244, 1684252429.455544], "version": 0.2, "tvm_version": "0.13.dev0"}
{"input": ["cuda -keys=cuda,gpu -arch=sm_75 -max_num_threads=1024 -thread_warp_size=32", "template_matmul", [900, 800, 700, [1, 16, 32, 48, 64, 80, 96, 112, 128], "cuda", "float32"], {}], "config": {"index": 180, "code_hash": null, "entity": [["tile_i", "ot", 1], ["tile_j", "ot", 32], ["tile_k", "ot", 32], ["order", "ot", 0]]}, "result": [[0.042749824500000005, 0.0427555195, 0.0427596015], 0, 1.2991840839385986, 1684252430.9002798], "version": 0.2, "tvm_version": "0.13.dev0"}
{"input": ["cuda -keys=cuda,gpu -arch=sm_75 -max_num_threads=1024 -thread_warp_size=32", "template_matmul", [900, 800, 700, [1, 16, 32, 48, 64, 80, 96, 112, 128], "cuda", "float32"], {}], "config": {"index": 181, "code_hash": null, "entity": [["tile_i", "ot", 16], ["tile_j", "ot", 32], ["tile_k", "ot", 32], ["order", "ot", 0]]}, "result": [[0.011032463999999999, 0.011036671500000001, 0.01107176], 0, 0.9829339981079102, 1684252431.5267262], "version": 0.2, "tvm_version": "0.13.dev0"}
{"input": ["cuda -keys=cuda,gpu -arch=sm_75 -max_num_threads=1024 -thread_warp_size=32", "template_matmul", [900, 800, 700, [1, 16, 32, 48, 64, 80, 96, 112, 128], "cuda", "float32"], {}], "config": {"index": 182, "code_hash": null, "entity": [["tile_i", "ot", 32], ["tile_j", "ot", 32], ["tile_k", "ot", 32], ["order", "ot", 0]]}, "result": [[0.009660176, 0.009664431499999999, 0.0096958875], 0, 0.9502546787261963, 1684252432.1369467], "version": 0.2, "tvm_version": "0.13.dev0"}
{"input": ["cuda -keys=cuda,gpu -arch=sm_75 -max_num_threads=1024 -thread_warp_size=32", "template_matmul", [900, 800, 700, [1, 16, 32, 48, 64, 80, 96, 112, 128], "cuda", "float32"], {}], "config": {"index": 189, "code_hash": null, "entity": [["tile_i", "ot", 1], ["tile_j", "ot", 48], ["tile_k", "ot", 32], ["order", "ot", 0]]}, "result": [[0.0434288635, 0.0434316975, 0.043431854], 0, 1.3242645263671875, 1684252433.12575], "version": 0.2, "tvm_version": "0.13.dev0"}
{"input": ["cuda -keys=cuda,gpu -arch=sm_75 -max_num_threads=1024 -thread_warp_size=32", "template_matmul", [900, 800, 700, [1, 16, 32, 48, 64, 80, 96, 112, 128], "cuda", "float32"], {}], "config": {"index": 190, "code_hash": null, "entity": [["tile_i", "ot", 16], ["tile_j", "ot", 48], ["tile_k", "ot", 32], ["order", "ot", 0]]}, "result": [[0.0124856315, 0.012489472, 0.0125087995], 0, 0.9525563716888428, 1684252433.7522893], "version": 0.2, "tvm_version": "0.13.dev0"}
{"input": ["cuda -keys=cuda,gpu -arch=sm_75 -max_num_threads=1024 -thread_warp_size=32", "template_matmul", [900, 800, 700, [1, 16, 32, 48, 64, 80, 96, 112, 128], "cuda", "float32"], {}], "config": {"index": 198, "code_hash": null, "entity": [["tile_i", "ot", 1], ["tile_j", "ot", 64], ["tile_k", "ot", 32], ["order", "ot", 0]]}, "result": [[0.043173889, 0.043176784499999996, 0.043179168500000004], 0, 1.2449719905853271, 1684252435.1322455], "version": 0.2, "tvm_version": "0.13.dev0"}
{"input": ["cuda -keys=cuda,gpu -arch=sm_75 -max_num_threads=1024 -thread_warp_size=32", "template_matmul", [900, 800, 700, [1, 16, 32, 48, 64, 80, 96, 112, 128], "cuda", "float32"], {}], "config": {"index": 199, "code_hash": null, "entity": [["tile_i", "ot", 16], ["tile_j", "ot", 64], ["tile_k", "ot", 32], ["order", "ot", 0]]}, "result": [[0.01152952, 0.0115542075, 0.0115647675], 0, 0.9291062355041504, 1684252435.758572], "version": 0.2, "tvm_version": "0.13.dev0"}
