results/cuda_RandomTuner_mm.log
{"input": ["cuda -keys=cuda,gpu -arch=sm_75 -max_num_threads=1024 -thread_warp_size=32", "template_matmul", [900, 800, 700, [1, 16, 32, 48, 64, 80, 96, 112, 128], "cuda", "float32"], {}], "config": {"index": 3060, "code_hash": null, "entity": [["tile_i", "ot", 1], ["tile_j", "ot", 112], ["tile_k", "ot", 16], ["order", "ot", 4]]}, "result": [[0.19276580799999998, 0.19279615749999998, 0.1928797605], 0, 3.1273653507232666, 1684252447.2012725], "version": 0.2, "tvm_version": "0.13.dev0"}
{"input": ["cuda -keys=cuda,gpu -arch=sm_75 -max_num_threads=1024 -thread_warp_size=32", "template_matmul", [900, 800, 700, [1, 16, 32, 48, 64, 80, 96, 112, 128], "cuda", "float32"], {}], "config": {"index": 2854, "code_hash": null, "entity": [["tile_i", "ot", 16], ["tile_j", "ot", 32], ["tile_k", "ot", 128], ["order", "ot", 3]]}, "result": [[0.0116222715, 0.011643055499999999, 0.0116787995], 0, 1.016615629196167, 1684252447.808587], "version": 0.2, "tvm_version": "0.13.dev0"}
{"input": ["cuda -keys=cuda,gpu -arch=sm_75 -max_num_threads=1024 -thread_warp_size=32", "template_matmul", [900, 800, 700, [1, 16, 32, 48, 64, 80, 96, 112, 128], "cuda", "float32"], {}], "config": {"index": 2848, "code_hash": null, "entity": [["tile_i", "ot", 64], ["tile_j", "ot", 16], ["tile_k", "ot", 128], ["order", "ot", 3]]}, "result": [[0.009776127499999999, 0.0097850875, 0.0098160635], 0, 1.1813013553619385, 1684252448.4100142], "version": 0.2, "tvm_version": "0.13.dev0"}
{"input": ["cuda -keys=cuda,gpu -arch=sm_75 -max_num_threads=1024 -thread_warp_size=32", "template_matmul", [900, 800, 700, [1, 16, 32, 48, 64, 80, 96, 112, 128], "cuda", "float32"], {}], "config": {"index": 3974, "code_hash": null, "entity": [["tile_i", "ot", 80], ["tile_j", "ot", 1], ["tile_k", "ot", 64], ["order", "ot", 5]]}, "result": [[0.032068367, 0.032068607, 0.0320706555], 0, 1.181084394454956, 1684252449.756717], "version": 0.2, "tvm_version": "0.13.dev0"}
{"input": ["cuda -keys=cuda,gpu -arch=sm_75 -max_num_threads=1024 -thread_warp_size=32", "template_matmul", [900, 800, 700, [1, 16, 32, 48, 64, 80, 96, 112, 128], "cuda", "float32"], {}], "config": {"index": 3326, "code_hash": null, "entity": [["tile_i", "ot", 80], ["tile_j", "ot", 1], ["tile_k", "ot", 80], ["order", "ot", 4]]}, "result": [[0.0310498405, 0.031058111, 0.0310702075], 0, 1.1751370429992676, 1684252450.589306], "version": 0.2, "tvm_version": "0.13.dev0"}
{"input": ["cuda -keys=cuda,gpu -arch=sm_75 -max_num_threads=1024 -thread_warp_size=32", "template_matmul", [900, 800, 700, [1, 16, 32, 48, 64, 80, 96, 112, 128], "cuda", "float32"], {}], "config": {"index": 3447, "code_hash": null, "entity": [["tile_i", "ot", 1], ["tile_j", "ot", 80], ["tile_k", "ot", 96], ["order", "ot", 4]]}, "result": [[0.1640213315, 0.16402333049999998, 0.164902908], 0, 2.639594316482544, 1684252452.8975747], "version": 0.2, "tvm_version": "0.13.dev0"}
{"input": ["cuda -keys=cuda,gpu -arch=sm_75 -max_num_threads=1024 -thread_warp_size=32", "template_matmul", [900, 800, 700, [1, 16, 32, 48, 64, 80, 96, 112, 128], "cuda", "float32"], {}], "config": {"index": 414, "code_hash": null, "entity": [["tile_i", "ot", 1], ["tile_j", "ot", 16], ["tile_k", "ot", 80], ["order", "ot", 0]]}, "result": [[0.0872886425, 0.0872905575, 0.0873041915], 0, 1.7909018993377686, 1684252454.340373], "version": 0.2, "tvm_version": "0.13.dev0"}
{"input": ["cuda -keys=cuda,gpu -arch=sm_75 -max_num_threads=1024 -thread_warp_size=32", "template_matmul", [900, 800, 700, [1, 16, 32, 48, 64, 80, 96, 112, 128], "cuda", "float32"], {}], "config": {"index": 2438, "code_hash": null, "entity": [["tile_i", "ot", 128], ["tile_j", "ot", 1], ["tile_k", "ot", 48], ["order", "ot", 3]]}, "result": [[0.0102361755, 0.01024392, 0.010300815500000001], 0, 0.929785966873169, 1684252455.461795], "version": 0.2, "tvm_version": "0.13.dev0"}
{"input": ["cuda -keys=cuda,gpu -arch=sm_75 -max_num_threads=1024 -thread_warp_size=32", "template_matmul", [900, 800, 700, [1, 16, 32, 48, 64, 80, 96, 112, 128], "cuda", "float32"], {}], "config": {"index": 3004, "code_hash": null, "entity": [["tile_i", "ot", 112], ["tile_j", "ot", 1], ["tile_k", "ot", 16], ["order", "ot", 4]]}, "result": [[0.031168512, 0.032233089, 0.035340816], 0, 1.2360036373138428, 1684252456.320823], "version": 0.2, "tvm_version": "0.13.dev0"}
{"input": ["cuda -keys=cuda,gpu -arch=sm_75 -max_num_threads=1024 -thread_warp_size=32", "template_matmul", [900, 800, 700, [1, 16, 32, 48, 64, 80, 96, 112, 128], "cuda", "float32"], {}], "config": {"index": 3420, "code_hash": null, "entity": [["tile_i", "ot", 1], ["tile_j", "ot", 32], ["tile_k", "ot", 96], ["order", "ot", 4]]}, "result": [[0.142222183, 0.1422807005, 0.14232081600000002], 0, 2.3970487117767334, 1684252458.3723943], "version": 0.2, "tvm_version": "0.13.dev0"}
{"input": ["cuda -keys=cuda,gpu -arch=sm_75 -max_num_threads=1024 -thread_warp_size=32", "template_matmul", [900, 800, 700, [1, 16, 32, 48, 64, 80, 96, 112, 128], "cuda", "float32"], {}], "config": {"index": 489, "code_hash": null, "entity": [["tile_i", "ot", 48], ["tile_j", "ot", 1], ["tile_k", "ot", 96], ["order", "ot", 0]]}, "result": [[0.0141456315, 0.014336, 0.0143368955], 0, 1.0392601490020752, 1684252459.0364459], "version": 0.2, "tvm_version": "0.13.dev0"}
{"input": ["cuda -keys=cuda,gpu -arch=sm_75 -max_num_threads=1024 -thread_warp_size=32", "template_matmul", [900, 800, 700, [1, 16, 32, 48, 64, 80, 96, 112, 128], "cuda", "float32"], {}], "config": {"index": 3246, "code_hash": null, "entity": [["tile_i", "ot", 96], ["tile_j", "ot", 1], ["tile_k", "ot", 64], ["order", "ot", 4]]}, "result": [[0.0290823685, 0.0290864635, 0.029121231], 0, 1.1899547576904297, 1684252459.8423321], "version": 0.2, "tvm_version": "0.13.dev0"}
{"input": ["cuda -keys=cuda,gpu -arch=sm_75 -max_num_threads=1024 -thread_warp_size=32", "template_matmul", [900, 800, 700, [1, 16, 32, 48, 64, 80, 96, 112, 128], "cuda", "float32"], {}], "config": {"index": 1908, "code_hash": null, "entity": [["tile_i", "ot", 1], ["tile_j", "ot", 80], ["tile_k", "ot", 80], ["order", "ot", 2]]}, "result": [[0.115400238, 0.115409149, 0.115456352], 0, 2.1018364429473877, 1684252462.1049151], "version": 0.2, "tvm_version": "0.13.dev0"}
{"input": ["cuda -keys=cuda,gpu -arch=sm_75 -max_num_threads=1024 -thread_warp_size=32", "template_matmul", [900, 800, 700, [1, 16, 32, 48, 64, 80, 96, 112, 128], "cuda", "float32"], {}], "config": {"index": 892, "code_hash": null, "entity": [["tile_i", "ot", 16], ["tile_j", "ot", 1], ["tile_k", "ot", 32], ["order", "ot", 1]]}, "result": [[0.009333679999999999, 0.009346719500000001, 0.009357312], 0, 0.9770615100860596, 1684252462.7066464], "version": 0.2, "tvm_version": "0.13.dev0"}
{"input": ["cuda -keys=cuda,gpu -arch=sm_75 -max_num_threads=1024 -thread_warp_size=32", "template_matmul", [900, 800, 700, [1, 16, 32, 48, 64, 80, 96, 112, 128], "cuda", "float32"], {}], "config": {"index": 1071, "code_hash": null, "entity": [["tile_i", "ot", 1], ["tile_j", "ot", 32], ["tile_k", "ot", 64], ["order", "ot", 1]]}, "result": [[0.1163740765, 0.1164346235, 0.1183159025], 0, 2.1697733402252197, 1684252464.5173297], "version": 0.2, "tvm_version": "0.13.dev0"}
{"input": ["cuda -keys=cuda,gpu -arch=sm_75 -max_num_threads=1024 -thread_warp_size=32", "template_matmul", [900, 800, 700, [1, 16, 32, 48, 64, 80, 96, 112, 128], "cuda", "float32"], {}], "config": {"index": 2352, "code_hash": null, "entity": [["tile_i", "ot", 48], ["tile_j", "ot", 1], ["tile_k", "ot", 32], ["order", "ot", 3]]}, "result": [[0.011150895999999999, 0.0111822395, 0.0111978235], 0, 0.9786951541900635, 1684252465.6450264], "version": 0.2, "tvm_version": "0.13.dev0"}
{"input": ["cuda -keys=cuda,gpu -arch=sm_75 -max_num_threads=1024 -thread_warp_size=32", "template_matmul", [900, 800, 700, [1, 16, 32, 48, 64, 80, 96, 112, 128], "cuda", "float32"], {}], "config": {"index": 2600, "code_hash": null, "entity": [["tile_i", "ot", 128], ["tile_j", "ot", 1], ["tile_k", "ot", 80], ["order", "ot", 3]]}, "result": [[0.0105891835, 0.010591231999999999, 0.0106064955], 0, 0.9743924140930176, 1684252466.2568204], "version": 0.2, "tvm_version": "0.13.dev0"}
{"input": ["cuda -keys=cuda,gpu -arch=sm_75 -max_num_threads=1024 -thread_warp_size=32", "template_matmul", [900, 800, 700, [1, 16, 32, 48, 64, 80, 96, 112, 128], "cuda", "float32"], {}], "config": {"index": 2287, "code_hash": null, "entity": [["tile_i", "ot", 16], ["tile_j", "ot", 32], ["tile_k", "ot", 16], ["order", "ot", 3]]}, "result": [[0.0045054875000000005, 0.00451304, 0.0045141115], 0, 0.9287986755371094, 1684252466.809865], "version": 0.2, "tvm_version": "0.13.dev0"}
{"input": ["cuda -keys=cuda,gpu -arch=sm_75 -max_num_threads=1024 -thread_warp_size=32", "template_matmul", [900, 800, 700, [1, 16, 32, 48, 64, 80, 96, 112, 128], "cuda", "float32"], {}], "config": {"index": 2889, "code_hash": null, "entity": [["tile_i", "ot", 1], ["tile_j", "ot", 96], ["tile_k", "ot", 128], ["order", "ot", 3]]}, "result": [[0.1203333585, 0.1203630065, 0.1203881145], 0, 2.201462507247925, 1684252468.623861], "version": 0.2, "tvm_version": "0.13.dev0"}
{"input": ["cuda -keys=cuda,gpu -arch=sm_75 -max_num_threads=1024 -thread_warp_size=32", "template_matmul", [900, 800, 700, [1, 16, 32, 48, 64, 80, 96, 112, 128], "cuda", "float32"], {}], "config": {"index": 1216, "code_hash": null, "entity": [["tile_i", "ot", 16], ["tile_j", "ot", 1], ["tile_k", "ot", 96], ["order", "ot", 1]]}, "result": [[0.035844097, 0.0358468625, 0.035850238500000006], 0, 1.2482545375823975, 1684252469.5067642], "version": 0.2, "tvm_version": "0.13.dev0"}
{"input": ["cuda -keys=cuda,gpu -arch=sm_75 -max_num_threads=1024 -thread_warp_size=32", "template_matmul", [900, 800, 700, [1, 16, 32, 48, 64, 80, 96, 112, 128], "cuda", "float32"], {}], "config": {"index": 3168, "code_hash": null, "entity": [["tile_i", "ot", 1], ["tile_j", "ot", 16], ["tile_k", "ot", 48], ["order", "ot", 4]]}, "result": [[0.1157897105, 0.1157913585, 0.1157984615], 0, 2.1192190647125244, 1684252471.2782242], "version": 0.2, "tvm_version": "0.13.dev0"}
{"input": ["cuda -keys=cuda,gpu -arch=sm_75 -max_num_threads=1024 -thread_warp_size=32", "template_matmul", [900, 800, 700, [1, 16, 32, 48, 64, 80, 96, 112, 128], "cuda", "float32"], {}], "config": {"index": 3244, "code_hash": null, "entity": [["tile_i", "ot", 64], ["tile_j", "ot", 1], ["tile_k", "ot", 64], ["order", "ot", 4]]}, "result": [[0.0281722885, 0.0281783195, 0.028197839500000002], 0, 1.0949180126190186, 1684252472.5404344], "version": 0.2, "tvm_version": "0.13.dev0"}
{"input": ["cuda -keys=cuda,gpu -arch=sm_75 -max_num_threads=1024 -thread_warp_size=32", "template_matmul", [900, 800, 700, [1, 16, 32, 48, 64, 80, 96, 112, 128], "cuda", "float32"], {}], "config": {"index": 2268, "code_hash": null, "entity": [["tile_i", "ot", 1], ["tile_j", "ot", 1], ["tile_k", "ot", 16], ["order", "ot", 3]]}, "result": [[0.09652426900000001, 0.09653769649999999, 0.096551933], 0, 1.8717525005340576, 1684252474.103425], "version": 0.2, "tvm_version": "0.13.dev0"}
{"input": ["cuda -keys=cuda,gpu -arch=sm_75 -max_num_threads=1024 -thread_warp_size=32", "template_matmul", [900, 800, 700, [1, 16, 32, 48, 64, 80, 96, 112, 128], "cuda", "float32"], {}], "config": {"index": 336, "code_hash": null, "entity": [["tile_i", "ot", 48], ["tile_j", "ot", 16], ["tile_k", "ot", 64], ["order", "ot", 0]]}, "result": [[0.012754816, 0.0127551355, 0.01275584], 0, 1.0201053619384766, 1684252474.7539835], "version": 0.2, "tvm_version": "0.13.dev0"}
{"input": ["cuda -keys=cuda,gpu -arch=sm_75 -max_num_threads=1024 -thread_warp_size=32", "template_matmul", [900, 800, 700, [1, 16, 32, 48, 64, 80, 96, 112, 128], "cuda", "float32"], {}], "config": {"index": 496, "code_hash": null, "entity": [["tile_i", "ot", 16], ["tile_j", "ot", 16], ["tile_k", "ot", 96], ["order", "ot", 0]]}, "result": [[0.011188783499999999, 0.011189247999999999, 0.011250880000000001], 0, 0.9435482025146484, 1684252475.8638182], "version": 0.2, "tvm_version": "0.13.dev0"}
{"input": ["cuda -keys=cuda,gpu -arch=sm_75 -max_num_threads=1024 -thread_warp_size=32", "template_matmul", [900, 800, 700, [1, 16, 32, 48, 64, 80, 96, 112, 128], "cuda", "float32"], {}], "config": {"index": 1378, "code_hash": null, "entity": [["tile_i", "ot", 16], ["tile_j", "ot", 1], ["tile_k", "ot", 128], ["order", "ot", 1]]}, "result": [[0.0360425105, 0.036046623, 0.0369662895], 0, 1.2531888484954834, 1684252476.7656953], "version": 0.2, "tvm_version": "0.13.dev0"}
{"input": ["cuda -keys=cuda,gpu -arch=sm_75 -max_num_threads=1024 -thread_warp_size=32", "template_matmul", [900, 800, 700, [1, 16, 32, 48, 64, 80, 96, 112, 128], "cuda", "float32"], {}], "config": {"index": 1955, "code_hash": null, "entity": [["tile_i", "ot", 32], ["tile_j", "ot", 16], ["tile_k", "ot", 96], ["order", "ot", 2]]}, "result": [[0.009779311999999998, 0.0098027035, 0.009824064], 0, 0.9731659889221191, 1684252477.367567], "version": 0.2, "tvm_version": "0.13.dev0"}
{"input": ["cuda -keys=cuda,gpu -arch=sm_75 -max_num_threads=1024 -thread_warp_size=32", "template_matmul", [900, 800, 700, [1, 16, 32, 48, 64, 80, 96, 112, 128], "cuda", "float32"], {}], "config": {"index": 1405, "code_hash": null, "entity": [["tile_i", "ot", 16], ["tile_j", "ot", 48], ["tile_k", "ot", 128], ["order", "ot", 1]]}, "result": [[0.012851072, 0.012856320000000001, 0.012872624000000001], 0, 1.0612781047821045, 1684252478.5836167], "version": 0.2, "tvm_version": "0.13.dev0"}
{"input": ["cuda -keys=cuda,gpu -arch=sm_75 -max_num_threads=1024 -thread_warp_size=32", "template_matmul", [900, 800, 700, [1, 16, 32, 48, 64, 80, 96, 112, 128], "cuda", "float32"], {}], "config": {"index": 199, "code_hash": null, "entity": [["tile_i", "ot", 16], ["tile_j", "ot", 64], ["tile_k", "ot", 32], ["order", "ot", 0]]}, "result": [[0.011542752, 0.011551744, 0.0115779835], 0, 0.9836077690124512, 1684252479.2106729], "version": 0.2, "tvm_version": "0.13.dev0"}
{"input": ["cuda -keys=cuda,gpu -arch=sm_75 -max_num_threads=1024 -thread_warp_size=32", "template_matmul", [900, 800, 700, [1, 16, 32, 48, 64, 80, 96, 112, 128], "cuda", "float32"], {}], "config": {"index": 3728, "code_hash": null, "entity": [["tile_i", "ot", 32], ["tile_j", "ot", 1], ["tile_k", "ot", 16], ["order", "ot", 5]]}, "result": [[0.0534487035, 0.0534640655, 0.053711872], 0, 1.4562158584594727, 1684252480.3247135], "version": 0.2, "tvm_version": "0.13.dev0"}
{"input": ["cuda -keys=cuda,gpu -arch=sm_75 -max_num_threads=1024 -thread_warp_size=32", "template_matmul", [900, 800, 700, [1, 16, 32, 48, 64, 80, 96, 112, 128], "cuda", "float32"], {}], "config": {"index": 4297, "code_hash": null, "entity": [["tile_i", "ot", 64], ["tile_j", "ot", 1], ["tile_k", "ot", 128], ["order", "ot", 5]]}, "result": [[0.0297223205, 0.029728767, 0.0297333125], 0, 1.2021677494049072, 1684252481.1516364], "version": 0.2, "tvm_version": "0.13.dev0"}
{"input": ["cuda -keys=cuda,gpu -arch=sm_75 -max_num_threads=1024 -thread_warp_size=32", "template_matmul", [900, 800, 700, [1, 16, 32, 48, 64, 80, 96, 112, 128], "cuda", "float32"], {}], "config": {"index": 3384, "code_hash": null, "entity": [["tile_i", "ot", 1], ["tile_j", "ot", 112], ["tile_k", "ot", 80], ["order", "ot", 4]]}, "result": [[0.192960449, 0.1929743345, 0.19304887350000002], 0, 3.0336689949035645, 1684252483.77682], "version": 0.2, "tvm_version": "0.13.dev0"}
{"input": ["cuda -keys=cuda,gpu -arch=sm_75 -max_num_threads=1024 -thread_warp_size=32", "template_matmul", [900, 800, 700, [1, 16, 32, 48, 64, 80, 96, 112, 128], "cuda", "float32"], {}], "config": {"index": 531, "code_hash": null, "entity": [["tile_i", "ot", 1], ["tile_j", "ot", 80], ["tile_k", "ot", 96], ["order", "ot", 0]]}, "result": [[0.116591522, 0.11659639699999999, 0.11659923550000001], 0, 2.148163318634033, 1684252486.0459983], "version": 0.2, "tvm_version": "0.13.dev0"}
{"input": ["cuda -keys=cuda,gpu -arch=sm_75 -max_num_threads=1024 -thread_warp_size=32", "template_matmul", [900, 800, 700, [1, 16, 32, 48, 64, 80, 96, 112, 128], "cuda", "float32"], {}], "config": {"index": 3034, "code_hash": null, "entity": [["tile_i", "ot", 16], ["tile_j", "ot", 64], ["tile_k", "ot", 16], ["order", "ot", 4]]}, "result": [[0.038022705000000004, 0.038070270499999996, 0.038071296500000004], 0, 1.2578589916229248, 1684252486.96719], "version": 0.2, "tvm_version": "0.13.dev0"}
{"input": ["cuda -keys=cuda,gpu -arch=sm_75 -max_num_threads=1024 -thread_warp_size=32", "template_matmul", [900, 800, 700, [1, 16, 32, 48, 64, 80, 96, 112, 128], "cuda", "float32"], {}], "config": {"index": 3277, "code_hash": null, "entity": [["tile_i", "ot", 16], ["tile_j", "ot", 64], ["tile_k", "ot", 64], ["order", "ot", 4]]}, "result": [[0.043813727999999996, 0.043903137, 0.0444760165], 0, 1.325895071029663, 1684252487.9515898], "version": 0.2, "tvm_version": "0.13.dev0"}
{"input": ["cuda -keys=cuda,gpu -arch=sm_75 -max_num_threads=1024 -thread_warp_size=32", "template_matmul", [900, 800, 700, [1, 16, 32, 48, 64, 80, 96, 112, 128], "cuda", "float32"], {}], "config": {"index": 1467, "code_hash": null, "entity": [["tile_i", "ot", 1], ["tile_j", "ot", 16], ["tile_k", "ot", 1], ["order", "ot", 2]]}, "result": [[0.087283073, 0.08729052699999999, 0.0872933425], 0, 1.8125975131988525, 1684252489.4048681], "version": 0.2, "tvm_version": "0.13.dev0"}
{"input": ["cuda -keys=cuda,gpu -arch=sm_75 -max_num_threads=1024 -thread_warp_size=32", "template_matmul", [900, 800, 700, [1, 16, 32, 48, 64, 80, 96, 112, 128], "cuda", "float32"], {}], "config": {"index": 4232, "code_hash": null, "entity": [["tile_i", "ot", 32], ["tile_j", "ot", 32], ["tile_k", "ot", 112], ["order", "ot", 5]]}, "result": [[0.037272575, 0.0372787055, 0.0373114735], 0, 1.2794525623321533, 1684252490.312028], "version": 0.2, "tvm_version": "0.13.dev0"}
{"input": ["cuda -keys=cuda,gpu -arch=sm_75 -max_num_threads=1024 -thread_warp_size=32", "template_matmul", [900, 800, 700, [1, 16, 32, 48, 64, 80, 96, 112, 128], "cuda", "float32"], {}], "config": {"index": 3276, "code_hash": null, "entity": [["tile_i", "ot", 1], ["tile_j", "ot", 64], ["tile_k", "ot", 64], ["order", "ot", 4]]}, "result": [[0.1459509275, 0.1459841915, 0.145984573], 0, 2.4027364253997803, 1684252492.89686], "version": 0.2, "tvm_version": "0.13.dev0"}
{"input": ["cuda -keys=cuda,gpu -arch=sm_75 -max_num_threads=1024 -thread_warp_size=32", "template_matmul", [900, 800, 700, [1, 16, 32, 48, 64, 80, 96, 112, 128], "cuda", "float32"], {}], "config": {"index": 2207, "code_hash": null, "entity": [["tile_i", "ot", 32], ["tile_j", "ot", 32], ["tile_k", "ot", 1], ["order", "ot", 3]]}, "result": [[0.0098590715, 0.009871248, 0.009893216], 0, 0.9519510269165039, 1684252493.5029347], "version": 0.2, "tvm_version": "0.13.dev0"}
{"input": ["cuda -keys=cuda,gpu -arch=sm_75 -max_num_threads=1024 -thread_warp_size=32", "template_matmul", [900, 800, 700, [1, 16, 32, 48, 64, 80, 96, 112, 128], "cuda", "float32"], {}], "config": {"index": 2599, "code_hash": null, "entity": [["tile_i", "ot", 112], ["tile_j", "ot", 1], ["tile_k", "ot", 80], ["order", "ot", 3]]}, "result": [[0.011913408, 0.011935744, 0.011962032000000001], 0, 0.9826054573059082, 1684252494.128166], "version": 0.2, "tvm_version": "0.13.dev0"}
{"input": ["cuda -keys=cuda,gpu -arch=sm_75 -max_num_threads=1024 -thread_warp_size=32", "template_matmul", [900, 800, 700, [1, 16, 32, 48, 64, 80, 96, 112, 128], "cuda", "float32"], {}], "config": {"index": 1464, "code_hash": null, "entity": [["tile_i", "ot", 96], ["tile_j", "ot", 1], ["tile_k", "ot", 1], ["order", "ot", 2]]}, "result": [[0.0109226875, 0.010928799500000001, 0.010948016000000001], 0, 0.9321911334991455, 1684252494.7302983], "version": 0.2, "tvm_version": "0.13.dev0"}
{"input": ["cuda -keys=cuda,gpu -arch=sm_75 -max_num_threads=1024 -thread_warp_size=32", "template_matmul", [900, 800, 700, [1, 16, 32, 48, 64, 80, 96, 112, 128], "cuda", "float32"], {}], "config": {"index": 2044, "code_hash": null, "entity": [["tile_i", "ot", 16], ["tile_j", "ot", 32], ["tile_k", "ot", 112], ["order", "ot", 2]]}, "result": [[0.0116138715, 0.011621904, 0.011641856], 0, 0.9950258731842041, 1684252495.3464706], "version": 0.2, "tvm_version": "0.13.dev0"}
{"input": ["cuda -keys=cuda,gpu -arch=sm_75 -max_num_threads=1024 -thread_warp_size=32", "template_matmul", [900, 800, 700, [1, 16, 32, 48, 64, 80, 96, 112, 128], "cuda", "float32"], {}], "config": {"index": 3889, "code_hash": null, "entity": [["tile_i", "ot", 16], ["tile_j", "ot", 1], ["tile_k", "ot", 48], ["order", "ot", 5]]}, "result": [[0.098910049, 0.098955055, 0.09898291000000001], 0, 1.8897500038146973, 1684252497.4124577], "version": 0.2, "tvm_version": "0.13.dev0"}
{"input": ["cuda -keys=cuda,gpu -arch=sm_75 -max_num_threads=1024 -thread_warp_size=32", "template_matmul", [900, 800, 700, [1, 16, 32, 48, 64, 80, 96, 112, 128], "cuda", "float32"], {}], "config": {"index": 494, "code_hash": null, "entity": [["tile_i", "ot", 128], ["tile_j", "ot", 1], ["tile_k", "ot", 96], ["order", "ot", 0]]}, "result": [[0.0122923675, 0.012404591500000001, 0.0124336], 0, 1.0107941627502441, 1684252498.0653932], "version": 0.2, "tvm_version": "0.13.dev0"}
{"input": ["cuda -keys=cuda,gpu -arch=sm_75 -max_num_threads=1024 -thread_warp_size=32", "template_matmul", [900, 800, 700, [1, 16, 32, 48, 64, 80, 96, 112, 128], "cuda", "float32"], {}], "config": {"index": 2512, "code_hash": null, "entity": [["tile_i", "ot", 16], ["tile_j", "ot", 1], ["tile_k", "ot", 64], ["order", "ot", 3]]}, "result": [[0.035560577, 0.035571342, 0.035573470999999995], 0, 1.2189996242523193, 1684252498.95147], "version": 0.2, "tvm_version": "0.13.dev0"}
{"input": ["cuda -keys=cuda,gpu -arch=sm_75 -max_num_threads=1024 -thread_warp_size=32", "template_matmul", [900, 800, 700, [1, 16, 32, 48, 64, 80, 96, 112, 128], "cuda", "float32"], {}], "config": {"index": 170, "code_hash": null, "entity": [["tile_i", "ot", 128], ["tile_j", "ot", 1], ["tile_k", "ot", 32], ["order", "ot", 0]]}, "result": [[0.010163199999999999, 0.0101650235, 0.010190848], 0, 0.9472918510437012, 1684252499.5685484], "version": 0.2, "tvm_version": "0.13.dev0"}
{"input": ["cuda -keys=cuda,gpu -arch=sm_75 -max_num_threads=1024 -thread_warp_size=32", "template_matmul", [900, 800, 700, [1, 16, 32, 48, 64, 80, 96, 112, 128], "cuda", "float32"], {}], "config": {"index": 2598, "code_hash": null, "entity": [["tile_i", "ot", 96], ["tile_j", "ot", 1], ["tile_k", "ot", 80], ["order", "ot", 3]]}, "result": [[0.010926128, 0.010935968, 0.010940624], 0, 0.9712526798248291, 1684252500.6823907], "version": 0.2, "tvm_version": "0.13.dev0"}
{"input": ["cuda -keys=cuda,gpu -arch=sm_75 -max_num_threads=1024 -thread_warp_size=32", "template_matmul", [900, 800, 700, [1, 16, 32, 48, 64, 80, 96, 112, 128], "cuda", "float32"], {}], "config": {"index": 2377, "code_hash": null, "entity": [["tile_i", "ot", 16], ["tile_j", "ot", 48], ["tile_k", "ot", 32], ["order", "ot", 3]]}, "result": [[0.01246504, 0.0124656635, 0.0125040635], 0, 1.0159273147583008, 1684252501.3368683], "version": 0.2, "tvm_version": "0.13.dev0"}
{"input": ["cuda -keys=cuda,gpu -arch=sm_75 -max_num_threads=1024 -thread_warp_size=32", "template_matmul", [900, 800, 700, [1, 16, 32, 48, 64, 80, 96, 112, 128], "cuda", "float32"], {}], "config": {"index": 1142, "code_hash": null, "entity": [["tile_i", "ot", 128], ["tile_j", "ot", 1], ["tile_k", "ot", 80], ["order", "ot", 1]]}, "result": [[0.0105779195, 0.010588879499999999, 0.0106004475], 0, 0.9917805194854736, 1684252501.9541125], "version": 0.2, "tvm_version": "0.13.dev0"}
{"input": ["cuda -keys=cuda,gpu -arch=sm_75 -max_num_threads=1024 -thread_warp_size=32", "template_matmul", [900, 800, 700, [1, 16, 32, 48, 64, 80, 96, 112, 128], "cuda", "float32"], {}], "config": {"index": 1542, "code_hash": null, "entity": [["tile_i", "ot", 48], ["tile_j", "ot", 1], ["tile_k", "ot", 16], ["order", "ot", 2]]}, "result": [[0.010865327499999999, 0.010911487499999999, 0.0109423195], 0, 0.9884347915649414, 1684252502.5821066], "version": 0.2, "tvm_version": "0.13.dev0"}
{"input": ["cuda -keys=cuda,gpu -arch=sm_75 -max_num_threads=1024 -thread_warp_size=32", "template_matmul", [900, 800, 700, [1, 16, 32, 48, 64, 80, 96, 112, 128], "cuda", "float32"], {}], "config": {"index": 3996, "code_hash": null, "entity": [["tile_i", "ot", 1], ["tile_j", "ot", 48], ["tile_k", "ot", 64], ["order", "ot", 5]]}, "result": [[0.1385720825, 0.138584976, 0.138594345], 0, 2.3672821521759033, 1684252504.6133592], "version": 0.2, "tvm_version": "0.13.dev0"}
{"input": ["cuda -keys=cuda,gpu -arch=sm_75 -max_num_threads=1024 -thread_warp_size=32", "template_matmul", [900, 800, 700, [1, 16, 32, 48, 64, 80, 96, 112, 128], "cuda", "float32"], {}], "config": {"index": 1062, "code_hash": null, "entity": [["tile_i", "ot", 1], ["tile_j", "ot", 16], ["tile_k", "ot", 64], ["order", "ot", 1]]}, "result": [[0.1004610745, 0.10066979200000001, 0.100986877], 0, 1.9080965518951416, 1684252506.6576104], "version": 0.2, "tvm_version": "0.13.dev0"}
{"input": ["cuda -keys=cuda,gpu -arch=sm_75 -max_num_threads=1024 -thread_warp_size=32", "template_matmul", [900, 800, 700, [1, 16, 32, 48, 64, 80, 96, 112, 128], "cuda", "float32"], {}], "config": {"index": 4266, "code_hash": null, "entity": [["tile_i", "ot", 1], ["tile_j", "ot", 96], ["tile_k", "ot", 112], ["order", "ot", 5]]}, "result": [[0.1691034085, 0.16912512200000002, 0.1691630705], 0, 2.675569534301758, 1684252509.0331748], "version": 0.2, "tvm_version": "0.13.dev0"}
